url,title,release_date,platforms,description,developers,publishers,genres,esrb
https://www.gamespot.com/games/robotech-invasion/,Robotech: Invasion,"Oct 5, 2004","PlayStation 2, Xbox",Robotech: Invasion's single-player campaign still suffers from the same bland gameplay and mission design that plagued its predecessor.,Vicious Cycle,Global Star Software,"Action, First-Person, Shooter, 3D",Teen
https://www.gamespot.com/games/dreamworks-shark-tale/,DreamWorks Shark Tale,"Sep 27, 2004","GameCube, PC, PlayStation 2, Xbox","Shark Tale integrates a fair amount of footage, music, and dialogue from the movie it's based on, but the pleasant surprise here is the sheer variety of different levels the game includes.","Edge of Reality, Amaze Entertainment","Activision, Taito Corporation","Action, 3D, Platformer",Everyone
https://www.gamespot.com/games/dreamworks-shark-tale/,DreamWorks Shark Tale,"Sep 27, 2004","GameCube, PC, PlayStation 2, Xbox","Shark Tale integrates a fair amount of footage, music, and dialogue from the movie it's based on, but the pleasant surprise here is the sheer variety of different levels the game includes.","Edge of Reality, Amaze Entertainment","Activision, Taito Corporation","Action, 3D, Platformer",Everyone
https://www.gamespot.com/games/dreamworks-shark-tale/,DreamWorks Shark Tale,"Sep 27, 2004","GameCube, PC, PlayStation 2, Xbox","Shark Tale integrates a fair amount of footage, music, and dialogue from the movie it's based on, but the pleasant surprise here is the sheer variety of different levels the game includes.","Edge of Reality, Amaze Entertainment","Activision, Taito Corporation","Action, 3D, Platformer",Everyone
https://www.gamespot.com/games/platoon-2004/,Platoon (2004),"Dec 4, 2004",Mobile,Shoddy controls and confusing goals make Platoon less than fun to play.,I-Play,I-Play,Action,
https://www.gamespot.com/games/wanted-a-wild-western-adventure/,Wanted: A Wild Western Adventure,"Oct 3, 2004","iOS (iPhone/iPad), PC, Wii",Fans of old-school adventures who can put up with a lot of problems should find Wanted reasonably entertaining.,"casualbrothers, Revistronic","casualbrothers, Focus Home Interactive, Casual Brothers, The Adventure Company, DreamCatcher Interactive, Peter Games, Revistronic",Adventure,Everyone
https://www.gamespot.com/games/bloodrayne-2/,BloodRayne 2,"Oct 12, 2004","Nintendo Switch, PC, PlayStation 2, PlayStation 4, PlayStation 5, Xbox, Xbox One",Underneath BloodRayne 2's problems is a stylish and gory action game with enough kills and thrills to keep you entertained.,"Ziggurat Interactive, Terminal Reality","Ziggurat Interactive, Majesco Games, SCEA, THQ","3D, Action, Shooter, Third-Person",Mature
https://www.gamespot.com/games/bloodrayne-2/,BloodRayne 2,"Oct 12, 2004","Nintendo Switch, PC, PlayStation 2, PlayStation 4, PlayStation 5, Xbox, Xbox One",Underneath BloodRayne 2's problems is a stylish and gory action game with enough kills and thrills to keep you entertained.,"Ziggurat Interactive, Terminal Reality","Ziggurat Interactive, Majesco Games, SCEA, THQ","3D, Action, Shooter, Third-Person",Mature
https://www.gamespot.com/games/rolling-stone-20-questions/,Rolling Stone 20 Questions,October 2004,Mobile,Rolling Stone 20 Questions delivers nicely focused music trivia while breaking up the questions in such a way that you won't see repeats.,Dwango Wireless,Dwango Wireless,Trivia/Board Game,
https://www.gamespot.com/games/conflict-vietnam/,Conflict: Vietnam,"Sep 10, 2004","Mobile, PC, PlayStation 2, Xbox","A solidly average game whose few original ideas are compromised by screwy controls, some pacing problems, and a punishing save-game system.","8bit Games, Pivotal Games","Synergenix, Global Star Software, Sold Out Software, SCi, Square Enix","Third-Person, 3D, Action, Shooter",Mature
https://www.gamespot.com/games/conflict-vietnam/,Conflict: Vietnam,"Sep 10, 2004","Mobile, PC, PlayStation 2, Xbox","A solidly average game whose few original ideas are compromised by screwy controls, some pacing problems, and a punishing save-game system.","8bit Games, Pivotal Games","Synergenix, Sold Out Software, SCi, Global Star Software, Square Enix","Third-Person, 3D, Action, Shooter",Mature
https://www.gamespot.com/games/ms-pac-man-maze-madness/,Ms. Pac-Man Maze Madness,"Sep 8, 2000","Dreamcast, Game Boy Advance, Nintendo 64, PlayStation","While Maze Madness may be overly easy for experienced gamers, the younger crowd and inexperienced gamers should have loads of fun with the game.","Mass Media, Full Fat, Namco","Namco, Zoo Digital Publishing, Bandai Namco Games, SCEE",Action,Everyone
https://www.gamespot.com/games/midway-arcade-treasures-2/,Midway Arcade Treasures 2,"Oct 11, 2004","GameCube, PlayStation 2, Xbox","The games here tend to hold up pretty well, and for the most part, they're very close to the arcade originals.",Backbone Entertainment,Midway,Compilation,Mature
https://www.gamespot.com/games/svc-chaos-snk-vs-capcom/,SVC Chaos: SNK vs. Capcom,"Nov 14, 2003","Arcade Games, Neo Geo, PlayStation 2, Xbox","Not only does SVC Chaos simply not play particularly well by the standards of 2D fighting games, but also the game's implementation of Xbox Live support is flawed.","Playmore, SNK Playmore","Sun Amusement, SNK Playmore, Ignition Entertainment","Fighting, 2D, Action",Teen
https://www.gamespot.com/games/under-the-skin/,Under the Skin,"Oct 12, 2004",PlayStation 2,"Under the Skin is built mostly on novelty, but all its quirky pieces don't really add up to a particularly compelling title.",Capcom,Capcom,"Adventure, Action",Teen
https://www.gamespot.com/games/tony-hawks-underground-2/,Tony Hawk's Underground 2 Remix,"Oct 4, 2004","Game Boy Advance, GameCube, Mobile, PC, PlayStation 2, PSP, Xbox","THUG2 hangs on to the great gameplay of the previous games, makes a few minor tweaks, and wraps it all up in a new Bam Margera-centric package.","Vicarious Visions, Neversoft Entertainment, Shaba Games","Activision, Jamdat Mobile, ak tronic","Skateboarding/Skating, Sports",Teen
https://www.gamespot.com/games/midway-arcade-treasures-2/,Midway Arcade Treasures 2,"Oct 11, 2004","GameCube, PlayStation 2, Xbox","The games here tend to hold up pretty well, and for the most part, they're very close to the arcade originals.",Backbone Entertainment,Midway,Compilation,Mature
https://www.gamespot.com/games/midway-arcade-treasures-2/,Midway Arcade Treasures 2,"Oct 11, 2004","GameCube, PlayStation 2, Xbox","The games here tend to hold up pretty well, and for the most part, they're very close to the arcade originals.",Backbone Entertainment,Midway,Compilation,Mature
https://www.gamespot.com/games/get-on-da-mic/,Get On Da Mic,"Oct 5, 2004",PlayStation 2,"This music game lets you rap along to one of more than 40 songs, while it also lets you rap in a freestyle manner.",Artificial Mind and Movement,Eidos Interactive,Music/Rhythm,Teen
https://www.gamespot.com/games/paper-mario-the-thousand-year-door/,Paper Mario: The Thousand-Year Door,"Oct 11, 2004",GameCube,"It's practically overflowing with wonderful, funny characters, memorable subplots, inventive gameplay, and beautiful visuals, and it's lengthy and quite challenging to boot.",Intelligent Systems,Nintendo,Role-Playing,Everyone
https://www.gamespot.com/games/tribes-vengeance/,Tribes: Vengeance,"Oct 12, 2004",PC,"Tribes: Vengeance effectively captures the spirit of the original game, and adds a surprisingly good single-player campaign to a deep and addictive multiplayer component.",Irrational Games,"VU Games, Sierra Entertainment","First-Person, Shooter, 3D, Action",Teen
https://www.gamespot.com/games/decisive-battles-of-wwii-battles-in-normandy/,Decisive Battles of WWII: Battles in Normandy,"Sep 13, 2004",PC,"If you like wargames and can stomach the price, Battles in Normandy definitely provides enough entertainment to earn its keep",Strategic Studies Group,Matrix Games,"Strategy, Turn-Based",
https://www.gamespot.com/games/if-racing-2/,IF Racing 2,"Sep 18, 2004",Mobile,"There's nothing here to render IF Racing Head 2 Head unplayable, but there's nothing to make it especially memorable, either.",Cybiko,In-Fusio,"Driving/Racing, Simulation",
https://www.gamespot.com/games/espn-nfl-primetime-2002/,ESPN NFL PrimeTime 2002,"Dec 2, 2001","PC, PlayStation 2, Xbox","Feeble gameplay makes PrimeTime unappealing, and the number of serious bugs that have come along for the ride make it completely unacceptable.","Farsight Technologies, Konami",Konami,"Simulation, Sports, Team-Based, Football (American)",Everyone
https://www.gamespot.com/games/asterix-and-obelix-kick-buttix/,Asterix & Obelix: Kick Buttix,"Sep 14, 2004","Game Boy Advance, GameCube, Macintosh, Nintendo Switch, PC, PlayStation 2, PlayStation 4, Xbox One",This Roman-bashing game will see you assuming the roles of both Asterix and Obelix simultaneously.,"Velez & Dubail, Etranges Libellules, OSome Studio","Atari SA, Microids, ak tronic","3D, Action, Beat-'Em-Up",Everyone
https://www.gamespot.com/games/shin-megami-tensei-nocturne/,Shin Megami Tensei: Nocturne,"Oct 12, 2004","Nintendo Switch, PC, PlayStation 2, PlayStation 4","Shin Megami Tensei: Nocturne is a refreshing, challenging change of pace.",ATLUS,"ATLUS, Sega, Ghostlight, SCEA",Role-Playing,Mature
https://www.gamespot.com/games/gish/,Gish,"Aug 2, 2004","BlackBerry, Linux, Macintosh, PC",Gish uses a well-worn genre as the launching pad for some exuberant and largely successful experimentation.,"GlobalFun, Chronic Logic","GlobalFun, Chronic Logic, GarageGames, Media House","Action, Platformer, 2D",Teen
https://www.gamespot.com/games/fox-sports-football-05/,Fox Sports Football 05,"Oct 1, 2004",Mobile,"Fox Sports Football 05 is good, but it cuts too many corners to make it your first choice for football.",Sorrent,Sorrent,"Team-Based, Arcade, Football (American), Sports",
https://www.gamespot.com/games/leisure-suit-larry-magna-cum-laude/,Leisure Suit Larry: Magna Cum Laude,"Oct 5, 2004","PC, PlayStation 2, Xbox","If you can forgive its brain-dead gameplay and occasionally frustrating design, Magna Cum Laude is a hysterically entertaining romp through a world of wacky sexual hijinks.",High Voltage Software,"VU Games, Assemble Entertainment","Third-Person, Adventure, 3D",Mature
https://www.gamespot.com/games/leisure-suit-larry-magna-cum-laude/,Leisure Suit Larry: Magna Cum Laude,"Oct 5, 2004","PC, PlayStation 2, Xbox","If you can forgive its brain-dead gameplay and occasionally frustrating design, Magna Cum Laude is a hysterically entertaining romp through a world of wacky sexual hijinks.",High Voltage Software,"VU Games, Assemble Entertainment","Adventure, 3D, Third-Person",Mature
https://www.gamespot.com/games/leisure-suit-larry-magna-cum-laude/,Leisure Suit Larry: Magna Cum Laude,"Oct 5, 2004","PC, PlayStation 2, Xbox","If you can forgive its brain-dead gameplay and occasionally frustrating design, Magna Cum Laude is a hysterically entertaining romp through a world of wacky sexual hijinks.",High Voltage Software,"VU Games, Assemble Entertainment","Adventure, 3D, Third-Person",Mature
https://www.gamespot.com/games/tom-clancys-ghost-recon-jungle-storm/,Tom Clancy's Ghost Recon: Jungle Storm,"Mar 16, 2004","Mobile, N-Gage, PlayStation 2","Jungle Storm is a decent enough vehicle for more Ghost Recon, if that's what you're after, but the franchise is really starting to show its age at this late date.","Gameloft, Red Storm Entertainment","Gameloft, Nokia, Ubisoft","Shooter, Tactical, Action, First-Person",Teen
https://www.gamespot.com/games/crash-twinsanity/,Crash Twinsanity,"Sep 28, 2004","PlayStation 2, Xbox",Players willing to look past Crash Twinsanity's faults should find a fun if somewhat familiar experience.,Traveller's Tales Oxford Studio,"Sierra Entertainment, VU Games","Action, 3D, Platformer",Everyone
https://www.gamespot.com/games/crash-twinsanity/,Crash Twinsanity,"Sep 28, 2004","PlayStation 2, Xbox",Players willing to look past Crash Twinsanity's faults should find a fun if somewhat familiar experience.,Traveller's Tales Oxford Studio,"Sierra Entertainment, VU Games","3D, Platformer, Action",Everyone
https://www.gamespot.com/games/malice/,Malice,"Jun 2, 2004","PlayStation 2, Xbox","Unless you're absolutely rapt with morbid curiosity about how Malice ultimately turned out, your time and money are definitely best spent elsewhere.",Argonaut Games,"Mud Duck Productions, Evolved Games","Action, 3D, Platformer",Teen
https://www.gamespot.com/games/port-royale-2/,Port Royale 2,"Sep 13, 2004","Mobile, PC","Port Royale 2 might focus more on building shipping cartels than sea battles and swordplay, but its brilliantly realized design is more than just number crunching.","Elkware, Ascaron Entertainment GmbH","Elkware, Ascaron Entertainment GmbH, Strategy First, Value Software","Real-Time, Strategy",Teen
https://www.gamespot.com/games/tony-hawks-underground-2/,Tony Hawk's Underground 2 Remix,"Oct 4, 2004","Game Boy Advance, GameCube, Mobile, PC, PlayStation 2, PSP, Xbox","THUG2 hangs on to the great gameplay of the previous games, makes a few minor tweaks, and wraps it all up in a new Bam Margera-centric package.","Vicarious Visions, Neversoft Entertainment, Shaba Games","Activision, Jamdat Mobile, ak tronic","Skateboarding/Skating, Sports",Teen
https://www.gamespot.com/games/tony-hawks-underground-2/,Tony Hawk's Underground 2 Remix,"Oct 4, 2004","Game Boy Advance, GameCube, Mobile, PC, PlayStation 2, PSP, Xbox","THUG2 hangs on to the great gameplay of the previous games, makes a few minor tweaks, and wraps it all up in a new Bam Margera-centric package.","Vicarious Visions, Neversoft Entertainment, Shaba Games","Activision, Jamdat Mobile, ak tronic","Skateboarding/Skating, Sports",Teen
https://www.gamespot.com/games/tony-hawks-underground-2/,Tony Hawk's Underground 2 Remix,"Oct 4, 2004","Game Boy Advance, GameCube, Mobile, PC, PlayStation 2, PSP, Xbox","THUG2 hangs on to the great gameplay of the previous games, makes a few minor tweaks, and wraps it all up in a new Bam Margera-centric package.","Vicarious Visions, Neversoft Entertainment, Shaba Games","Activision, Jamdat Mobile, ak tronic","Skateboarding/Skating, Sports",Teen
https://www.gamespot.com/games/mortal-kombat-deception/,Mortal Kombat: Deception,"Oct 4, 2004","GameCube, PlayStation 2, PSP, Xbox","Mortal Kombat: Deception packs in some completely off-the-wall gameplay modes, but the core one-on-one fighting action--whether you play it offline or online--is easily its best part.","Midway, JGI Entertainment",Midway,"3D, Action, Fighting",Mature
https://www.gamespot.com/games/mortal-kombat-deception/,Mortal Kombat: Deception,"Oct 4, 2004","GameCube, PlayStation 2, PSP, Xbox","Mortal Kombat: Deception packs in some completely off-the-wall gameplay modes, but the core one-on-one fighting action--whether you play it offline or online--is easily its best part.","Midway, JGI Entertainment",Midway,"3D, Action, Fighting",Mature
https://www.gamespot.com/games/colin-mcrae-rally-2005/,Colin McRae Rally 2005,"Sep 28, 2004","Mobile, N-Gage, PC, PlayStation 2, PSP, Xbox","The PSP version of Colin McRae Rally 2005 features a variety of gameplay modes, wireless network play, and more.","I-Play, Ideaworks3D, Codemasters, Six by Nine","Codemasters, Nokia, Sold Out Software, Interchannel-Holon","Driving/Racing, Simulation",Everyone
https://www.gamespot.com/games/tony-hawks-underground-2/,Tony Hawk's Underground 2 Remix,"Oct 4, 2004","Game Boy Advance, GameCube, Mobile, PC, PlayStation 2, PSP, Xbox","THUG2 hangs on to the great gameplay of the previous games, makes a few minor tweaks, and wraps it all up in a new Bam Margera-centric package.","Vicarious Visions, Neversoft Entertainment, Shaba Games","Activision, Jamdat Mobile, ak tronic","Sports, Skateboarding/Skating",Teen
https://www.gamespot.com/games/mario-pinball-land/,Mario Pinball Land,"Oct 4, 2004",Game Boy Advance,Mario Pinball Land combines Mario with pinball to create an interesting kind of adventure game.,Fuse Games Limited,Nintendo,Pinball,Everyone
https://www.gamespot.com/games/rocky-legends/,Rocky: Legends,"Sep 28, 2004","PlayStation 2, Xbox","Legends is not an especially noteworthy boxing game, but for serious fans of the Rocky films, the game does have its worthwhile moments.",Venom Games,"Ubisoft, Microsoft Game Studios","Boxing, Sports",Teen
https://www.gamespot.com/games/rocky-legends/,Rocky: Legends,"Sep 28, 2004","PlayStation 2, Xbox","Legends is not an especially noteworthy boxing game, but for serious fans of the Rocky films, the game does have its worthwhile moments.",Venom Games,"Ubisoft, Microsoft Game Studios","Sports, Boxing",Teen
https://www.gamespot.com/games/espn-nba-2k5/,ESPN NBA 2K5,"Sep 28, 2004","PlayStation 2, Xbox",ESPN NBA 2K5 delivers a fantastic simulation-style basketball experience that is graphically appealing and chock-full of content.,Visual Concepts,Sega,"Team-Based, Basketball, Simulation, Sports",Everyone
https://www.gamespot.com/games/espn-nba-2k5/,ESPN NBA 2K5,"Sep 28, 2004","PlayStation 2, Xbox",ESPN NBA 2K5 delivers a fantastic simulation-style basketball experience that is graphically appealing and chock-full of content.,Visual Concepts,Sega,"Sports, Team-Based, Basketball, Simulation",Everyone
https://www.gamespot.com/games/disney-pixar-the-incredibles/,Disney/Pixar The Incredibles,"Sep 28, 2004","Game Boy Advance, GameCube, Macintosh, Mobile, PC, PlayStation 2, Xbox",The Incredibles is a fairly unremarkable experience that puts you through the motions of the film's plot without capturing any of its essence.,"Helixe, Heavy Iron Studios, Beenox, Lavastorm","THQ, D3Publisher, Disney Mobile Studios, Disney Interactive Studios, SCEA","Action, Adventure",Teen
https://www.gamespot.com/games/the-dukes-of-hazzard-return-of-the-general-lee/,The Dukes of Hazzard: Return of the General Lee,"Sep 28, 2004","PlayStation 2, Xbox","Just like the show's Sheriff Rosco P. Coltrane, this game is foiled largely by its own ineptitude.",Ratbag,Ubisoft,"Arcade, Driving/Racing",Everyone
https://www.gamespot.com/games/the-dukes-of-hazzard-return-of-the-general-lee/,The Dukes of Hazzard: Return of the General Lee,"Sep 28, 2004","PlayStation 2, Xbox","Just like the show's Sheriff Rosco P. Coltrane, this game is foiled largely by its own ineptitude.",Ratbag,Ubisoft,"Arcade, Driving/Racing",Everyone
https://www.gamespot.com/games/codename-panzers-phase-one/,"Codename: Panzers, Phase One","Sep 30, 2004",PC,"Codename: Panzers provides plenty of interesting units and destructible environments to play around with, and it contains a ton of content, resulting in an excellent real-time strategy game.",Stormregion,"cdv Software, Nordic Games Publishing","Strategy, Real-Time",Teen
https://www.gamespot.com/games/wings-of-power-wwii-heavy-bombers-and-jets/,Wings of Power: WWII Heavy Bombers and Jets,"Sep 13, 2004",PC,"If you've ever dreamed about flying any of these bombers or jets, this is as close as you can get outside of paying for a real-life flight.",Shockwave Productions,Tri Synergy,"Simulation, Flight",
https://www.gamespot.com/games/mega-man-zero-3/,Mega Man Zero 3,"Oct 5, 2004",Game Boy Advance,"If you've enjoyed Mega Man games in the past or have been waiting for one that's a little less punishing, Mega Man Zero 3 is the game to get.",Inti,Capcom,"Action, 2D, Platformer",Everyone
https://www.gamespot.com/games/tiger-woods-pga-tour-2005/,Tiger Woods PGA Tour 2005,"Sep 20, 2004","DS, GameCube, Macintosh, Mobile, PC, PlayStation 2, PSP, Xbox","Tiger Woods takes good advantage of the capabilities of the DS, and it's easily the most technically accomplished handheld golf game to date.","Sensory Sweep, EA Sports, Electronic Arts, I-Play, Headgate, EA Canada","EA Sports, Electronic Arts, Aspyr, EA Games","Golf, Sports, Simulation",Everyone
https://www.gamespot.com/games/starsky-and-hutch/,Starsky & Hutch,"Sep 9, 2003","Game Boy Advance, GameCube, PC, PlayStation 2, Xbox",What Starsky & Hutch does best is pay homage to the wonderful clichés of 1970s cop shows.,"Spellbound, Supersonic Software, Minds-Eye Productions","Empire Interactive, Gotham Games","Driving/Racing, Arcade",Teen
https://www.gamespot.com/games/dragon-edge-pinball/,Dragon Edge Pinball,"Sep 22, 2004",Mobile,"Despite all its charm, Dragon Edge Pinball's questionable ball physics unfortunately keep it short of greatness.",Bandai America Inc.,Bandai America Inc.,Pinball,
https://www.gamespot.com/games/astro-boy/,Astro Boy,"Aug 18, 2004",PlayStation 2,It would have been a more valuable homage to the life's work of Osamu Tezuka had Sonic Team simply created a better game.,Sonic Team,Sega,Action,Everyone
https://www.gamespot.com/games/arena-wars/,Arena Wars,"Sep 13, 2004",PC,"Arena Wars manages to rise above some serious problems to offer fresh, fun gameplay that can challenge you both strategically and tactically.",Ascaron Entertainment GmbH,"Tri Synergy, Ascaron Entertainment GmbH","Strategy, Real-Time",Teen
https://www.gamespot.com/games/pandemonium/,Pandemonium!,"Oct 31, 1996","iOS (iPhone/iPad), Mobile, N-Gage, PC, PlayStation, Saturn","Pandemonium doesn't have what it takes to contend with the latest 3-D action games, like Crash Bandicoot and Tomb Raider.","Eidos Interactive, Ideaworks3D, Toys for Bob","Electronic Arts, Eidos Mobile, Eidos Interactive, BMG Interactive Entertainment, Crystal Dynamics, Square Enix, SCEA, Bandai","3D, Action, Platformer",Kids to Adults
https://www.gamespot.com/games/nba-live-2005/,NBA Live 2005,"Sep 28, 2004","GameCube, PC, PlayStation 2, Xbox","NBA Live 2005 plays a solid game of basketball, but even the flashy new features can't hide the fact that it isn't a huge step up from last year's edition.",EA Canada,EA Sports,"Sports, Team-Based, Basketball, Simulation",Everyone
https://www.gamespot.com/games/nba-live-2005/,NBA Live 2005,"Sep 28, 2004","GameCube, PC, PlayStation 2, Xbox","NBA Live 2005 plays a solid game of basketball, but even the flashy new features can't hide the fact that it isn't a huge step up from last year's edition.",EA Canada,EA Sports,"Sports, Team-Based, Basketball, Simulation",Everyone
https://www.gamespot.com/games/nba-live-2005/,NBA Live 2005,"Sep 28, 2004","GameCube, PC, PlayStation 2, Xbox","NBA Live 2005 plays a solid game of basketball, but even the flashy new features can't hide the fact that it isn't a huge step up from last year's edition.",EA Canada,EA Sports,"Sports, Team-Based, Basketball, Simulation",Everyone
https://www.gamespot.com/games/myst-iv-revelation/,Myst IV: Revelation,"Sep 1, 2004","Macintosh, PC, Xbox",Freely explore Myst IV's imaginative and remarkably lifelike worlds as you try to push past the game's near-impenetrable puzzle barriers.,"Cyan Worlds, Ubisoft Montreal","Ubisoft, Cyan Worlds","3D, Adventure, First-Person",Teen
https://www.gamespot.com/games/carmen-sandiego-the-secret-of-the-stolen-drums/,Carmen Sandiego: The Secret of the Stolen Drums,"Sep 8, 2004","GameCube, PlayStation 2, Xbox","Don't go into The Secret of the Stolen Drums thinking you're going to get an educational game or an enjoyable platformer, as you'll find neither here.",Artificial Mind and Movement,Bam Entertainment,"Adventure, Action",Everyone
https://www.gamespot.com/games/carmen-sandiego-the-secret-of-the-stolen-drums/,Carmen Sandiego: The Secret of the Stolen Drums,"Sep 8, 2004","GameCube, PlayStation 2, Xbox","Don't go into The Secret of the Stolen Drums thinking you're going to get an educational game or an enjoyable platformer, as you'll find neither here.",Artificial Mind and Movement,Bam Entertainment,"Adventure, Action",Everyone
https://www.gamespot.com/games/carmen-sandiego-the-secret-of-the-stolen-drums/,Carmen Sandiego: The Secret of the Stolen Drums,"Sep 8, 2004","GameCube, PlayStation 2, Xbox","Don't go into The Secret of the Stolen Drums thinking you're going to get an educational game or an enjoyable platformer, as you'll find neither here.",Artificial Mind and Movement,Bam Entertainment,"Adventure, Action",Everyone
https://www.gamespot.com/games/bad-boys-miami-takedown/,Bad Boys: Miami Takedown,"Sep 14, 2004","GameCube, PC, PlayStation 2, Xbox",Miami Takedown really only serves as a cold reminder of a past we don't want to revisit.,Blitz Games,"Empire Interactive, Crave","3D, Action, Shooter, Third-Person",Mature
https://www.gamespot.com/games/bad-boys-miami-takedown/,Bad Boys: Miami Takedown,"Sep 14, 2004","GameCube, PC, PlayStation 2, Xbox",Miami Takedown really only serves as a cold reminder of a past we don't want to revisit.,Blitz Games,"Crave, Empire Interactive","Action, Shooter, Third-Person, 3D",Mature
https://www.gamespot.com/games/bad-boys-miami-takedown/,Bad Boys: Miami Takedown,"Sep 14, 2004","GameCube, PC, PlayStation 2, Xbox",Miami Takedown really only serves as a cold reminder of a past we don't want to revisit.,Blitz Games,"Crave, Empire Interactive","Action, Shooter, Third-Person, 3D",Mature
https://www.gamespot.com/games/evil-genius/,Evil Genius,"Sep 28, 2004",PC,"Evil Genius is surprisingly successful for being so focused on style over substance, but it can also be quite frustrating at times.",Elixir Studios,"VU Games, Rebellion","Real-Time, Strategy",Teen
https://www.gamespot.com/games/zoids-legacy/,Zoids: Legacy,"Sep 15, 2004",Game Boy Advance,"The game does a masterful job of allowing players to collect and put together an army of unique and powerful robots, but it falls short at providing a cohesive or memorable role-playing experience.",Amedio,"Tomy Corporation, Atari SA",Role-Playing,Everyone
https://www.gamespot.com/games/shadow-hearts-covenant/,Shadow Hearts: Covenant,"Sep 27, 2004",PlayStation 2,Shadow Hearts: Covenant is a great game that any fan of the role-playing genre would likely enjoy.,Nautilus,"Aruze Corp, Midway",Role-Playing,Teen
