url,title,release_date,platforms,description,developers,publishers,genres,esrb
https://www.gamespot.com/games/all-star-baseball-2003/,All-Star Baseball 2003,"Feb 25, 2002","Game Boy Advance, GameCube, PlayStation 2, Xbox","All-Star Baseball 2003 is the best baseball simulation available for the Xbox, and it will satisfy hard-core fans of hardball.","Software Creations, Acclaim Studios Austin","Acclaim, Acclaim Japan","Team-Based, Baseball, Simulation, Sports",Everyone
https://www.gamespot.com/games/superpower/,SuperPower,"Mar 28, 2002",PC,SuperPower will please neither hard-core wargamers nor those just looking for an enjoyable way to conquer the world.,GolemLabs,DreamCatcher Interactive,"Strategy, Turn-Based",Everyone
https://www.gamespot.com/games/mister-mosquito/,Mister Mosquito,"Mar 12, 2002",PlayStation 2,"Mister Mosquito is a thoroughly original title that brings to a new audience, through parody, a touch of what makes Japanese culture so appealing to so many Westerners.",Zoom,"SCEI, Eidos Interactive",Action,Teen
https://www.gamespot.com/games/mad-maestro/,Mad Maestro!,"Mar 12, 2002",PlayStation 2,"While the game is both quirky and Japanese, it simply isn't compelling or challenging enough to really engage its target audience of hard-core rhythm gamers.",Desert Productions,"SCEI, Eidos Interactive",Music/Rhythm,Everyone
https://www.gamespot.com/games/baseball-advance/,Baseball Advance,"Mar 20, 2002",Game Boy Advance,Its clever design and gorgeous visuals more than compensate for any deficiency.,Smilebit,"Sega, THQ","Team-Based, Arcade, Baseball, Sports",Everyone
https://www.gamespot.com/games/real-pool-2/,Real Pool 2,"Feb 24, 2002",PC,"Real Pool 2 may offer pretty graphics, but it comes up short in so many other areas that it cannot be heartily recommended.",Groove Alliance,Infogrames,"Sports, Billiards",Everyone
https://www.gamespot.com/games/wrc-world-rally-championship/,WRC: World Rally Championship,"Mar 21, 2002",PlayStation 2,Players of all skill levels will enjoy World Rally Championship for what it is: a fun racing game with just the right amount of realism.,Evolution Studios,"Spike, SCEE, Bam Entertainment","Simulation, Driving/Racing",Everyone
https://www.gamespot.com/games/out-of-the-park-baseball-4/,Out of the Park Baseball 4,"Feb 28, 2002",PC,The game is a remarkable simulation of running a big-league franchise from the front office to the field.,Out Of The Park Developments,Out Of The Park Developments,"Simulation, Sports, Team-Based, Baseball",
https://www.gamespot.com/games/wolfenstein-3d/,Wolfenstein 3D,"May 5, 1992","3DO, Acorn Archimedes, Game Boy Advance, iOS (iPhone/iPad), Jaguar, Macintosh, Mobile, NEC PC98, Online/Browser, PC, PlayStation 3, Super Nintendo, Xbox 360",The classic first-person shooter makes an appearance on Xbox LIVE Arcade.,"Logicware, Inc., id Software, Stalker Entertainment, id Mobile, Infinity, Apogee Software, Ltd., Nerve Software","Electronic Arts Victor, Interplay, Powerslave Software, Bam Entertainment, id Software, Atari Corporation, Mumin Corp., Mac Play, Imagineer, Bethesda Softworks, Apogee Software, Ltd., GT Software, Wiz Technology, Inc, GT Interactive, Activision, Euro Power Pack","Shooter, 3D, Action, First-Person",Mature
https://www.gamespot.com/games/the-three-stooges/,The Three Stooges,"Mar 31, 2002","Game Boy Advance, PlayStation",Cinemaware brings a game starring the three classic stars of slapstick comedy.,"Cinemaware, Flying Tiger Development",Metro3D,Action,Everyone
https://www.gamespot.com/games/the-operative-no-one-lives-forever/,The Operative: No One Lives Forever,"Nov 11, 2000","Macintosh, PC, PlayStation 2","Just when it seemed as if first-person shooters had run out of ideas, along comes No One Lives Forever to reinvigorate the genre.","MumboJumbo, Monolith Productions","Mac Play, Fox Interactive, Sierra Entertainment, Empire Interactive, CyberFront","Action, First-Person, Shooter, 3D",Mature
https://www.gamespot.com/games/disneys-donald-duck-goin-quackers/,Disney's Donald Duck: Goin' Quackers,"Nov 14, 2000","Dreamcast, GameCube, Nintendo 64, PC, PlayStation, PlayStation 2","Children will enjoy the lively adventures of Donald Duck, and some of those who enjoyed the DuckTales animated series and are looking for a comical Disney romp will want to pick this up.","Ubisoft Montreal, Disney Interactive Studios, Ubisoft Shanghai",Ubisoft,"Platformer, 3D, Action",Everyone
https://www.gamespot.com/games/gauntlet-dark-legacy/,Gauntlet: Dark Legacy,2000,"Arcade Games, Game Boy Advance, GameCube, PlayStation 2, Xbox","If you have a group of bored, bloodthirsty friends visiting, having Dark Legacy around would definitely be an asset.","Midway, Pocket Studios","SNK, Midway","Action, 3D, Beat-'Em-Up",Teen
https://www.gamespot.com/games/kings-field-the-ancient-city/,King's Field: The Ancient City,"Mar 25, 2002",PlayStation 2,"King's Field: The Ancient City will strongly appeal to a small subset of RPG gamers, fans of From Software's similar endeavors in particular.",From Software,"From Software, Agetec Inc., Metro3D",Role-Playing,Teen
https://www.gamespot.com/games/factory-mogul/,Factory Mogul,"Apr 8, 2002",PC,"It has some charm, and the budget price is suited to the amount of fun it provides.",Monte Cristo Multimedia,DreamCatcher Interactive,"Management, Strategy",Teen
https://www.gamespot.com/games/tetris-worlds/,Tetris Worlds,"Sep 5, 2001","Game Boy Advance, GameCube, PC, PlayStation 2, Xbox","Tetris Worlds offers several solid interpretations of the classic Russian mindbender, though there's little here that hasn't been seen before.","3d6 Games, Radical Entertainment, Blue Planet Software","THQ, Success","Puzzle, Matching/Stacking",Everyone
https://www.gamespot.com/games/die-hard-nakatomi-plaza/,Die Hard: Nakatomi Plaza,"Apr 22, 2002",PC,"Even with its cheap $30 price tag, only the most die-hard Die Hard fans should pick up this game.",Piranha Games,Sierra Entertainment,"3D, Action, First-Person, Shooter",Mature
https://www.gamespot.com/games/transworld-surf/,TransWorld Surf,"Nov 15, 2001","PlayStation 2, Xbox",Transworld Surf is one of the best action sports titles in the Xbox launch lineup.,"Rockstar San Diego, Angel Studios",Infogrames,"Wakeboarding/Surfing, Sports",Teen
https://www.gamespot.com/games/spider-man-the-movie/,Spider-Man: The Movie,"Apr 16, 2002","GameCube, PC, PlayStation 2, Xbox",It makes perfect sense that the core gameplay of Spider-Man: The Movie is similar to previous Spider-Man games--but that its graphics really show off what the Xbox can do.,"Treyarch, Gray Matter","Activision, Capcom","Action, Adventure",Everyone
https://www.gamespot.com/games/spider-man-the-movie/,Spider-Man: The Movie,"Apr 16, 2002","GameCube, PC, PlayStation 2, Xbox",It makes perfect sense that the core gameplay of Spider-Man: The Movie is similar to previous Spider-Man games--but that its graphics really show off what the Xbox can do.,"Treyarch, Gray Matter","Activision, Capcom","Action, Adventure",Everyone
https://www.gamespot.com/games/spider-man-the-movie/,Spider-Man: The Movie,"Apr 16, 2002","GameCube, PC, PlayStation 2, Xbox",It makes perfect sense that the core gameplay of Spider-Man: The Movie is similar to previous Spider-Man games--but that its graphics really show off what the Xbox can do.,"Treyarch, Gray Matter","Activision, Capcom","Action, Adventure",Everyone
https://www.gamespot.com/games/burnout/,Burnout,"Nov 1, 2001","GameCube, PlayStation 2, Xbox","Burnout is one of the most intense and entertaining racing games on the PlayStation 2, complete with tight controls and impressive graphics.",Criterion Games,Acclaim,"Arcade, Driving/Racing",Everyone
https://www.gamespot.com/games/burnout/,Burnout,"Nov 1, 2001","GameCube, PlayStation 2, Xbox","Burnout is one of the most intense and entertaining racing games on the PlayStation 2, complete with tight controls and impressive graphics.",Criterion Games,Acclaim,"Arcade, Driving/Racing",Everyone
https://www.gamespot.com/games/the-scorpion-king-sword-of-osiris/,The Scorpion King: Sword of Osiris,"Mar 31, 2002",Game Boy Advance,"Game players are naturally wary of movie-licensed video games, but The Scorpion King: Sword of Osiris doesn't need The Rock to be interesting.",WayForward,Universal Interactive,"Platformer, Action, 2D",Everyone
https://www.gamespot.com/games/rayman-rush/,Rayman Rush,"Mar 26, 2002",PlayStation,"Rayman Rush certainly doesn't maintain the same level of quality as the main games in the Rayman series, but it can prove to be a decent diversion for a short period of time.",Ubisoft Shanghai,Ubisoft,"Arcade, Driving/Racing",Everyone
https://www.gamespot.com/games/breath-of-fire-ii/,Breath of Fire II,December 1995,"Game Boy Advance, Super Nintendo",The lengthy quest offers a meaty challenge for RPG fans to get sucked into and a surprise or two to satisfy those who look for them.,Capcom,"Capcom, Ubisoft, Laguna",Role-Playing,Kids to Adults
https://www.gamespot.com/games/season-ticket-baseball-2003/,Season Ticket Baseball 2003,"Mar 24, 2002",PC,There is no better sports management sim available on this side of the Atlantic.,Out Of The Park Developments,Infogrames,"Team-Based, Baseball, Simulation, Sports",Everyone
https://www.gamespot.com/games/tactical-ops-assault-on-terror/,Tactical Ops: Assault on Terror,"Apr 24, 2002",PC,"Looked at as a free mod, Tactical Ops is an achievement its developers can be proud of, but taken as a retail game, it still needs more work.",Kamehan Studios,"Infogrames, Sold Out Software, Atari SA, ak tronic","First-Person, Shooter, 3D, Action",Mature
https://www.gamespot.com/games/2002-fifa-world-cup/,2002 FIFA World Cup,"Apr 22, 2002","GameCube, PC, PlayStation, PlayStation 2, Xbox",Anyone looking for an Xbox soccer game that plays well and looks nice would do well not to pass on 2002 FIFA World Cup.,"TOSE, EA Sports, EA Canada, Software Creations","Electronic Arts Victor, EA Sports, Electronic Arts","Sports, Team-Based, Simulation, Soccer",Everyone
https://www.gamespot.com/games/wwii-desert-rats/,WWII: Desert Rats,"Mar 17, 2002",PC,WWII: Desert Rats is a good example of a budget game done right.,Canopy Games,ValuSoft,"Action, Shooter, Third-Person, 3D",Teen
https://www.gamespot.com/games/star-x/,Star X,"Apr 17, 2002",Game Boy Advance,Star X is a sight to be seen on the Game Boy Advance.,Graphic State,Bam Entertainment,"Shooter, 3D, Action, On-Rails",Everyone
https://www.gamespot.com/games/ultimate-ride-coaster-deluxe/,Ultimate Ride Coaster Deluxe,"Mar 31, 2002",PC,Coaster Deluxe is essentially just a slightly better version of the original Ultimate Ride.,Gigawatt Studios,Disney Interactive,"Management, Strategy",Everyone
https://www.gamespot.com/games/k-1-world-grand-prix-2001/,K-1 World Grand Prix 2001,"Dec 6, 2001",PlayStation 2,IMPORT: Fans of the sport who are savvy in the ways of importing may want to think about importing what is by far the best iteration of the K-1 sport.,KCEJ,Konami,"Sports, Boxing",
https://www.gamespot.com/games/ice-age/,Ice Age,"Mar 18, 2002",Game Boy Advance,Ice Age is a straightforward platform game with a host of problems that ultimately make it a completely joyless experience.,Artificial Mind and Movement,Ubisoft,"Platformer, 2D, Action",Everyone
https://www.gamespot.com/games/blender-bros/,Blender Bros.,"Apr 15, 2002","Game Boy Advance, PC","If you enjoy good 2D platform games, you can't go wrong with this one.","AI, Infogrames","Hudson, Infogrames, Piko Interactive LLC","2D, Platformer, Action",Everyone
https://www.gamespot.com/games/dance-dance-revolution-konamix/,Dance Dance Revolution Konamix,"Apr 25, 2002",PlayStation,"Though it's as technically sound as the original DDR, Konamix is much harder to recommend, partly because it's more of the same, and partly because of the subpar music selection.",Konami,Konami,Music/Rhythm,Everyone
https://www.gamespot.com/games/bct-commander/,BCT Commander,"Feb 23, 2002",PC,"BCT Commander in many ways delivers exactly what it claims to--it's a rigorous, realistic simulation of what it's like to command a brigade of combined-arms troops in modern warfare.",ProSim,Shrapnel Games,"Real-Time, Strategy",
https://www.gamespot.com/games/hired-team-trial-gold/,Hired Team Trial Gold,"Apr 30, 2002",PC,Hired Team: Trial Gold has arrived at about the worst possible time.,New Media Generation,"New Media Generation, Summitsoft Entertainment","3D, Action, First-Person, Shooter",Mature
https://www.gamespot.com/games/motogp/,MotoGP,"Mar 8, 2002","Game Boy Advance, Mobile, N-Gage, PC, Xbox","While it doesn't have as many tracks or as much replay value as we'd like, MotoGP definitely deserves a spot on your shelf.","Visual Impact, Cybiko, THQ, Climax Group","THQ, MTO, Nokia, ak tronic","Driving/Racing, Simulation",Everyone
https://www.gamespot.com/games/headhunter/,Headhunter,"May 14, 2002","Dreamcast, PlayStation 2","Its graphics fall short of the best the console has to offer, but its blend of action, stealth, and driving manages to keep things interesting throughout.",Amuze,"Sega, Acclaim","Adventure, Action",Mature
https://www.gamespot.com/games/warbirds-iii-fighter-pilot-academy/,WarBirds III Fighter Pilot Academy,"Mar 19, 2002",PC,"There's no denying that Warbirds is at once the most difficult, expensive, and ultimately gratifying online flight sim currently available.",iEntertainment Network,"Simon & Schuster, Tiscali","Simulation, Flight",Everyone
https://www.gamespot.com/games/star-wars-jedi-starfighter/,Star Wars: Jedi Starfighter,"Mar 10, 2002","PlayStation 2, PlayStation 4, Xbox",Star Wars: Jedi Starfighter is a solid game that fans of the first entry in the series should check out without giving it a second thought.,"LucasArts, Secret Level","LucasArts, Electronic Arts, Activision, Disney Interactive Studios, Disney Interactive",Simulation,Teen
https://www.gamespot.com/games/aggressive-inline/,Aggressive Inline,"May 28, 2002","Game Boy Advance, GameCube, PlayStation 2, Xbox",Fans of the Tony Hawk or Dave Mirra games will surely find a lot to like in Aggressive Inline.,"Full Fat, Z-Axis, Ltd.",Acclaim,"Skateboarding/Skating, Sports",Teen
https://www.gamespot.com/games/smashing-drive/,Smashing Drive,"Feb 18, 2002","Arcade Games, Game Boy Advance, GameCube, Xbox","By no means the most technically impressive GameCube game, Smashing Drive would hold the interest of only the most dedicated arcade racing fans.","Gaelco, Raylight Studios, Point of View, Namco","Gaelco, Zoo Digital Publishing, DSI Games, Namco","Arcade, Driving/Racing",Teen
https://www.gamespot.com/games/ski-park-manager/,Ski Park Manager,"Feb 24, 2002",PC,"What is otherwise an enjoyable and challenging game is hidden beneath an unintuitive interface, questionable design decisions, compatibility issues, and an overall lack of polish.",Lankhor,"Microids, Sold Out Software, Frogster Interactive","Strategy, Management",Everyone
https://www.gamespot.com/games/britneys-dance-beat/,Britney's Dance Beat,"Mar 25, 2002","Game Boy Advance, PC, PlayStation 2","Britney's Dance Beat can actually provide an enjoyable if short-lived experience, and it serves as a good introduction for the uninitiated to the world of rhythm games.","Art, Metro Graphics","THQ, Sega",Music/Rhythm,Everyone
https://www.gamespot.com/games/atari-revival/,Atari Revival,"Apr 30, 2002",PC,"These remakes don't look that great or play that well, but at least you get all three of them for $20.",Creature Labs,Infogrames,Compilation,Everyone
https://www.gamespot.com/games/2002-fifa-world-cup/,2002 FIFA World Cup,"Apr 22, 2002","GameCube, PC, PlayStation, PlayStation 2, Xbox",Anyone looking for an Xbox soccer game that plays well and looks nice would do well not to pass on 2002 FIFA World Cup.,"TOSE, EA Sports, EA Canada, Software Creations","Electronic Arts Victor, EA Sports, Electronic Arts","Sports, Team-Based, Simulation, Soccer",Everyone
https://www.gamespot.com/games/combat-medic-special-ops/,Combat Medic: Special Ops,"Apr 30, 2002",PC,Combat Medic probably wasn't the best idea for a game.,Legacy Interactive,Legacy Interactive,"Action, Adventure",Teen
https://www.gamespot.com/games/top-angler/,Top Angler,"Mar 28, 2002","GameCube, PlayStation 2","Use the most up-to-date lures, bait, fish finders, and boating equipment in four game modes that challenge you to find the biggest bass in some of the world's best fishing lakes.","Xicat Interactive, Sims","Xicat Interactive, Sims, THQ","Hunting/Fishing, Sports",Everyone
https://www.gamespot.com/games/r-c-helicopter/,R/C Helicopter,"Apr 30, 2002",PC,"It's something to goof around with when you have 10 minutes to kill, but if you want any more than that, you should look elsewhere.",Summitsoft Entertainment,Summitsoft Entertainment,"Flight, Simulation",Everyone
https://www.gamespot.com/games/test-drive-le-mans/,Test Drive Le Mans,"Mar 31, 2000","Dreamcast, Game Boy Color, PC, PlayStation, PlayStation 2","If you're a racing game fan, you really owe it to yourself to give Le Mans a try.","Melbourne House, Velez & Dubail, Eutechnyx","Infogrames, Sega","Driving/Racing, Simulation",Everyone
https://www.gamespot.com/games/wipeout-fusion/,Wipeout Fusion,"Jun 17, 2002",PlayStation 2,"Wipeout fans should definitely give Fusion at least a rental, though they should prepare themselves for some bittersweet nostalgia.",Studio Liverpool,"SCEE, Bam Entertainment","Arcade, Driving/Racing",Everyone
https://www.gamespot.com/games/legion-the-legend-of-excalibur/,Legion: The Legend of Excalibur,"Jun 18, 2002",PlayStation 2,"Legion has many sound concepts, but just about everything falls apart in the execution, resulting in a game that runs the gamut from frustrating to just plain terrible.",7 Studios,Midway,"Action, Adventure",Mature
https://www.gamespot.com/games/looney-tunes-space-race/,Looney Tunes: Space Race,"Nov 27, 2000","Dreamcast, PlayStation 2","Space Race probably wasn't the best game to port to the PS2 untouched, though Looney Tunes fans ought to give it a look.",Melbourne House,Infogrames,"Driving/Racing, Arcade",Everyone
https://www.gamespot.com/games/the-watchmaker-2001/,The Watchmaker (2001),"Jun 1, 2002",PC,Fans of traditional adventure games will enjoy the puzzles and will likely be able to bear with the awful voice acting and the underdeveloped story.,Trecision,"Got Game Entertainment, Trecision","Adventure, 3D, Third-Person",Teen
https://www.gamespot.com/games/dropship-united-peace-force/,Dropship: United Peace Force,"May 29, 2002",PlayStation 2,"It's an altogether unique flight combat game, and one that can also be quite impressive from a technological standpoint.",Camden Studio,"SCEE, Bam Entertainment","Simulation, Flight",Teen
https://www.gamespot.com/games/gore-ultimate-soldier/,Gore: Ultimate Soldier,"Jun 5, 2002",PC,"Gore is a decent shooter, but there isn't anything here that hasn't been done already--and better--in a game you probably already own.",4D Rulers,DreamCatcher Interactive,"First-Person, Shooter, 3D, Action",Mature
https://www.gamespot.com/games/wta-tour-tennis/,WTA Tour Tennis,"Mar 26, 2002","Game Boy Advance, GameCube, PlayStation 2, Xbox","WTA Tour Tennis offers a decent game of tennis, but the game's biggest strength is its lack of competition.","Now Production, Konami",Konami,"Tennis, Sports",Everyone
https://www.gamespot.com/games/skygunner/,SkyGunner,"Jun 24, 2002",PlayStation 2,"It plays really well a lot of the time, and the game itself is action-packed and interesting enough to warrant looking past its problems.",Pixel Arts,"SCEI, ATLUS","Action, Shooter, Third-Person, 3D",Everyone
https://www.gamespot.com/games/test-drive/,Test Drive,"May 28, 2002","PC, PlayStation 2, Xbox","It's fun for a while, but it's too arcadelike for its own good, and it really only lends itself to short amounts of time spent playing.",Pitbull Syndicate,"Atari SA, Infogrames","Arcade, Driving/Racing",Teen
https://www.gamespot.com/games/nascar-heat-2002/,NASCAR Heat 2002,"Jun 18, 2001","Game Boy Advance, PlayStation 2, Xbox",The dated graphics and the surprisingly inept gameplay make for a bad combination that dooms the game to mediocrity.,"Crawfish Interactive, Monster Games Inc.",Infogrames,"Driving/Racing, Simulation",Everyone
https://www.gamespot.com/games/wwe-wrestlemania-x8/,WWE WrestleMania X8,"Jun 9, 2002",GameCube,"If you're looking for a fun wrestling game for the GameCube, then you'll definitely want to check out WrestleMania X8.",Yuke's,"THQ, Yuke's","Wrestling, Fighting, Action",Teen
https://www.gamespot.com/games/pryzm-chapter-one-the-dark-unicorn/,Pryzm Chapter One: The Dark Unicorn,"Jun 10, 2002",PlayStation 2,Younger players are more likely to enjoy the simplistic and predictable gameplay that Pryzm offers.,Digital Illusions,TDK Mediactive,"Action, Adventure",Teen
https://www.gamespot.com/games/spy-hunter/,Spy Hunter,1984,"Game Boy Advance, GameCube, Macintosh, PC, PlayStation 2, Xbox, Zodiac",It's a solid reinterpretation of a video game classic that adds its own unique elements to the franchise without forsaking what made Spy Hunter what it was.,"Midway, Point of View, Fluent, Paradigm Entertainment, Fathammer","Midway, Aspyr, Sega","Driving/Racing, Arcade",Teen
https://www.gamespot.com/games/outlaw-golf/,Outlaw Golf,"Jun 10, 2002","GameCube, PC, PlayStation 2, Xbox","Outlaw Golf is an odd game because it has a theme that seems to appeal to a certain audience, yet the gameplay isn't really for that crowd.","Hypnotix, Simon & Schuster","TDK Mediactive, Simon & Schuster, Microsoft Game Studios","Golf, Arcade, Sports",Teen
https://www.gamespot.com/games/splashdown/,Splashdown,"Nov 5, 2001","PlayStation 2, Xbox",Splashdown is a good racing game that--with a few tweaks-- could have easily been one of the greatest.,Rainbow Studios,"Infogrames, Atari SA","Driving/Racing, Arcade",Everyone
https://www.gamespot.com/games/legends-of-wrestling/,Legends of Wrestling,"Dec 3, 2001","GameCube, PlayStation 2, Xbox",Legends of Wrestling sadly doesn't follow through with a game that's as good as its concept.,Acclaim Studios Salt Lake City,Acclaim,"Fighting, Wrestling, Action",Teen
https://www.gamespot.com/games/virtua-striker-2002/,Virtua Striker 2002,"May 20, 2002","Arcade Games, GameCube","Virtua Striker 2002 has plenty of gameplay options to keep you busy. Unfortunately, its poor gameplay renders all of these modes nearly worthless.","Sega, Amusement Vision",Sega,"Arcade, Soccer, Sports, Team-Based",Everyone
https://www.gamespot.com/games/big-biz-tycoon/,Big Biz Tycoon,"May 29, 2002",PC,"In trying to walk the line between being a virtual-life game and a business management game, Big Biz Tycoon limits itself to mediocrity.",Animedia,Activision Value,"Management, Strategy",Everyone
https://www.gamespot.com/games/disneys-stitch-experiment-626/,Disney's Stitch: Experiment 626,"Jun 19, 2002",PlayStation 2,"Stitch: Experiment 626 provides a disjointed gameplay experience, and as such it can't be recommended to anyone who isn't very into the recently released Disney movie.",High Voltage Software,"Square EA, Disney Interactive Studios, Buena Vista Games, SCEE, SCEA","Action, Adventure",Everyone
https://www.gamespot.com/games/shifters/,Shifters,"Jun 17, 2002",PlayStation 2,"Shifters was clearly not given enough time in development, and it isn't fun to play as a result.",3DO,3DO,"Adventure, Action",Teen
https://www.gamespot.com/games/lost-kingdoms/,Lost Kingdoms,"May 27, 2002",GameCube,It's quite short and doesn't look or sound particularly good. You can tell that most of the effort went into the combat system.,From Software,"Activision, From Software",Role-Playing,Teen
https://www.gamespot.com/games/bomberman-generation/,Bomberman Generation,"Jun 3, 2002",GameCube,"Surprisingly addictive and deceptively clever, Bomberman Generation has gotten the series back on track.",Hudson,"Hudson, VU Games, Majesco Games","Adventure, 3D, Third-Person",Everyone
https://www.gamespot.com/games/freekstyle/,Freekstyle,"Jun 17, 2002","Game Boy Advance, GameCube, PlayStation 2","While it's not the motocross equivalent of SSX, EA Sports Big's first excursion on dirt is worth a look for those who enjoy a stiff challenge.","Full Fat, Page 44 Studios","Zoo Digital Publishing, Destination Software, Electronic Arts, EA Sports, EA Sports Big","Driving/Racing, Arcade",Everyone
https://www.gamespot.com/games/punch-king/,Punch King,"May 30, 2002",Game Boy Advance,"Punch King tries its best to be the next Punch-Out!!, but it falls short of the mark.",Full Fat,Acclaim,"Sports, Boxing",Everyone
https://www.gamespot.com/games/pac-man-all-stars/,Pac-Man All-Stars,"May 14, 2002",PC,Pac-Man All-Stars simply isn't very fun.,Creature Labs,Infogrames,Puzzle,Everyone
https://www.gamespot.com/games/lethal-skies-elite-pilot-team-sw/,Lethal Skies Elite Pilot: Team SW,"May 31, 2002",PlayStation 2,Sammy's Lethal Skies Elite Pilot: Team SW has survived localization and emerges as an altogether impressive combat flight sim.,Bit Town,"Sammy Studios, Sammy Europe Ltd., Asmik Ace Entertainment, Inc","Flight, Simulation",Everyone
https://www.gamespot.com/games/redcard-20-03/,RedCard 20-03,"Apr 16, 2002","GameCube, PlayStation 2, Xbox","It goes into slightly more realistic territory without sacrificing the fun, easy-to-learn gameplay that most of Midway's sports games possess.","Point of View, Midway",Midway,"Sports, Team-Based, Arcade, Soccer",Everyone
https://www.gamespot.com/games/redcard-20-03/,RedCard 20-03,"Apr 16, 2002","GameCube, PlayStation 2, Xbox","It goes into slightly more realistic territory without sacrificing the fun, easy-to-learn gameplay that most of Midway's sports games possess.","Point of View, Midway",Midway,"Sports, Team-Based, Arcade, Soccer",Everyone
https://www.gamespot.com/games/jazz-and-faust/,Jazz and Faust,"Jun 13, 2002",PC,"Considering its dull, clumsy gameplay and bad writing, Jazz and Faust is a depressing reminder of why so many gamers have left adventure games behind.",Saturn+,"1C, Saturn+","First-Person, 3D, Adventure",Teen
