url,title,release_date,platforms,description,developers,publishers,genres,esrb
https://www.gamespot.com/games/killzone/,Killzone,"Nov 2, 2004","PlayStation 2, PlayStation 3","It's a functional shooter, but with a couple of extra coats of paint, Killzone could have been a whole lot better.","Guerrilla, SuperMassive Games","SCEA, Sega, SCEE, SCEI, SCE Australia","Shooter, 3D, Action, First-Person",Mature
https://www.gamespot.com/games/disney-pixar-the-incredibles/,Disney/Pixar The Incredibles,"Sep 28, 2004","Game Boy Advance, GameCube, Macintosh, Mobile, PC, PlayStation 2, Xbox",The Incredibles is a fairly unremarkable experience that puts you through the motions of the film's plot without capturing any of its essence.,"Helixe, Heavy Iron Studios, Beenox, Lavastorm","THQ, D3Publisher, Disney Mobile Studios, Disney Interactive Studios, SCEA","Adventure, Action",Teen
https://www.gamespot.com/games/disney-pixar-the-incredibles/,Disney/Pixar The Incredibles,"Sep 28, 2004","Game Boy Advance, GameCube, Macintosh, Mobile, PC, PlayStation 2, Xbox",The Incredibles is a fairly unremarkable experience that puts you through the motions of the film's plot without capturing any of its essence.,"Helixe, Heavy Iron Studios, Beenox, Lavastorm","D3Publisher, THQ, Disney Mobile Studios, SCEA, Disney Interactive Studios","Adventure, Action",Teen
https://www.gamespot.com/games/disney-pixar-the-incredibles/,Disney/Pixar The Incredibles,"Sep 28, 2004","Game Boy Advance, GameCube, Macintosh, Mobile, PC, PlayStation 2, Xbox",The Incredibles is a fairly unremarkable experience that puts you through the motions of the film's plot without capturing any of its essence.,"Helixe, Heavy Iron Studios, Beenox, Lavastorm","THQ, D3Publisher, Disney Mobile Studios, Disney Interactive Studios, SCEA","Adventure, Action",Teen
https://www.gamespot.com/games/sonic-mega-collection-plus/,Sonic Mega Collection Plus,"Nov 2, 2004","PC, PlayStation 2, Xbox","While Sonic aficionados will be disappointed by the omission of a few notable titles, there's a ton of solid Robotnik-thwarting to be had with the Mega Collection Plus.","Sega, Sonic Team","Sega, Sega Europe",Compilation,Everyone
https://www.gamespot.com/games/sega-superstars/,Sega SuperStars,"Nov 3, 2004",PlayStation 2,The healthy number of minigames included in the package makes it one of best values out there for EyeToy owners.,Sonic Team,Sega,Party/Minigame,Teen
https://www.gamespot.com/games/ducati-extreme/,Ducati Extreme,"Sep 7, 2004",Mobile,"Simply put, Ducati Extreme is one of the most enjoyable racers to grace the Series 60 platform.",Vir2L Studios,Mforma,"Arcade, Driving/Racing",Everyone
https://www.gamespot.com/games/axis-and-allies/,Axis and Allies,1994,CD-I,,CapDisc,Philips Media,Trivia/Board Game,
https://www.gamespot.com/games/dr-mario/,Dr. Mario,October 1990,"Game Boy, Game Boy Advance, NES, Super Nintendo",,Nintendo,Nintendo,"Matching/Stacking, Puzzle",Everyone
https://www.gamespot.com/games/sonic-mega-collection-plus/,Sonic Mega Collection Plus,"Nov 2, 2004","PC, PlayStation 2, Xbox","While Sonic aficionados will be disappointed by the omission of a few notable titles, there's a ton of solid Robotnik-thwarting to be had with the Mega Collection Plus.","Sega, Sonic Team","Sega, Sega Europe",Compilation,Everyone
https://www.gamespot.com/games/deer-hunter-2005/,Deer Hunter 2005,"Sep 28, 2004",PC,"The next Deer Hunter title will feature a huge variety of weapons, vehicles, and equipment, as well as multiplayer for up to sixteen people via LAN or Internet.",Southlogic Studios,Atari SA,"Hunting/Fishing, Sports",Teen
https://www.gamespot.com/games/fifa-soccer-2005/,FIFA Soccer 2005,"Oct 12, 2004","Game Boy Advance, GameCube, Gizmondo, Mobile, N-Gage, PC, PlayStation, PlayStation 2, Xbox","This is EA Sports' best soccer game to date on the pitch, but it's really unfortunate that the career mode isn't more user-friendly.","EA Canada, Gizmondo Studios, Distinctive Developments Ltd, Exient Entertainment","Electronic Arts, EA Sports, Gizmondo Studios, I-Play, Nokia","Soccer, Sports, Team-Based, Simulation",Everyone
https://www.gamespot.com/games/star-wars-galaxies-an-empire-divided/,Star Wars Galaxies: An Empire Divided,"Jul 9, 2003",PC,"A short while after the game's release, there's a lot of breadth to Star Wars Galaxies, but there isn't a lot of depth.",Sony Online Entertainment,"LucasArts, Electronic Arts, Activision","MMO, Role-Playing",Teen
https://www.gamespot.com/games/rollercoaster-tycoon-3/,RollerCoaster Tycoon 3,"Oct 26, 2004","iOS (iPhone/iPad), Macintosh, Nintendo Switch, PC","If not for some of the glaring bugs in the retail version, RollerCoaster Tycoon 3 would have been a truly excellent sequel to a beloved franchise.","Frontier Developments, Aspyr","Frontier Developments, Frontier Foundry, Aspyr, Atari SA, FRONTIER, Mastertronic","Management, Strategy",Everyone
https://www.gamespot.com/games/guilty-gear-isuka/,Guilty Gear Isuka,"Nov 2, 2004","Arcade Games, PC, PlayStation 2","While many fighting games this year have gone online, Guilty Gear Isuka takes a step back and to the side with its awkward multicharacter fighting system.","Sammy Studios, Arc System Works","Sammy Studios, KISS Ltd., Sourcenext, Zoo Digital Publishing, 505 Game Street","Fighting, 2D, Action",Teen
https://www.gamespot.com/games/wwe-smackdown-vs-raw/,WWE SmackDown! vs. Raw,"Nov 2, 2004",PlayStation 2,"SmackDown! vs. Raw is a fun, full-featured wrestling game that brings some neat gameplay additions to the table, but you won't be able to shake the feeling that it isn't living up to its potential.",Yuke's,"THQ, Yuke's","Action, Wrestling, Fighting",Teen
https://www.gamespot.com/games/atv-offroad-fury-3/,ATV Offroad Fury 3,"Nov 2, 2004",PlayStation 2,"ATV Offroad Fury 3, maintains a familiar feel while generally tightening up the whole package.",Climax Group,"SCEA, SouthPeak Games","Simulation, Driving/Racing",Everyone
https://www.gamespot.com/games/oleg-maddox-presents-pacific-fighters/,Oleg Maddox presents: Pacific Fighters,"Oct 26, 2004",PC,"This is the best way to get your Pacific theater air combat fix, but it unfortunately marks the low point in the series.","1C, X1 Software","Ubisoft, X1 Software, Matrix Games","Flight, Simulation",Teen
https://www.gamespot.com/games/robocop-2004/,RoboCop (2004),"Nov 6, 2004",Mobile,"Fans of arcade games, and especially of the original arcade title, will enjoy Robocop.",I-Play,I-Play,"2D, Action, Shoot-'Em-Up",Everyone
https://www.gamespot.com/games/castlevania/,Castlevania,May 1987,"Amiga, Arcade Games, Commodore 64, Famicom Disk System, Game Boy Advance, Mobile, MSX, NES, Nintendo Switch, PC, PlayStation 4",Let's just hope this doesn't mark the end of the 2D era of Castlevania games.,"Novotrade, Konami, Unlimited Software Inc., Upstart Games, Hamster","Konami, Nintendo, Konami Mobile & Online, Inc., Hamster","2D, Action, Platformer",Everyone
https://www.gamespot.com/games/armored-core-nexus/,Armored Core: Nexus,"Sep 28, 2004",PlayStation 2,"Nexus doesn't look, sound, or handle any differently from previous Armored Core games, but it sure does offer a lot more in terms of customization and challenge.",From Software,"From Software, Agetec Inc., Indie Games",Simulation,Teen
https://www.gamespot.com/games/taiko-drum-master/,Taiko Drum Master,"Oct 26, 2004","Mobile, PlayStation 2",Taiko Drum Master might be best rented for parties and suchlike given its bundled-with-a-peripheral price tag and somewhat limited single-player appeal.,Namco,Namco,Music/Rhythm,Everyone
https://www.gamespot.com/games/men-of-valor/,Men of Valor,"Oct 19, 2004","PC, Xbox",Men of Valor is a first-person shooter set in the Vietnam War. And it's good!,2015,"Sierra Entertainment, Nordic Games Publishing, VU Games","First-Person, Shooter, 3D, Action",Mature
https://www.gamespot.com/games/men-of-valor/,Men of Valor,"Oct 19, 2004","PC, Xbox",Men of Valor is a first-person shooter set in the Vietnam War. And it's good!,2015,"Sierra Entertainment, Nordic Games Publishing, VU Games","First-Person, Shooter, 3D, Action",Mature
https://www.gamespot.com/games/outlaw-golf-2/,Outlaw Golf 2,"Oct 21, 2004","PlayStation 2, Xbox","Outlaw Golf 2 offers a tight, challenging game of golf with some unique gameplay ideas, and it comes at a price that makes it a terrific value.",Hypnotix,Global Star Software,"Sports, Arcade, Golf",Mature
https://www.gamespot.com/games/hidden-and-dangerous-2/,Hidden & Dangerous 2,"Oct 21, 2003",PC,"There's a lot of entertainment to be found in this game, but you'll need to wade through a lot of problems to get to it.",Illusion Softworks,"Gathering, Sold Out Software, 2K Games, ak tronic, Global Star Software","Action, First-Person, Shooter, Tactical",Mature
https://www.gamespot.com/games/outrun2/,OutRun2,"Oct 25, 2004","Arcade Games, Xbox","While it may not offer the sophistication of other racing games on the market, OutRun2 has an old-school sensibility that makes it both appealing and addictive.","Sega AM2, Sumo Digital","Sega, Microsoft Game Studios","Arcade, Driving/Racing",Everyone
https://www.gamespot.com/games/the-nightmare-of-druaga/,The Nightmare of Druaga,"Oct 26, 2004",PlayStation 2,The Nightmare of Druaga is a dungeon hack of the most boring kind.,Arika,"Namco, Arika","Role-Playing, Roguelike",Everyone
https://www.gamespot.com/games/donald-trumps-real-estate-tycoon/,Donald Trump's Real Estate Tycoon,"Nov 2, 2002","Mobile, PC",Donald Trump's Real Estate Tycoon challenges you to become a millionaire by buying and selling properties.,"Airborne, Red Cap Entertainment","Activision Value, Empire Interactive","Management, Strategy",Everyone
https://www.gamespot.com/games/scaler/,Scaler,"Oct 20, 2004","GameCube, PlayStation 2, Xbox","Scaler just isn't an especially engaging platformer, so it's unlikely that anyone past the youngest of audiences will get too much fun from it.",Artificial Mind and Movement,"Global Star Software, Take-Two Interactive","Platformer, 3D, Action",Everyone
https://www.gamespot.com/games/dead-or-alive-ultimate/,Dead or Alive Ultimate,"Oct 26, 2004",Xbox,"For a game that's so bold as to call itself ""Ultimate,"" DOAU sure comes close. It truly is the best, most fully featured Dead or Alive fighting game yet.",Team Ninja,"Microsoft Game Studios, Tecmo",Compilation,Mature
https://www.gamespot.com/games/national-treasure/,National Treasure,"Nov 10, 2004",Mobile,"Unless you are obsessed with all things Nic Cage, there's absolutely no reason to buy this game.",Lightplay,Starwave,"Platformer, 2D, Action",
https://www.gamespot.com/games/atlantis-evolution/,Atlantis Evolution,"Oct 17, 2004",PC,"If you can bear playing Atlantis Evolution long enough, it starts to get better toward the end, but by then it's scant consolation.",Atlantis Interactive Entertainment	,"The Adventure Company, Big Fish Games","Third-Person, Adventure, 3D",Teen
https://www.gamespot.com/games/ace-combat-5-the-unsung-war/,Ace Combat 5: The Unsung War,"Oct 25, 2004","PlayStation 2, PlayStation 4","Ace Combat 5 isn't the huge step for the series that Ace Combat 04 was, but it's still a great flight combat game, featuring grueling arcade-style action and plenty of surprises.",Project Aces ,"Namco, SCEI, SCEE, Bandai Namco Games","Simulation, Flight",Teen
https://www.gamespot.com/games/boktai-2-solar-boy-django/,Boktai 2: Solar Boy Django,"Oct 19, 2004",Game Boy Advance,Boktai 2 stands as a unique action adventure experience that's sufficiently different from the first game to make it seem fresh and interesting all over again.,KCEJ,Konami,"Role-Playing, Action",Teen
https://www.gamespot.com/games/the-bards-tale-2004/,The Bard's Tale,"Oct 26, 2004","Android, iOS (iPhone/iPad), Linux, Macintosh, Nintendo Switch, Ouya, PC, PlayStation 2, PlayStation 4, PlayStation Vita, Xbox, Xbox One","The Bard's Tale is a modern interpretation of the original role-playing game of the same name. In this game, you'll take on the role of the Bard, a sardonic and opportunistic musician and adventurer.","InXile Entertainment, Square One Games","InXile Entertainment, Focus Multimedia, Xbox Game Studios, Ubisoft, Limited Run Games, Red Art Games",Role-Playing,Teen
https://www.gamespot.com/games/the-bards-tale-2004/,The Bard's Tale,"Oct 26, 2004","Android, iOS (iPhone/iPad), Linux, Macintosh, Nintendo Switch, Ouya, PC, PlayStation 2, PlayStation 4, PlayStation Vita, Xbox, Xbox One","The Bard's Tale is a modern interpretation of the original role-playing game of the same name. In this game, you'll take on the role of the Bard, a sardonic and opportunistic musician and adventurer.","InXile Entertainment, Square One Games","InXile Entertainment, Focus Multimedia, Xbox Game Studios, Ubisoft, Limited Run Games, Red Art Games",Role-Playing,Teen
https://www.gamespot.com/games/grand-theft-auto-san-andreas/,Grand Theft Auto: San Andreas,"Oct 26, 2004","Android, iOS (iPhone/iPad), Macintosh, Nintendo Switch, Oculus Quest, PC, PlayStation 2, PlayStation 3, PlayStation 4, Windows Mobile, Xbox, Xbox 360, Xbox One","Set in the early 90s, the next installment in the Grand Theft Auto series brings you to San Andreas--a city troubled by gangs, drugs, and corruption. You'll follow a rising gang member in his journey to save his family and to take control of the streets.","War Drum Studios, TransGaming Inc., Take-Two Interactive, Rockstar Games, Rockstar North","Rockstar Games, Take-Two Interactive, ak tronic, Capcom, SCEA","Action, Adventure",Adults Only
https://www.gamespot.com/games/colin-mcrae-rally-2005/,Colin McRae Rally 2005,"Sep 28, 2004","Mobile, N-Gage, PC, PlayStation 2, PSP, Xbox","The PSP version of Colin McRae Rally 2005 features a variety of gameplay modes, wireless network play, and more.","I-Play, Ideaworks3D, Codemasters, Six by Nine","Codemasters, Nokia, Sold Out Software, Interchannel-Holon","Driving/Racing, Simulation",Everyone
https://www.gamespot.com/games/jamdat-sports-nba-2005/,Jamdat Sports NBA 2005,"Jan 3, 2005",Mobile,"It's not the deepest game you'll ever play on your mobile phone, but if you're a basketball fan it should easily keep you occupied for a few minutes at a time.",Knockabout Games,Jamdat Mobile,"Team-Based, Basketball, Simulation, Sports",
https://www.gamespot.com/games/wwe-survivor-series/,WWE Survivor Series,"Oct 12, 2004",Game Boy Advance,"This is almost an exact duplicate of WWE Road to Wrestlemania X8 from two years ago, warts and all.",Natsume,THQ,"Wrestling, Action, Fighting",Teen
https://www.gamespot.com/games/tak-2-the-staff-of-dreams/,Tak 2: The Staff of Dreams,"Oct 11, 2004","GameCube, PlayStation 2, Xbox","The Staff of Dreams is definitely a more well-conceived game than The Power of Juju, but the whole experience is muddled by an inconsistent difficulty and slapdash level designs.",Avalanche Software,THQ,"Action, Platformer, 3D",Everyone
https://www.gamespot.com/games/tak-2-the-staff-of-dreams/,Tak 2: The Staff of Dreams,"Oct 11, 2004","GameCube, PlayStation 2, Xbox","The Staff of Dreams is definitely a more well-conceived game than The Power of Juju, but the whole experience is muddled by an inconsistent difficulty and slapdash level designs.",Avalanche Software,THQ,"Action, Platformer, 3D",Everyone
https://www.gamespot.com/games/superpower-2/,SuperPower 2,"Oct 11, 2004",PC,All SuperPower 2 has going for it is an anything-can-happen atmosphere.,GolemLabs,"DreamCatcher Interactive, Nordic Games Publishing","Real-Time, Strategy",Teen
https://www.gamespot.com/games/law-and-order-justice-is-served/,Law & Order: Justice Is Served,"Oct 5, 2004",PC,"This isn't really a game for diehard adventure fans, but for enthusiasts of the Law & Order franchise, it's quality fan service.",Legacy Interactive,"Legacy Interactive, Mindscape Inc.","First-Person, 3D, Adventure",Teen
https://www.gamespot.com/games/trigger-man/,Trigger Man,"Oct 5, 2004","GameCube, PlayStation 2, Xbox","Trigger Man is short and clumsy, and not particularly pleasant to look at either.",Point of View,"Crave, Play It","Third-Person, 3D, Action, Shooter",Teen
https://www.gamespot.com/games/trigger-man/,Trigger Man,"Oct 5, 2004","GameCube, PlayStation 2, Xbox","Trigger Man is short and clumsy, and not particularly pleasant to look at either.",Point of View,"Crave, Play It","Third-Person, 3D, Action, Shooter",Teen
https://www.gamespot.com/games/operation-shadow/,Operation Shadow,"Oct 19, 2004",N-Gage,Operation Shadow is a deeply flawed action game that's impossible to recommend.,Torus Games,Nokia,"Action, Adventure",Teen
https://www.gamespot.com/games/teenage-mutant-ninja-turtles-2-battle-nexus/,Teenage Mutant Ninja Turtles 2: Battle Nexus,"Oct 19, 2004","Game Boy Advance, GameCube, PC, PlayStation 2, Xbox",Battle Nexus is more than just a step backward for this series--it's a step backward into a large chasm.,"Konami, KCE Studios",Konami,"Beat-'Em-Up, 3D, Action",Teen
https://www.gamespot.com/games/teenage-mutant-ninja-turtles-2-battle-nexus/,Teenage Mutant Ninja Turtles 2: Battle Nexus,"Oct 19, 2004","Game Boy Advance, GameCube, PC, PlayStation 2, Xbox",Battle Nexus is more than just a step backward for this series--it's a step backward into a large chasm.,"Konami, KCE Studios",Konami,"Beat-'Em-Up, 3D, Action",Teen
https://www.gamespot.com/games/dark-fall-lights-out/,Dark Fall: Lights Out,"Aug 31, 2004",PC,"If you played last year's Dark Fall - The Journal, then you've virtually played its follow-up, Dark Fall: Lights Out. Both games share almost identical weaknesses and strengths.",XXV Productions,"The Adventure Company, Nordic Games Publishing, Iceberg Interactive, DreamCatcher Interactive","First-Person, Adventure, 3D",Teen
https://www.gamespot.com/games/fifa-soccer-2005/,FIFA Soccer 2005,"Oct 12, 2004","Game Boy Advance, GameCube, Gizmondo, Mobile, N-Gage, PC, PlayStation, PlayStation 2, Xbox","This is EA Sports' best soccer game to date on the pitch, but it's really unfortunate that the career mode isn't more user-friendly.","EA Canada, Gizmondo Studios, Distinctive Developments Ltd, Exient Entertainment","Electronic Arts, EA Sports, Gizmondo Studios, I-Play, Nokia","Sports, Team-Based, Simulation, Soccer",Everyone
https://www.gamespot.com/games/fifa-soccer-2005/,FIFA Soccer 2005,"Oct 12, 2004","Game Boy Advance, GameCube, Gizmondo, Mobile, N-Gage, PC, PlayStation, PlayStation 2, Xbox","This is EA Sports' best soccer game to date on the pitch, but it's really unfortunate that the career mode isn't more user-friendly.","EA Canada, Gizmondo Studios, Distinctive Developments Ltd, Exient Entertainment","Electronic Arts, EA Sports, Gizmondo Studios, I-Play, Nokia","Team-Based, Simulation, Soccer, Sports",Everyone
https://www.gamespot.com/games/kingdom-under-fire-the-crusaders/,Kingdom Under Fire: The Crusaders,"Oct 12, 2004","PC, Xbox","Once you climb The Crusaders' steep learning curve and experience the wild frenzy of its massive battles, all the game's complexity pays off in spades.","Blueside, Phantagram","Blueside, Phantagram, Microsoft Game Studios, Jaleco Entertainment","Real-Time, Strategy",Mature
https://www.gamespot.com/games/crash-nitro-kart/,Crash Nitro Kart,"Nov 11, 2003","Game Boy Advance, GameCube, Mobile, N-Gage, PlayStation 2, Xbox","Crash Nitro Kart is the best option to come along in a long while, and it's a totally respectable kart-racing game on its own, regardless of how derivative it may be.","Vicarious Visions, I-Play, VU Games","Konami, Universal Interactive, I-Play, Nokia, VU Games","Arcade, Driving/Racing",Everyone
https://www.gamespot.com/games/neo-contra/,Neo Contra,"Oct 19, 2004",PlayStation 2,"Neo Contra is filled with over-the-top shooting action and twitch gameplay, so it's good for some kicks, even if the game ultimately doesn't provide much depth or challenge.",KCET,"Konami, SCEA","3D, Action, Shooter, Third-Person",Mature
https://www.gamespot.com/games/yager/,Yager,"Oct 5, 2004","PC, Xbox","Yager is priced to move, and fans of aerial dogfighting games will find 15 to 20 hours of better-than-average action here.",Yager,"THQ, Kemco","Adventure, Action",Teen
https://www.gamespot.com/games/fifa-soccer-2005/,FIFA Soccer 2005,"Oct 12, 2004","Game Boy Advance, GameCube, Gizmondo, Mobile, N-Gage, PC, PlayStation, PlayStation 2, Xbox","This is EA Sports' best soccer game to date on the pitch, but it's really unfortunate that the career mode isn't more user-friendly.","EA Canada, Gizmondo Studios, Distinctive Developments Ltd, Exient Entertainment","Electronic Arts, EA Sports, Gizmondo Studios, I-Play, Nokia","Team-Based, Simulation, Soccer, Sports",Everyone
https://www.gamespot.com/games/campaign-gettysburg/,Campaign Gettysburg,"Aug 6, 2004",PC,"If you're a fan of the period and can find a willing foe, Campaign Gettysburg gives you everything you need to reenact one of the most epic campaigns of all time.",HPS Simulations,HPS Simulations,"Strategy, Turn-Based",
https://www.gamespot.com/games/xiii/,XIII,"Nov 18, 2003","GameCube, Macintosh, Mobile, Nintendo Switch, PC, PlayStation 2, PlayStation 4, Xbox, Xbox One","XIII has a unique and potentially interesting premise, but the game doesn't really differentiate itself from the wide array of other first-person shooters on the market.","Ubisoft Paris, Zonic, PlayMagic Ltd, Gameloft, Southend Interactive","Ubisoft, Feral Interactive, Microids, Gameloft, ak tronic, Marvelous","Shooter, 3D, Action, First-Person",Mature
https://www.gamespot.com/games/otogi-2-immortal-warriors/,Otogi 2: Immortal Warriors,"Oct 21, 2004",Xbox,"Otogi 2 retains much of its predecessor's unique and awe-inspiring style, thanks to a great cast, some completely new types of challenges, and a presentation that's second to none.",From Software,"Sega, From Software","Adventure, Action",Teen
https://www.gamespot.com/games/kirby-and-the-amazing-mirror/,Kirby & the Amazing Mirror,"Oct 18, 2004",Game Boy Advance,"If you're looking for pure platforming action with plenty of variety, Kirby's latest adventure most certainly fits the bill.",Flagship,Nintendo,"2D, Platformer, Action",Everyone
https://www.gamespot.com/games/time-crisis-crisis-zone/,Time Crisis: Crisis Zone,1999,"Arcade Games, PlayStation 2","It's a solid two-day rental, but as a full-priced PlayStation 2 game, it's just not worth it.","Namco, TOSE","Namco, SCEE, SCE Australia","Light-Gun, Action, Shooter",Teen
https://www.gamespot.com/games/medieval-conquest/,Medieval Conquest,"Sep 6, 2004",PC,"Medieval Conquest is a charming, lighthearted blend of real-time strategy and fantasy-themed, tycoon-style building.",Cat Daddy Games,Global Star Software,"Strategy, Real-Time",Teen
https://www.gamespot.com/games/final-fantasy-xi/,Final Fantasy XI,"Oct 28, 2003","PC, PlayStation 2, Xbox 360","Final Fantasy XI is an online RPG that manages to break the mold, if just barely--but, actually, that's no mean feat.",Square Enix,"Square Enix, SquareSoft, Ubisoft, Sourcenext, SCEA","Role-Playing, MMO",Teen
https://www.gamespot.com/games/final-fantasy-xi/,Final Fantasy XI,"Oct 28, 2003","PC, PlayStation 2, Xbox 360","Final Fantasy XI is an online RPG that manages to break the mold, if just barely--but, actually, that's no mean feat.",Square Enix,"Square Enix, SquareSoft, Ubisoft, Sourcenext, SCEA","Role-Playing, MMO",Teen
https://www.gamespot.com/games/jamdat-sports-nfl-2005/,Jamdat Sports NFL 2005,"Aug 19, 2004",Mobile,You won't find a mobile game that simulates the football experience as faithfully as Jamdat NFL 2005.,Knockabout Games,Jamdat Mobile,"Simulation, Sports, Team-Based, Football (American)",
https://www.gamespot.com/games/baldurs-gate/,Baldur's Gate,"Dec 21, 1998","Macintosh, Mobile, PC","Baldur's Gate largely manages to meet, and even surpass, gamers' high expectations for this ambitious game.","Graphsim Entertainment, BioWare, Sorrent","Graphic Simulations, Graphsim Entertainment, Sorrent, Interplay, Virgin Interactive, Sega",Role-Playing,Teen
https://www.gamespot.com/games/king-of-fighters-maximum-impact/,King of Fighters: Maximum Impact,"Oct 12, 2004",PlayStation 2,"It's unlikely that anyone other than King of Fighters fans will find much interest in Maximum Impact, but even they will be disappointed by certain key aspects of the game.",SNK Playmore,"SNK Playmore, Ignition Entertainment","Fighting, Action, 3D",Teen
https://www.gamespot.com/games/op15-rising-threat/,OP15: Rising Threat,October 2004,Mobile,"OP15: Rising Threat is definitely missing a few pieces when it comes to user accessibility, but those who invest some time in this game will be rewarded.",Gosub 60,Gosub 60,"3D, Team-Based, Third-Person, Action, Shooter",
https://www.gamespot.com/games/ty-the-tasmanian-tiger-2-bush-rescue/,Ty the Tasmanian Tiger 2: Bush Rescue,"Oct 12, 2004","Game Boy Advance, GameCube, Nintendo Switch, PC, PlayStation 2, PlayStation 4, Xbox, Xbox One","Older audiences probably won't be engaged by it, but Ty 2 should be easily appreciated by juvenile platformer fans.",Krome Studios,"EA Games, Krome Studios","Action, Platformer, 3D",Everyone 10+
https://www.gamespot.com/games/ty-the-tasmanian-tiger-2-bush-rescue/,Ty the Tasmanian Tiger 2: Bush Rescue,"Oct 12, 2004","Game Boy Advance, GameCube, Nintendo Switch, PC, PlayStation 2, PlayStation 4, Xbox, Xbox One","Older audiences probably won't be engaged by it, but Ty 2 should be easily appreciated by juvenile platformer fans.",Krome Studios,"EA Games, Krome Studios","Action, Platformer, 3D",Everyone 10+
https://www.gamespot.com/games/ty-the-tasmanian-tiger-2-bush-rescue/,Ty the Tasmanian Tiger 2: Bush Rescue,"Oct 12, 2004","Game Boy Advance, GameCube, Nintendo Switch, PC, PlayStation 2, PlayStation 4, Xbox, Xbox One","Older audiences probably won't be engaged by it, but Ty 2 should be easily appreciated by juvenile platformer fans.",Krome Studios,"EA Games, Krome Studios","3D, Action, Platformer",Everyone 10+
