url,title,release_date,platforms,description,developers,publishers,genres,esrb
https://www.gamespot.com/games/driven/,Driven,"Nov 6, 2001","Game Boy Advance, GameCube, PlayStation 2","If you're looking for a racing game that is easy to control but extremely difficult, Driven fits the bill.","Crawfish Interactive, Bam Entertainment",Bam Entertainment,"Driving/Racing, Simulation",Teen
https://www.gamespot.com/games/driven/,Driven,"Nov 6, 2001","Game Boy Advance, GameCube, PlayStation 2","If you're looking for a racing game that is easy to control but extremely difficult, Driven fits the bill.","Crawfish Interactive, Bam Entertainment",Bam Entertainment,"Driving/Racing, Simulation",Teen
https://www.gamespot.com/games/frank-herberts-dune/,Frank Herbert's Dune,"Dec 14, 2001","PC, PlayStation 2",It's a poorly designed 3D action-adventure game that actually has precious little to do with the source material and equally little to recommend it.,WideScreen Games,"DreamCatcher Interactive, Cryo Interactive","Adventure, Action",Teen
https://www.gamespot.com/games/dave-mirra-freestyle-bmx-2/,Dave Mirra Freestyle BMX 2,"Sep 6, 2001","Game Boy Advance, GameCube, PlayStation 2, Xbox",The GBA version of Dave Mirra Freestyle BMX 2 makes no compromises in re-creating the experience of its console cousins.,"Full Fat, Z-Axis, Ltd.","Acclaim, Liquid Games",Sports,Teen
https://www.gamespot.com/games/nfl-gameday-2002/,NFL GameDay 2002,"Aug 6, 2001","PlayStation, PlayStation 2",GameDay 2002 does a decent job of delivering a fun and somewhat realistic game of football to the PlayStation.,"989 Sports, Red Zone Entertainment",SCEA,"Sports, Team-Based, Football (American), Simulation",Everyone
https://www.gamespot.com/games/fifa-soccer-2002/,FIFA 2002,"Oct 29, 2001","GameCube, PC, PlayStation, PlayStation 2","Fans of soccer will find that this latest FIFA game is the most challenging, most realistic, and also the greatest yet.","EA Sports, EA Canada","EA Sports, Square EA, Electronic Arts, Electronic Arts Victor","Soccer, Sports, Team-Based, Simulation",Everyone
https://www.gamespot.com/games/europa-universalis-ii/,Europa Universalis II,"Nov 12, 2001","Macintosh, PC","The new game has a broader focus, one that will interest returning veterans of the first game, and it greatly improves the tutorial and documentation to ease the significant learning curve for new players.",Paradox Development Studio,"Virtual Programming, Strategy First, Paradox Interactive, Ubisoft, CyberFront","Real-Time, Strategy",Everyone
https://www.gamespot.com/games/espn-nfl-primetime-2002/,ESPN NFL PrimeTime 2002,"Dec 2, 2001","PC, PlayStation 2, Xbox","Feeble gameplay makes PrimeTime unappealing, and the number of serious bugs that have come along for the ride make it completely unacceptable.","Farsight Technologies, Konami",Konami,"Team-Based, Football (American), Simulation, Sports",Everyone
https://www.gamespot.com/games/kohan-ahrimans-gift/,Kohan: Ahriman's Gift,"Nov 5, 2001",PC,"If you've never taken up arms in the Kohan universe, this is your second chance to introduce yourself to a new brand of real-time strategy game--and you shouldn't miss it again.",TimeGate Studios,"Strategy First, Wanadoo","Real-Time, Strategy",Everyone
https://www.gamespot.com/games/sunny-garcia-surfing/,Sunny Garcia Surfing,"Oct 22, 2001",PlayStation 2,"The age of the engine is apparent, and the presentation and gameplay simply aren't up to par with those of more modern surfing games.",Krome Studios,Ubisoft,"Sports, Wakeboarding/Surfing",Everyone
https://www.gamespot.com/games/disneys-tarzan-untamed/,Disney's Tarzan Untamed,"Nov 14, 2001","GameCube, PlayStation 2","Disney's Tarzan Untamed is a great game for children and perhaps for adults looking for a quick rental, but it's certainly not something you'd induct into your permanent collection.","Ubisoft Montreal, Ubisoft",Ubisoft,"Adventure, Action",Everyone
https://www.gamespot.com/games/rally-trophy/,Rally Trophy,"Nov 20, 2001",PC,"If you enjoy this generally lonely style of driving, Rally Trophy will take you on a journey that ranks right up there with the best the racing genre has to offer.",Bugbear,JoWooD Entertainment AG,"Driving/Racing, Simulation",Everyone
https://www.gamespot.com/games/survivor-2010/,Survivor (2010),"Oct 19, 2010","DS, Wii","This third-person adventure game challenges you to survive historical catastrophes such as the sinking of the Titanic, hurricanes, earthquakes, and more.",Mindscape Inc.,"Mindscape Inc., Valcon Games",Adventure,Everyone
https://www.gamespot.com/games/s-w-i-n-e/,S.W.I.N.E.,"Nov 19, 2001",PC,"While the gameplay isn't quite as unusual as the premise, S.W.I.N.E. is a solid real-time strategy game with plenty of humor, all wrapped up in a beautiful shell.","Stormregion, Kite Games","Fishtank Interactive, Kite Games","Strategy, Real-Time",Teen
https://www.gamespot.com/games/capitalism-ii/,Capitalism II,"Dec 16, 2001",PC,"Once competition picks up against the aggressive AI, Capitalism II shows its colors as a great strategy game. Also, as if to help your own bottom line, the game's a real bargain at $20.",Enlight Software,"Ubisoft, Big Fish Games, Encore Software, Inc., Enlight Software","Management, Strategy",Everyone
https://www.gamespot.com/games/secret-service-in-harms-way/,Secret Service: In Harm's Way,"Nov 23, 2001",PC,Secret Service has a lot of potential that's hampered by sloppy execution.,FUN Labs,Activision Value,"Action, First-Person, Shooter, 3D",Teen
https://www.gamespot.com/games/takeda/,Takeda,"Nov 14, 2001",PC,"Although Takeda is original, a combination of questionable design decisions and serious technical issues make it tough to play, let alone enjoy.",Magitech,Xicat Interactive,"Real-Time, Strategy",Teen
https://www.gamespot.com/games/american-bass-challenge/,American Bass Challenge,"Dec 5, 2001",Game Boy Advance,"Fans of arcade-style fishing may turn their noses up at the complexity of the game, but in the end, this is a solid game that will satiate avid anglers.",Starfish,"Starfish, Ubisoft","Sports, Hunting/Fishing",Everyone
https://www.gamespot.com/games/espn-great-outdoor-games-bass-2002/,ESPN Great Outdoor Games Bass 2002,"Nov 29, 2001",Game Boy Advance,Great Outdoor Games Bass 2002 from Konami is a fine example of how a game can be stripped down to its barest essentials and still be a great game.,KCEO,Konami,"Hunting/Fishing, Sports",Everyone
https://www.gamespot.com/games/monster-truck-fury/,Monster Truck Fury,"Nov 14, 2001",PC,This monster-truck racing game will feature six different tracks and will allow up to four players to race on a network.,Iridon Interactive AB,"Nordic Softsales AB, ValuSoft","Driving/Racing, Simulation",Everyone
https://www.gamespot.com/games/hoshigami-ruining-blue-earth/,Hoshigami: Ruining Blue Earth,"Dec 10, 2001",PlayStation,"For serious fans of the genre, the game can be very time consuming and rewarding in the way a good strategy game should be.",Max Five,"Max Five, ATLUS","Turn-Based, Strategy",Everyone
https://www.gamespot.com/games/star-wars-obi-wan/,Star Wars: Obi-Wan,"Dec 19, 2001",Xbox,Something bad clearly happened when Obi-Wan was turned into an Xbox game.,LucasArts,"LucasArts, Activision","Action, Adventure",Teen
https://www.gamespot.com/games/disciples-ii-dark-prophecy/,Disciples II: Dark Prophecy,"Jan 22, 2002",PC,"The game's unique style and great gameplay, with its distilled strategic and tactical elements, makes for a very enjoyable experience--one that can last you for a very long time.",Strategy First,"Strategy First, Mindscape Inc.","Turn-Based, Strategy",Teen
https://www.gamespot.com/games/star-wars-starfighter/,Star Wars: Starfighter,"Feb 19, 2001","PC, PlayStation 2","The game presents a compelling story, excellent presentation, and gameplay that will surely satisfy fans of LucasArts' N64 shooters.",LucasArts,"LucasArts, SCEA, Activision, Electronic Arts Victor",Simulation,Teen
https://www.gamespot.com/games/black-and-white/,Black & White,"Mar 26, 2001","Macintosh, PC",No other PC game to date has so effectively combined so many seemingly incompatible elements into one highly polished game.,"Lionhead Studios, Zonic","Feral Interactive, EA Games, Electronic Arts, Mastertronic","Strategy, Real-Time",Teen
https://www.gamespot.com/games/star-trek-voyager-elite-force/,Star Trek: Voyager Elite Force,"Sep 20, 2000","Macintosh, PC, PlayStation 2","Star Trek fans shouldn't be alone in experiencing the game's exciting story-driven single-player campaign, as well as its solid multiplayer mode.","Raven Software, Pipe Dream Interactive","Aspyr, Activision, Codemasters, Majesco Games","Shooter, 3D, Action, First-Person",Teen
https://www.gamespot.com/games/mx-2002-featuring-ricky-carmichael/,MX 2002 featuring Ricky Carmichael,"Jul 3, 2001","Game Boy Advance, PlayStation 2, Xbox","CMX is THQ's latest motocross game, featuring lots of licenses, modes, and options.","Tiertex Design Studios, Pacific Coast Power & Light",THQ,"Arcade, Driving/Racing",Everyone
https://www.gamespot.com/games/fighting-legends/,Fighting Legends,"Oct 31, 2001",PC,Fighting Legends could have used at least another year in development.,Maximum Charisma,Maximum Charisma,Role-Playing,Teen
https://www.gamespot.com/games/tsugunai-atonement/,Tsugunai: Atonement,"Nov 29, 2001",PlayStation 2,Many of the interesting concepts in Tsugunai: Atonement lose their appeal shortly after the umpteenth quest to help some tortured soul in town.,Cattle Call,"SCEI, ATLUS",Role-Playing,Teen
https://www.gamespot.com/games/nightcaster-defeat-the-darkness/,NightCaster: Defeat the Darkness,"Jan 21, 2002",Xbox,Nightcaster is a game that aims for the sky but comes up a little short.,VR1 Entertainment,Microsoft Game Studios,"Adventure, Action",Teen
https://www.gamespot.com/games/wizardry-tale-of-the-forsaken-land/,Wizardry: Tale of the Forsaken Land,"Dec 19, 2001",PlayStation 2,Wizardry: Tale of the Forsaken Land is easily one of the best PC-style role-playing games to ever grace a console.,Racjin,"ATLUS, Ubisoft",Role-Playing,Teen
https://www.gamespot.com/games/shaun-palmers-pro-snowboarder/,Shaun Palmer's Pro Snowboarder,"Nov 13, 2001","Game Boy Advance, Game Boy Color, PlayStation 2","While not without its flaws, the game capably brings the gameplay mechanics and general style of the Tony Hawk games to the mountain.","Natsume, ITL, Dearsoft","Activision, Codemasters, Success","Sports, Snowboarding/Skiing",Everyone
https://www.gamespot.com/games/wreckless-the-yakuza-missions/,Wreckless: The Yakuza Missions,"Feb 4, 2002","GameCube, PlayStation 2, Xbox","If you're looking for a great-looking game that will show off the Xbox's graphical muscle, Wreckless fits the bill.","Stealth Studios, Bunkasha Publishing","Activision, Bunkasha Publishing","Arcade, Driving/Racing",Teen
https://www.gamespot.com/games/mega-man-xtreme-2/,Mega Man Xtreme 2,"Oct 30, 2001",Game Boy Color,It will certainly appeal to an audience eager for a serious challenge and more classic Mega Man action as well as those who might have been disappointed with the previous game.,Capcom,Capcom,"Action, 2D, Platformer",Everyone
https://www.gamespot.com/games/nba-courtside-2002/,NBA Courtside 2002,"Jan 13, 2002",GameCube,"Despite the fact that it's a solid first-year effort, Courtside 2002 isn't without its flaws and is generally a step behind more seasoned competing products.",Left Field Productions,Nintendo,"Simulation, Sports, Team-Based, Basketball",Everyone
https://www.gamespot.com/games/blood-wake/,Blood Wake,"Dec 25, 2001",Xbox,"Though not without drawbacks, Bloodwake is an entertaining game that could be a good start to a new series.",Stormfront Studios,Microsoft Game Studios,"Action, Shooter, Third-Person, 3D",Teen
https://www.gamespot.com/games/lineage-the-blood-pledge/,Lineage: The Blood Pledge,"Oct 24, 2001","Macintosh, PC","Lineage looks and plays like a much older game, and unless you can drum up some fake nostalgia, you most likely won't make it past the free trial period.",NCSOFT,"NCSOFT, E-Frontier","Role-Playing, MMO",Teen
https://www.gamespot.com/games/cel-damage/,Cel Damage,"Nov 14, 2001","GameCube, Nintendo Switch, PlayStation 2, PlayStation 3, PlayStation 4, PlayStation Vita, Xbox, Xbox One",Cel Damage is a mix of demolition derbys intense carnage and race car finesse all bundled into a zany cartoon universe.,"Pseudo Interactive, Finish Line Games","Electronic Arts, Finish Line Games, System 3, Play It",Simulation,Teen
https://www.gamespot.com/games/nfl-quarterback-club-2002/,NFL Quarterback Club 2002,"Sep 7, 2001","GameCube, PlayStation 2","For football fans looking for an alternative to Madden, QB Club 2002 is far from perfect, but it isn't terrible, especially if you're not interested in a single-player game.",Acclaim Studios Austin,Acclaim,"Simulation, Sports, Team-Based, Football (American)",Everyone
https://www.gamespot.com/games/nfl-2k2/,NFL 2K2,"Sep 19, 2001","Dreamcast, PlayStation 2, Xbox",Fans of the NFL 2K series will undoubtedly find that it's hard not to like NFL 2K2.,Visual Concepts,Sega,"Sports, Team-Based, Football (American), Simulation",Everyone
https://www.gamespot.com/games/nba-2k2/,NBA 2K2,"Oct 24, 2001","Dreamcast, GameCube, PlayStation 2, Xbox","The improvements in the game, although subtle on the surface, are substantial for serious fans of the NBA.",Visual Concepts,Sega,"Basketball, Simulation, Sports, Team-Based",Everyone
https://www.gamespot.com/games/monster-rancher-advance/,Monster Rancher Advance,"Nov 28, 2001",Game Boy Advance,"Previous games in the Monster Rancher series may have been grander in size or graphical splendor, but Monster Rancher Advance may be the greatest entry yet for a number of reasons.",Tecmo,Tecmo,Strategy,Everyone
https://www.gamespot.com/games/airblade/,AirBlade,"Jan 28, 2002",PlayStation 2,"AirBlade is a fun, entirely playable game that puts a unique twist on the current trend in skateboarding games.",Criterion Games,"SCEE, Namco",Sports,Teen
https://www.gamespot.com/games/espn-international-winter-sports-2002/,ESPN International Winter Sports 2002,"Jan 28, 2002","Game Boy Advance, GameCube, PlayStation 2, Xbox",The gameplay mechanics that proved oh-so-satisfying more than a decade ago fail to impress today.,"KCEO, Konami",Konami,Sports,Everyone
https://www.gamespot.com/games/rez/,Rez,"Jan 7, 2002","Dreamcast, Oculus Quest, PC, PlayStation 2, PlayStation 4, Xbox 360","On paper, UGA's ""music shooter"" may sound a little dull, but it's one of those games that simply must be seen--and in this case, heard--to be fully understood.","UGA, Monstars Inc., Enhance Games, HexaDrive","Sega, Enhance Games, SCEE, iam8bit, Microsoft Game Studios, Q Entertainment","Shooter, On-Rails, VR, 3D, Action",Everyone 10+
https://www.gamespot.com/games/mobile-suit-gundam-zeonic-front/,Mobile Suit Gundam: Zeonic Front,"Jan 15, 2002",PlayStation 2,The amount of enjoyment you'll derive from Mobile Suit Gundam: Zeonic Front may be directly related to your love of the series.,Bec,Bandai,Simulation,Teen
https://www.gamespot.com/games/prehistorik-man/,Prehistorik Man,January 1996,"DS, Game Boy, Game Boy Advance, iOS (iPhone/iPad), Super Nintendo","At best, Prehistorik Man is a weekend diversion from the GBA's more substantial fare.","Arc System Works, Titus Software, Interplay","Interplay, Arc System Works, Kemco, Titus Software, THQ","Action, 2D, Platformer",Kids to Adults
https://www.gamespot.com/games/dragon-rage-2001/,Dragon Rage (2001),"Nov 27, 2001",PlayStation 2,Dragon Rage comes down to being a very basic shooter with a number of flaws thrown in at no extra cost.,3DO,3DO,"Shooter, Third-Person, 3D, Action",Teen
https://www.gamespot.com/games/godai-elemental-force/,GoDai: Elemental Force,"Jan 21, 2002",PlayStation 2,"Despite some solid ideas and some very cool game mechanics, the game is technically flawed to a degree that's almost criminal.",3DO,3DO,"3D, Action, Beat-'Em-Up",Teen
https://www.gamespot.com/games/universal-studios-theme-parks-adventure/,Universal Studios Theme Parks Adventure,"Dec 18, 2001",GameCube,"The game is too frustrating and convoluted for kids to have any fun with it, and all but the most desperate adult GameCube fans will find it tedious and unentertaining as well.",Nai'a Digital Works,Kemco,"Adventure, 3D, Third-Person",Teen
https://www.gamespot.com/games/fifa-soccer-2002/,FIFA 2002,"Oct 29, 2001","GameCube, PC, PlayStation, PlayStation 2","Fans of soccer will find that this latest FIFA game is the most challenging, most realistic, and also the greatest yet.","EA Sports, EA Canada","EA Sports, Square EA, Electronic Arts, Electronic Arts Victor","Soccer, Sports, Team-Based, Simulation",Everyone
https://www.gamespot.com/games/jonny-moseley-mad-trix/,Jonny Moseley Mad Trix,"Dec 26, 2001","Game Boy Advance, PlayStation 2","Virtually every technical and stylistic aspect of the game is either shoddily handled, or feels somehow incomplete.","GFX Construction, 3DO",3DO,"Snowboarding/Skiing, Sports",Teen
https://www.gamespot.com/games/espn-nfl-primetime-2002/,ESPN NFL PrimeTime 2002,"Dec 2, 2001","PC, PlayStation 2, Xbox","Feeble gameplay makes PrimeTime unappealing, and the number of serious bugs that have come along for the ride make it completely unacceptable.","Farsight Technologies, Konami",Konami,"Team-Based, Football (American), Simulation, Sports",Everyone
https://www.gamespot.com/games/tekken-advance/,Tekken Advance,"Jan 28, 2002",Game Boy Advance,The end product looks and feels enough like the original game to succeed.,Eighting/Raizing,"Infogrames, Namco","Action, Fighting, 3D",Teen
https://www.gamespot.com/games/boxing-fever/,Boxing Fever,"Oct 11, 2001",Game Boy Advance,"The graphics are great, the gameplay is solid, and the quick fights make it the perfect type of game to play when you're on the go.",Digital Fiction,"Majesco Games, THQ","Boxing, Sports",Everyone
https://www.gamespot.com/games/master-rallye/,Master Rallye,"Apr 17, 2002","PC, PlayStation 2",Master Rallye is an entertaining trucking thrill ride that walks a fine line between a realistic rally title and a wild 4x4 off-road racer.,Steel Monkeys,Microids,"Simulation, Driving/Racing",Everyone
https://www.gamespot.com/games/espn-winter-x-games-snowboarding-2002/,ESPN Winter X-Games Snowboarding 2002,"Jan 14, 2002","Game Boy Advance, PlayStation 2, Xbox",ESPN Winter X-Games Snowboarding 2002 demonstrates that an average game ported to a more powerful console is still an average game.,"KCEO, Konami",Konami,"Snowboarding/Skiing, Sports",Teen
https://www.gamespot.com/games/dig-dug-deeper/,Dig Dug Deeper,"Oct 31, 2001",PC,"Dig Dug Deeper's lack of difficulty, levels, and extra features make it difficult to recommend to even the most ardent fan.",Creature Labs,Infogrames,"Arcade, Action",Everyone
https://www.gamespot.com/games/monsters-inc-scream-team/,"Monsters, Inc. Scream Team","Oct 30, 2001","PC, PlayStation, PlayStation 2",More sophisticated players will likely find this 3D platformer to be too repetitive and easy.,"Disney Interactive Studios, Artificial Mind and Movement","Ubisoft, Disney Interactive, SCEE, SCEA, Tomy Corporation","Platformer, 3D, Action",Everyone
https://www.gamespot.com/games/phalanx/,Phalanx,October 1992,"Amiga, Game Boy Advance, Sharp X68000, Super Nintendo, Wii","If you're into games like Gradius and Project S-11, and happen to possess twitch reflexes, Phalanx has your call sign, Ace.","Amiga Artists, Kemco, Zoom","Anco, Kemco, Zoom","2D, Action, Shoot-'Em-Up",Everyone
https://www.gamespot.com/games/mech-platoon/,Mech Platoon,"Jan 3, 2002",Game Boy Advance,"Although the Game Boy Advance is nowhere near as powerful as a PC, Mech Platoon compromises nothing compared with stalwart veterans like Starcraft or Command & Conquer.",Will,Kemco,"Real-Time, Strategy",Everyone
https://www.gamespot.com/games/serious-sam-the-second-encounter/,Serious Sam: The Second Encounter,"Feb 4, 2002","Linux, PC, Xbox 360",You'll find virtually everything there is to like about action gaming in the stunning sequel to Serious Sam.,Croteam,"Devolver Digital, Gathering, CyberFront, Take-Two Interactive, Majesco Games","Shooter, 3D, Action, First-Person",Mature
https://www.gamespot.com/games/starships-unlimited-divided-galaxies/,Starships Unlimited: Divided Galaxies,"Dec 2, 2002",PC,Starships Unlimited is a game that's as remarkable for its humble shareware beginnings as it is for its elegant design.,ApeZone,Matrix Games,"Real-Time, Strategy",Everyone
https://www.gamespot.com/games/la-grande-armee-at-austerlitz/,La Grande Armee at Austerlitz,"Dec 18, 2001",PC,"It's different enough from the traditional turn-based, hexagonal wargame that wargamers should sit up and take notice.",HistWar,Matrix Games,"Strategy, Turn-Based",
https://www.gamespot.com/games/the-powerpuff-girls-mojo-jojo-a-go-go/,The Powerpuff Girls: Mojo Jojo A-Go-Go,"Nov 27, 2001",Game Boy Advance,"While the game can't be recommended as highly as the incredible cartoon it's based on, Powerpuff Girls: Mojo-Jojo A-Go-Go is a capable shooter in its own right.",Sennari Interactive,Bam Entertainment,"Action, 2D, Shoot-'Em-Up",Everyone
https://www.gamespot.com/games/mortal-kombat-advance/,Mortal Kombat Advance,"Dec 12, 2001",Game Boy Advance,MKA plays little to nothing like the game it's based on and should be avoided.,Virtucraft,Midway,"Fighting, 2D, Action",Mature
https://www.gamespot.com/games/nba-inside-drive-2002/,NBA Inside Drive 2002,"Jan 21, 2002",Xbox,A general lack of polish and a long list of annoying quirks make it difficult to recommend when there might be a better alternative on the horizon.,High Voltage Software,Microsoft Game Studios,"Basketball, Simulation, Sports, Team-Based",Everyone
https://www.gamespot.com/games/car-tycoon/,Car Tycoon,"Jan 4, 2002",PC,"Car Tycoon may appear to be a decent ride, but if you're looking for a really excellent management game, you should look elsewhere.",Fishtank Interactive,Fishtank Interactive,"Strategy, Management",Everyone
https://www.gamespot.com/games/gunfighter-the-legend-of-jesse-james/,Gunfighter: The Legend of Jesse James,"Nov 30, 2001",PlayStation,"While this light-gun game falls short more often than it succeeds, it does give a glimpse of what could be done within the settings of the wild Wild West.",Rebellion,Ubisoft,"Shooter, Light-Gun, Action",Teen
https://www.gamespot.com/games/cabelas-4x4-off-road-adventure-2/,Cabela's 4x4 Off-Road Adventure 2,"Nov 13, 2001",PC,Off-Road Adventure 2 is unlike virtually any previous driving game in that it does not force you to compete against other cars or a constantly ticking clock.,Clever's Development,"Activision, Activision Value","Simulation, Driving/Racing",Everyone
https://www.gamespot.com/games/planet-monsters/,Planet Monsters,"Dec 6, 2001",Game Boy Advance,Planet Monsters doesn't bring much to this already well-established genre.,Planet Interactive,Titus Software,"Action, Puzzle",Everyone
https://www.gamespot.com/games/motogp-2/,MotoGP 2,"May 21, 2003","Mobile, PC, Xbox",MotoGP2 for the PC falls short of its potential.,"Blue Beck, Climax Group","THQ, Microsoft Game Studios","Simulation, Driving/Racing",Everyone
https://www.gamespot.com/games/tropico/,Tropico,"Apr 5, 2001","Android, iOS (iPhone/iPad), Macintosh, PC",The political wrapper that PopTop has built around the core of the game is sophisticated enough to appeal to all types of strategy game players.,"Feral Interactive, PopTop Software, BreakAway Games, Various","Feral Interactive, MacSoft, ak tronic, Take-Two Interactive, E-Frontier, Gathering","Strategy, Management",Teen
https://www.gamespot.com/games/pirates-the-legend-of-black-kat/,Pirates: The Legend of Black Kat,"Feb 17, 2002","PlayStation 2, Xbox","Pirates is like a Zelda-meets-Tomb Raider, though the actual environments you'll explore are pretty original, as is the method by which you'll get around.",Westwood Studios,Electronic Arts,"Action, Adventure",Teen
https://www.gamespot.com/games/new-legends/,New Legends,"Feb 17, 2002",Xbox,The game's combat system is executed so well that it saves the game from being just another cookie-cutter beat-'em-up.,Infinite Machine,THQ,"3D, Action, Beat-'Em-Up",Teen
https://www.gamespot.com/games/destroyer-command/,Destroyer Command,"Feb 17, 2002",PC,This is a blatant and insulting instance of a game released too early to the detriment of the people who buy it.,Ultimation Inc.,"Dice Multi Media, Ubisoft",Simulation,Everyone
https://www.gamespot.com/games/maximo-ghosts-to-glory/,Maximo: Ghosts to Glory,"Feb 11, 2002",PlayStation 2,"The graphics are simple yet endearing, the gameplay is repetitive but solid, and the game's design is a throwback to the 16-bit era.",Capcom,Capcom,"3D, Platformer, Action",Teen
https://www.gamespot.com/games/18-wheeler-american-pro-trucker/,18 Wheeler: American Pro Trucker,"Nov 22, 2000","Arcade Games, Dreamcast, GameCube, PlayStation 2","18 Wheeler would be easier to recommend as a budget title; with a price comparable to more lasting games, however, it's probably best left as a rental.","Sega, CRI, Acclaim Studios Cheltenham","Sega, Acclaim Japan, Acclaim","Driving/Racing, Arcade",Everyone
https://www.gamespot.com/games/nba-street/,NBA Street,"Jun 18, 2001","GameCube, PlayStation 2",Anyone looking for a fast-action basketball game that isn't afraid to tinker with Midway's stock formula will definitely find a lot to like in NBA Street.,"EA Sports, NuFX","EA Sports Big, Electronic Arts Victor","Team-Based, Arcade, Basketball, Sports",Everyone
https://www.gamespot.com/games/gitaroo-man/,Gitaroo Man,"Feb 19, 2002","PlayStation 2, PSP","Gitaroo-Man is arguably the most original and inventive rhythm game since the advent of Dance Dance Revolution or the original Parappa the Rapper, and it's easily one of the best rhythm games for the PlayStation 2.",Koei/Inis,Koei,Music/Rhythm,Everyone
