url,title,release_date,platforms,description,developers,publishers,genres,esrb
https://www.gamespot.com/games/dmc-devil-may-cry/,DmC: Devil May Cry,"Jan 15, 2013","PC, PlayStation 3, PlayStation 4, Xbox 360, Xbox One","DMC is the next installment in the gothic Devil May Cry series, featuring a short-coiffed, fully aggressive Dante.","QLOC, Ninja Theory",Capcom,"Adventure, Action",Mature
https://www.gamespot.com/games/dmc-devil-may-cry/,DmC: Devil May Cry,"Jan 15, 2013","PC, PlayStation 3, PlayStation 4, Xbox 360, Xbox One","DMC is the next installment in the gothic Devil May Cry series, featuring a short-coiffed, fully aggressive Dante.","QLOC, Ninja Theory",Capcom,"Adventure, Action",Mature
https://www.gamespot.com/games/god-of-war-ascension/,God of War: Ascension,"Mar 12, 2013",PlayStation 3,"God of War: Ascension is the seventh release in the series and is a prequel to the original trilogy that will tell Kratos' origin story by revealing Kratos' initial betrayal by Ares while human, and the source of his rage.",SCE Santa Monica,"SCE Australia, SCEI, SCEE, SCEA","Action, Adventure",Mature
https://www.gamespot.com/games/grid-2/,GRID 2,"May 27, 2013","Macintosh, PC, PlayStation 3, Xbox 360",Codemasters is set to return to the streets with GRID 2.,Codemasters,"Codemasters, Feral Interactive","Simulation, Driving/Racing",Everyone
https://www.gamespot.com/games/shin-megami-tensei-devil-summoner-soul-hackers/,Shin Megami Tensei: Devil Summoner - Soul Hackers,"Apr 16, 2013",3DS,"Soul Hackers delivers a first-person, dungeon-crawling RPG experience set in a future where technology and otherworldly forces meet in a macabre fusion of cyberpunk futurism and gothic horror.",ATLUS,"ATLUS, NIS America",Role-Playing,Mature
https://www.gamespot.com/games/lego-city-undercover/,LEGO City Undercover,"Mar 18, 2013","Nintendo Switch, PC, PlayStation 4, Wii U, Xbox One","In LEGO City: Undercover, players assume the identity of Chase McCain, an undercover detective armed with clever disguises.",TT Games,"Warner Bros. Interactive Entertainment, Nintendo","Adventure, Action",Everyone 10+
https://www.gamespot.com/games/dishonored/,Dishonored,"Oct 8, 2012","PC, PlayStation 3, PlayStation 4, Xbox 360, Xbox One","Dishonored places players in the role an infamous assassin who was the once-trusted bodyguard of the beloved Empress until he was framed for murder. Using supernatural powers and deadly weapons, you must sneak, shoot, and stab your way through a dystopian city in order to depose a cruel tyrant.",Arkane Studios,Bethesda Softworks,"Adventure, Action",Mature
https://www.gamespot.com/games/dishonored/,Dishonored,"Oct 8, 2012","PC, PlayStation 3, PlayStation 4, Xbox 360, Xbox One","Dishonored places players in the role an infamous assassin who was the once-trusted bodyguard of the beloved Empress until he was framed for murder. Using supernatural powers and deadly weapons, you must sneak, shoot, and stab your way through a dystopian city in order to depose a cruel tyrant.",Arkane Studios,Bethesda Softworks,"Adventure, Action",Mature
https://www.gamespot.com/games/dishonored/,Dishonored,"Oct 8, 2012","PC, PlayStation 3, PlayStation 4, Xbox 360, Xbox One","Dishonored places players in the role an infamous assassin who was the once-trusted bodyguard of the beloved Empress until he was framed for murder. Using supernatural powers and deadly weapons, you must sneak, shoot, and stab your way through a dystopian city in order to depose a cruel tyrant.",Arkane Studios,Bethesda Softworks,"Adventure, Action",Mature
https://www.gamespot.com/games/dishonored/,Dishonored,"Oct 8, 2012","PC, PlayStation 3, PlayStation 4, Xbox 360, Xbox One","Dishonored places players in the role an infamous assassin who was the once-trusted bodyguard of the beloved Empress until he was framed for murder. Using supernatural powers and deadly weapons, you must sneak, shoot, and stab your way through a dystopian city in order to depose a cruel tyrant.",Arkane Studios,Bethesda Softworks,"Adventure, Action",Mature
https://www.gamespot.com/games/dishonored/,Dishonored,"Oct 8, 2012","PC, PlayStation 3, PlayStation 4, Xbox 360, Xbox One","Dishonored places players in the role an infamous assassin who was the once-trusted bodyguard of the beloved Empress until he was framed for murder. Using supernatural powers and deadly weapons, you must sneak, shoot, and stab your way through a dystopian city in order to depose a cruel tyrant.",Arkane Studios,Bethesda Softworks,"Adventure, Action",Mature
https://www.gamespot.com/games/dishonored/,Dishonored,"Oct 8, 2012","PC, PlayStation 3, PlayStation 4, Xbox 360, Xbox One","Dishonored places players in the role an infamous assassin who was the once-trusted bodyguard of the beloved Empress until he was framed for murder. Using supernatural powers and deadly weapons, you must sneak, shoot, and stab your way through a dystopian city in order to depose a cruel tyrant.",Arkane Studios,Bethesda Softworks,"Adventure, Action",Mature
https://www.gamespot.com/games/mortal-kombat-2011/,Mortal Kombat (2011),"Apr 19, 2011","PC, PlayStation 3, PlayStation Vita, Xbox 360",Mortal Kombat returns after a lengthy hiatus and puts players back into the Tournament for 2D fighting with gruesome combat and fatalities.,"High Voltage Software, NetherRealm Studios",Warner Bros. Interactive Entertainment,"Fighting, Action, 2D",Mature
https://www.gamespot.com/games/ni-no-kuni-wrath-of-the-white-witch/,Ni no Kuni: Wrath of the White Witch,"Jan 22, 2013","Nintendo Switch, PC, PlayStation 3, PlayStation 4","Ni no Kuni: Wrath of the White Witch is a fantasy RPG game from LEVEL-5 that tells the tale of a young boy named Oliver, who embarks on a journey into a parallel world in an attempt to bring his mother back from the dead.","Engine Software, QLOC, Level 5","Bandai Namco Games, Level 5, Namco Bandai Games, SCEI, Sony DADC Brasil",Role-Playing,Everyone 10+
https://www.gamespot.com/games/strike-suit-zero/,Strike Suit Zero,"Jan 23, 2013","Android, Linux, Macintosh, Nintendo Switch, PC, PlayStation 4, Xbox One","Strike Suit Zero is an action-packed arcade game set in the final hours of a future Earth where the only hope for the planet to avoid destruction is the Strike Suit, an advanced, transforming spacecraft that empowers the player with ludicrous firepower and awesome abilities.",Born Ready Games,Born Ready Games,"Simulation, VR, Flight",Everyone 10+
https://www.gamespot.com/games/shin-megami-tensei-iv/,Shin Megami Tensei IV,"Jul 16, 2013",3DS,Shin Megami Tensei IV puts players in role of a newly appointed samurai where they will struggle with factions that have nefarious designs on the world as they defend their home kingdom from a growing army of demons.,ATLUS,"Nintendo, ATLUS",Role-Playing,Mature
https://www.gamespot.com/games/company-of-heroes-2/,Company of Heroes 2,"Jun 25, 2013","Linux, Macintosh, PC",Company of Heroes 2 focuses on some of history's most brutal and devastating conflicts on the eastern front.,"Feral Interactive, Relic","Feral Interactive, Sega","Real-Time, Strategy",Mature
https://www.gamespot.com/games/state-of-decay/,State of Decay,"Jun 5, 2013","PC, Xbox 360, Xbox One",State of Decay is a 3rd person action zombie-survival game set in a dynamic open world.,Undead Labs,"Microsoft Game Studios, Nordic Games Publishing","Action, Adventure, Survival, 3D",Mature
https://www.gamespot.com/games/monster-hunter-3-ultimate/,Monster Hunter 3 Ultimate,"Mar 19, 2013","3DS, Wii U",Monster Hunter 3 Ultimate utilises the functionalities of the Wii U console and Nintendo 3DS system to provide players with a truly intuitive hunting experience.,Capcom,"Capcom, Nintendo","Action, Role-Playing",Teen
https://www.gamespot.com/games/monster-hunter-3-ultimate/,Monster Hunter 3 Ultimate,"Mar 19, 2013","3DS, Wii U",Monster Hunter 3 Ultimate utilises the functionalities of the Wii U console and Nintendo 3DS system to provide players with a truly intuitive hunting experience.,Capcom,"Nintendo, Capcom","Role-Playing, Action",Teen
https://www.gamespot.com/games/injustice-gods-among-us/,Injustice: Gods Among Us,"Apr 3, 2013","Arcade Games, PC, PlayStation 3, PlayStation 4, PlayStation Vita, Wii U, Xbox 360","Injustice: Gods Among Us is a new fighting game franchise from the creators of Mortal Kombat that introduces a deep, original story featuring a large cast of favorite DC Comics icons such as Batman, Harley Quinn, Solomon Grundy, Superman, The Flash, Wonder Woman and many others.","Raw Thrills, NetherRealm Studios, Armature Studio","Raw Thrills, Warner Bros. Interactive Entertainment, Sony DADC Brasil","2D, Action, Fighting",Teen
https://www.gamespot.com/games/injustice-gods-among-us/,Injustice: Gods Among Us,"Apr 3, 2013","Arcade Games, PC, PlayStation 3, PlayStation 4, PlayStation Vita, Wii U, Xbox 360","Injustice: Gods Among Us is a new fighting game franchise from the creators of Mortal Kombat that introduces a deep, original story featuring a large cast of favorite DC Comics icons such as Batman, Harley Quinn, Solomon Grundy, Superman, The Flash, Wonder Woman and many others.","Raw Thrills, NetherRealm Studios, Armature Studio","Raw Thrills, Warner Bros. Interactive Entertainment, Sony DADC Brasil","2D, Action, Fighting",Teen
https://www.gamespot.com/games/dead-space-3/,Dead Space 3,"Feb 5, 2013","PC, PlayStation 3, Xbox 360","Dead Space 3 brings Isaac Clarke and merciless soldier John Carver on a journey across space to discover the source of the Necromorph outbreak. Players can play together or with a friend using the new drop in, drop out co-op functionality, with each mode offering unique story elements and gameplay.",Visceral Games,"Electronic Arts, Sony DADC Brasil","Action, Adventure",Mature
https://www.gamespot.com/games/dead-space-3/,Dead Space 3,"Feb 5, 2013","PC, PlayStation 3, Xbox 360","Dead Space 3 brings Isaac Clarke and merciless soldier John Carver on a journey across space to discover the source of the Necromorph outbreak. Players can play together or with a friend using the new drop in, drop out co-op functionality, with each mode offering unique story elements and gameplay.",Visceral Games,"Electronic Arts, Sony DADC Brasil","Adventure, Action",Mature
https://www.gamespot.com/games/dead-space-3/,Dead Space 3,"Feb 5, 2013","PC, PlayStation 3, Xbox 360","Dead Space 3 brings Isaac Clarke and merciless soldier John Carver on a journey across space to discover the source of the Necromorph outbreak. Players can play together or with a friend using the new drop in, drop out co-op functionality, with each mode offering unique story elements and gameplay.",Visceral Games,"Electronic Arts, Sony DADC Brasil","Action, Adventure",Mature
https://www.gamespot.com/games/spelunky/,Spelunky,"Jul 4, 2012","Nintendo Switch, PC, PlayStation 3, PlayStation 4, PlayStation Vita, Xbox 360",Spelunky is a unique platformer with randomized levels that offer a new and challenging experience each time you play.,"Mossmouth, BlitWorks","Mossmouth, Limited Run Games, Microsoft Game Studios","2D, Action, Platformer, Roguelike",Teen
https://www.gamespot.com/games/rise-of-the-triad/,Rise of the Triad,"Jul 31, 2013",PC,The 1994 shooter returns with a full Unreal Engine 3 remake featuring a classic arsenal and online modes.,Interceptor,Apogee Games,"Action, First-Person, Shooter, 3D",Mature
https://www.gamespot.com/games/mario-and-luigi-dream-team/,Mario & Luigi: Dream Team,"Aug 11, 2013",3DS,Mario & Luigi: Dream Team is a new installment in the Mario & Luigi role-playing series that takes place on a mysterious island and challenges Mario to go between the real world and Luigi's dreams to rescue Princess Peach.,Alphadream Corporation,Nintendo,Role-Playing,Everyone 10+
https://www.gamespot.com/games/killer-is-dead/,Killer Is Dead,"Aug 27, 2013","PC, PlayStation 3, Xbox 360","Killer Is Dead is a title from the demented mind of celebrated game creator, SUDA51, serving as a spiritual successor to his previous cult favorites, No More Heroes and Killer 7.",Grasshopper Manufacture,"Deep Silver, Kadokawa Shoten, Xseed Games","Adventure, Action",Mature
https://www.gamespot.com/games/shadowrun-returns/,Shadowrun Returns,"Jul 25, 2013","Android, iOS (iPhone/iPad), Linux, Macintosh, Nintendo Switch, PC, Xbox One, Xbox Series X",Shadowrun Returns is a 2D turn-based single player role playing game with an emphasis on storytelling and tactical combat.,"Harebrained Schemes LLC, Paradox Interactive","Harebrained Schemes LLC, Paradox Interactive",Role-Playing,Rating Pending
https://www.gamespot.com/games/dragons-crown/,Dragon's Crown,"Aug 6, 2013","PlayStation 3, PlayStation 4, PlayStation Vita",Dragon's Crown is an online adventure where players are thrust into a fantastical medieval world.,Vanillaware,"ATLUS, NIS America","Action, Role-Playing",Teen
https://www.gamespot.com/games/shelter/,Shelter,"Aug 28, 2013","Macintosh, PC",Shelter is a game where you take on the role of a badger mother who needs to protect her cubs from the dangers that exist in nature.,Might and Delight,Might and Delight,Adventure,Everyone 10+
https://www.gamespot.com/games/spycraft-the-great-game/,Spycraft: The Great Game,"Feb 29, 1996","Macintosh, PC","This is not a game whose video segments are mere story props that leave the player behind, but one designed to keep the player actively involved.",Activision,"Ubisoft, Activision",Adventure,
https://www.gamespot.com/games/open-me/,Open Me!,"Aug 13, 2013",PlayStation Vita,,SCEI,"SCEI, SCEE, SCEA",Action,Everyone 10+
https://www.gamespot.com/games/warframe/,Warframe,"Mar 25, 2013","Nintendo Switch, PC, PlayStation 4, PlayStation 5, Xbox One, Xbox Series X",Warframe is a free-to-play fast-paced co-op shooter.,Digital Extremes,Digital Extremes,"Shooter, Third-Person, 3D, Action",Mature
https://www.gamespot.com/games/pikmin-3/,Pikmin 3,"Aug 4, 2013","Nintendo Switch, Wii U","Pikmin 3 is a fully reimagined, mass-action strategy title from the critically acclaimed Pikmin series that adds a new Rock Pikmin as well as a flying Winged Pikmin that will follow the player and can carry items in the air..","Eighting, Nintendo",Nintendo,"Real-Time, Strategy",Everyone 10+
https://www.gamespot.com/games/stealth-inc-a-clone-in-the-dark/,Stealth Inc: A Clone in the Dark,"Jul 23, 2013","iOS (iPhone/iPad), PlayStation 3, PlayStation 4, PlayStation Vita","Stealth Inc: A Clone in the Dark is a fast-paced stealth platformer featuring brutal hazards, ruthless enemies, fiendish puzzles, and red pixels galore.","Angel VGD LTD, Curve Studios","Curve Digital Games, Square Enix, Curve Studios, Limited Run Games","2D, Action, Platformer",Teen
https://www.gamespot.com/games/time-and-eternity/,Time and Eternity,"Jul 16, 2013",PlayStation 3,Time and Eternity is a hand-drawn animation RPG where you will witness your own death at your wedding before traveling back in time with your wife-to-be in order to track down your killer.,Image Epoch,"Bandai Namco Games, NIS America",Role-Playing,Teen
https://www.gamespot.com/games/guncraft/,Guncraft,"Jul 11, 2013","PC, Xbox 360",,Exato Game Studios,"Exato Game Studios, GameMill Entertainment","Shooter, 3D, Action, First-Person",Teen
https://www.gamespot.com/games/pacific-rim/,Pacific Rim,"Jul 11, 2013","Android, iOS (iPhone/iPad), PlayStation 3, Xbox 360","Pacific Rim is a digital downloadable title to be released on the Xbox LIVE that recreates the mega-scale battles between Jaegers and Kaiju depicted in the ""Pacific Rim"" film.","Reliance Big Entertainment UK Private Ltd, Yuke's","Reliance Big Entertainment UK Private Ltd, Yuke's","Fighting, 3D, Action",Everyone 10+
https://www.gamespot.com/games/bleed/,Bleed,"Dec 12, 2012","Linux, Macintosh, Nintendo Switch, PC, PlayStation 4, Xbox 360, Xbox One","Bleed is an action-platformer focused on stylish, acrobatic dodging and fluid, challenging gameplay.",BootdiskRevolution,"BootdiskRevolution, Digerati Distribution, EastAsiaSoft, Ianthraxx","Platformer, 2D, Action",Teen
https://www.gamespot.com/games/ride-to-hell-retribution/,Ride to Hell: Retribution,"Jun 24, 2013","PC, PlayStation 3, Xbox 360","Take on the role of the leader in a motorcycle gang, riding full throttle through the West Coast in Ride to Hell.","Eutechnyx, Deep Silver",Deep Silver,"Adventure, Action",Mature
https://www.gamespot.com/games/the-last-door-chapter-1-the-letter/,The Last Door: Chapter 1 - The Letter,"Mar 1, 2013","iOS (iPhone/iPad), PC",The Last Door is a horror adventure game where you must unravel the terrible situation in which the manor's inhabitants are living as well as the truth about his owner.,The Game Kitchen,The Game Kitchen,Adventure,
https://www.gamespot.com/games/ncaa-football-14/,NCAA Football 14,"Jul 9, 2013","PlayStation 3, Xbox 360",NCAA Football 14 is a college football simulation game that introduces real-time physics and the Force Impact system.,EA Tiburon,EA Sports,"Simulation, Sports, Team-Based, Football (American)",Everyone
https://www.gamespot.com/games/project-x-zone/,Project X Zone,"Jun 25, 2013",3DS,Project X Zone features over 50 characters from 29 historic game franchises by three of Japan's most prolific video game companies.,Monolith Soft,"Bandai Namco Games, Namco Bandai Games","Strategy, Turn-Based",Teen
https://www.gamespot.com/games/scourge-outbreak/,Scourge: Outbreak,"Jul 3, 2013","Macintosh, PC, PlayStation 3, Xbox 360",Scourge: Outbreak is a futuristic third-person shooter from Tragnarion Studios.,Tragnarion Studios,"TransGaming Inc., BITBOX S.L., UFO Interactive","Shooter, Third-Person, 3D, Action",Mature
https://www.gamespot.com/games/leisure-suit-larry-in-the-land-of-the-lounge-lizar/,Leisure Suit Larry in the Land of the Lounge Lizards,"Jun 4, 1987","Amiga, Apple II, Atari ST, Macintosh, PC, Tandy Color Computer",,"Sierra Entertainment, Fairfield Software","Sierra Entertainment, Kixx","Adventure, Text-Based",
https://www.gamespot.com/games/wargame-airland-battle/,Wargame: AirLand Battle,"May 29, 2013","Linux, Macintosh, PC",Wargame: AirLand Battle allows players to command all military resources of the Cold War era from tanks to planes.,Eugen Systems,Focus Home Interactive,"Real-Time, Strategy",Teen
https://www.gamespot.com/games/new-super-mario-bros-u/,New Super Mario Bros. U,"Nov 18, 2012","Nintendo Switch, Wii U",New Super Mario Bros. U is a new side-scrolling adventure that introduces new transformations for Mario and the ability for players to play as their Mii characters.,Nintendo,Nintendo,"2D, Platformer, Action",Everyone
https://www.gamespot.com/games/game-and-wario/,Game & Wario,"Jun 23, 2013",Wii U,Game & Wario features a collection of games that use only the Wii U GamePad controller.,Intelligent Systems,Nintendo,Party/Minigame,Everyone
https://www.gamespot.com/games/hotline-miami/,Hotline Miami,"Oct 23, 2012","Android, Linux, Macintosh, PC, PlayStation 3, PlayStation 4, PlayStation Vita, Stadia",Hotline Miami has you step into the neon-soaked underground of 1980s Miami as bizarre messages on your answering machine seem to be urging you to commit terrible acts of violence.,"Devolver Digital, Dennaton, Abstraction Games",Devolver Digital,"Action, Adventure",Mature
https://www.gamespot.com/games/magrunner-dark-pulse/,Magrunner: Dark Pulse,"Jun 20, 2013","PC, PlayStation 3, Xbox 360",Magrunner: Dark Pulse is a first-person action puzzle game set in a cyberpunk reimagining of H.P. Lovecraft's Cthulhu Mythos.,Frogwares,"Focus Home Interactive, Frogwares","Action, Puzzle",Mature
https://www.gamespot.com/games/kentucky-route-zero/,Kentucky Route Zero,"Feb 22, 2013","Linux, Macintosh, Nintendo Switch, PC, PlayStation 4, Xbox One","Kentucky Route Zero is a magical realistic adventure game about a secret highway in the caves beneath Kentucky, and the mysterious folks who travel it.",Cardboard Computer,"Cardboard Computer, Annapurna Interactive, iam8bit",Adventure,Teen
https://www.gamespot.com/games/marvel-heroes/,Marvel Heroes,"Jun 3, 2013","Macintosh, PC, PlayStation 4, Xbox One",Marvel Heroes is a free-to-play online game from Gazillion Entertainment.,Gazillion,Gazillion,"MMO, Role-Playing",Teen
https://www.gamespot.com/games/fist-puncher/,Fist Puncher,"Jun 21, 2013","Linux, Macintosh, Ouya, PC, Xbox 360","Fist Puncher is a retro-styled, side scrolling beat em up that follows a team of vigilantes led by Dr. Karate as they perform unnecessary surgery on the crime lords that hold a lawless city in their brutal grip.",Team2Bit,"Adult Swim, Team2Bit","Action, Beat-'Em-Up, 2D",
https://www.gamespot.com/games/the-night-of-the-rabbit/,The Night of the Rabbit,"May 28, 2013","Macintosh, PC",The Night of the Rabbit is an adventure game where a 12-year-old boy is carried off into an enchanted realm by an elegantly dressed rabbit right after his dream of becoming a magician comes true during his last two days of summer vacation.,Daedalic Entertainment,"Daedalic Entertainment, Ikaron",Adventure,
https://www.gamespot.com/games/7-grand-steps/,7 Grand Steps,"Jun 7, 2013","Macintosh, PC","7 Grand Steps is part turn-based strategy, part interactive narrative, and part board game and tells of ancient ancestors who started Western civilization.",Mousechief,Mousechief,Strategy,
https://www.gamespot.com/games/reus/,Reus,"May 16, 2013","Linux, Macintosh, PC, PlayStation 4, Xbox One","In Reus, you control powerful giants that help you shape the planet to your will. You can create mountains and oceans, forests and more. Enrich your planet with plants, minerals and animal life. There is only one thing on the planet that you do not control: mankind, with all their virtues and and all their vices. You can shape their world, but not their will. Provide for them and they may thrive. Give them too much, and their greed may gain the upper hand.","Abbey Games, BlitWorks","Abbey Games, Soedesco",Strategy,Everyone 10+
https://www.gamespot.com/games/animal-crossing-new-leaf/,Animal Crossing: New Leaf,"Jun 9, 2013",3DS,"Animal Crossing: New Leaf for the 3DS is the latest installment of the community-building franchise with new features and general improvements across the entire game, including new species of animal neighbors, new ways to customize your house and town, and a new main street shopping area and model home showcase.",Nintendo,Nintendo,Simulation,Everyone
https://www.gamespot.com/games/rush-bros/,Rush Bros,"Dec 17, 2012","Macintosh, Ouya, PC",Rush Bros. is a unique platforming game which uses your MP3 collection as an integral part of the overall experience.,XYLA Entertainment,XYLA Entertainment,"2D, Action, Platformer",
https://www.gamespot.com/games/the-denpa-men-2-beyond-the-waves/,The Denpa Men 2: Beyond The Waves,"May 30, 2013",3DS,,Genius Sonority Inc.,Genius Sonority Inc.,Role-Playing,Everyone
https://www.gamespot.com/games/the-swapper/,The Swapper,"May 30, 2013","Linux, Macintosh, PC, PlayStation 3, PlayStation 4, PlayStation Vita, Wii U, Xbox One","The Swapper is an atmospheric, 2D puzzle-platformer, and was announced recently as one of the PAX10.",Facepalm Games,"Facepalm Games, Curve Studios, Curve Digital Games, Limited Run Games, Nintendo","Action, Platformer, 2D",Everyone 10+
https://www.gamespot.com/games/fuse/,Fuse,"May 28, 2013","PlayStation 3, Xbox 360",Fuse is a 4-person co-op story-driven action game that invites players to experience what happens when humans access alien technology they were never meant to have.,Insomniac Games,Electronic Arts,Action,Mature
https://www.gamespot.com/games/fuse/,Fuse,"May 28, 2013","PlayStation 3, Xbox 360",Fuse is a 4-person co-op story-driven action game that invites players to experience what happens when humans access alien technology they were never meant to have.,Insomniac Games,Electronic Arts,Action,Mature
https://www.gamespot.com/games/renaissance-heroes/,Renaissance Heroes,"Feb 19, 2013",PC,Renaissance Heroes is an online multiplayer first-person shooter game set in 16th-century Renaissance Europe.,Bridea,"ChangYou, Gamefuse","First-Person, 3D, Action, Team-Based, Shooter",
https://www.gamespot.com/games/resident-evil-revelations/,Resident Evil: Revelations,"Feb 7, 2012","3DS, Nintendo Switch, PC, PlayStation 3, PlayStation 4, Wii U, Xbox 360, Xbox One",Resident Evil: Revelations tells the story of what happens between Resident Evil 4 and Resident Evil 5.,Capcom,"Capcom, Nintendo","3D, Action, Adventure, Survival",Mature
https://www.gamespot.com/games/resident-evil-revelations/,Resident Evil: Revelations,"Feb 7, 2012","3DS, Nintendo Switch, PC, PlayStation 3, PlayStation 4, Wii U, Xbox 360, Xbox One",Resident Evil: Revelations tells the story of what happens between Resident Evil 4 and Resident Evil 5.,Capcom,"Capcom, Nintendo","3D, Action, Adventure, Survival",Mature
https://www.gamespot.com/games/resident-evil-revelations/,Resident Evil: Revelations,"Feb 7, 2012","3DS, Nintendo Switch, PC, PlayStation 3, PlayStation 4, Wii U, Xbox 360, Xbox One",Resident Evil: Revelations tells the story of what happens between Resident Evil 4 and Resident Evil 5.,Capcom,"Capcom, Nintendo","3D, Action, Adventure, Survival",Mature
https://www.gamespot.com/games/resident-evil-revelations/,Resident Evil: Revelations,"Feb 7, 2012","3DS, Nintendo Switch, PC, PlayStation 3, PlayStation 4, Wii U, Xbox 360, Xbox One",Resident Evil: Revelations tells the story of what happens between Resident Evil 4 and Resident Evil 5.,Capcom,"Capcom, Nintendo","3D, Action, Adventure, Survival",Mature
https://www.gamespot.com/games/thunder-wolves/,Thunder Wolves,"May 15, 2013","PC, PlayStation 3, Xbox 360",Thunder Wolves puts you in the hot seat of an experienced helicopter group that has survived a flurry of bullets and caused more destruction than the Seventh United States Army.,Most Wanted Entertainment,bitComposer Games,"Action, Shoot-'Em-Up, 2D",Mature
