url,title,release_date,platforms,description,developers,publishers,genres,esrb
https://www.gamespot.com/games/beyond-the-beyond/,Beyond the Beyond,"Aug 31, 1996",PlayStation,Beyond the Beyond lands squarely in familiar territory - nothing likely to convert new players.,Camelot Software Planning,"SCEI, SCEA",Role-Playing,Kids to Adults
https://www.gamespot.com/games/brahma-force-the-assault-on-beltlogger-9/,BRAHMA Force: The Assault on Beltlogger 9,"Mar 31, 1997",PlayStation,BRAHMA Force: The Assault on Beltlogger 9 is a compelling title.,Genki,"Genki, JVC Music Europe, Jaleco Entertainment","First-Person, Shooter, 3D, Action",Everyone
https://www.gamespot.com/games/beat-planet-music/,Beat Planet Music,"Jan 20, 2000",PlayStation,The main problem with BPM is competition. The gameplay is so mediocre that you would be well-advised to pick any other music game over it.,Opus,SCEI,Music/Rhythm,
https://www.gamespot.com/games/beast-wars-transformers/,Beast Wars: Transformers,"Dec 5, 1997","PC, PlayStation",Beast Wars is an imperfect but fun over-the-shoulder shooter.,"Hasbro Interactive, SCE Studio Cambridge","Hasbro Interactive, Takara","Third-Person, 3D, Action, Shooter",Kids to Adults
https://www.gamespot.com/games/battle-stations-1997/,Battle Stations (1997),"Mar 31, 1997","PlayStation, Saturn",A real-time Battleship for the 90s.,Realtime Associates,Electronic Arts,Strategy,Kids to Adults
https://www.gamespot.com/games/battletanx-global-assault/,BattleTanx: Global Assault,"Oct 12, 1999","Nintendo 64, PlayStation","Instead of playing to the PlayStation's abilities, this port tries to match the N64 version as much as it can, without improving the areas where it could exceed it.",3DO,3DO,Simulation,Teen
https://www.gamespot.com/games/batman-and-robin/,Batman & Robin,"Aug 7, 1998",PlayStation,"Batman & Robin is the best Batman game in years and far better than the '97 Joel Schumacher film it was based on, but neither of those things really amounts to too much.",Probe Entertainment Limited,Acclaim,"Adventure, Action",Teen
https://www.gamespot.com/games/batman-forever-the-arcade-game/,Batman Forever: The Arcade Game,"Nov 21, 1996","Arcade Games, PC, PlayStation, Saturn",Beauty is skin deep.,"Acclaim, Iguana Entertainment","Acclaim, Acclaim Japan","2D, Action, Beat-'Em-Up",Kids to Adults
https://www.gamespot.com/games/bass-rise/,Bass Rise,"Sep 30, 1999",PlayStation,Bass Rise makes for an amusing diversion best suited for casual fishing fans who generally play for no longer than an hour per sitting.,Bec,Bandai,"Sports, Hunting/Fishing",Everyone
https://www.gamespot.com/games/baseball-2000/,Baseball 2000,"Mar 31, 1999",PlayStation,"Baseball 2000 feels, plays, and looks just the way its name sounds: generic.",Interplay,Interplay,"Baseball, Simulation, Sports, Team-Based",Everyone
https://www.gamespot.com/games/hexen-beyond-heretic/,Hexen: Beyond Heretic,"Oct 30, 1995","Macintosh, Nintendo 64, PC, PlayStation, Saturn",Time stands still for no one. Especially not Doom clones.,"Presage Software, Software Creations, Raven Software, Probe Entertainment Limited, Atod AB","id Software, GT Interactive, GameBank, Tec Toy","Shooter, 3D, Action, First-Person",Mature
https://www.gamespot.com/games/guntu-western-front-june-1944/,"Guntu Western Front June, 1944","Nov 27, 1997",PlayStation,"In the words of the immortal Luke Skywalker, ""What a piece of junk.""","Electrocoin Japan Co., Ltd.","Electrocoin Japan Co., Ltd.","Action, Light-Gun, Shooter",
https://www.gamespot.com/games/gunnm-martian-memory/,GUNNM Martian Memory,"Aug 27, 1998",PlayStation,"For fans of the original manga, this is a must-buy.",Yukito Products,Banpresto,Role-Playing,
https://www.gamespot.com/games/glover/,Glover,"Oct 26, 1998","Nintendo 64, PC, PlayStation","Glover, despite its interesting play mechanics, seems to have lost its soul in the port from the N64.","Interactive Studios Ltd., Piko Interactive LLC","Hasbro Interactive, Piko Interactive LLC","Action, 3D, Platformer",Everyone
https://www.gamespot.com/games/gex-3-deep-cover-gecko/,Gex 3: Deep Cover Gecko,"Mar 23, 1999","Nintendo 64, PlayStation","Like Gary Coleman in Diff'rent Strokes, Gex is having a tough time showing off his range.","Gratuitous Games, Crystal Dynamics","Crave, Eidos Interactive, Square Enix, SCEA","Platformer, 3D, Action",Teen
https://www.gamespot.com/games/gex-enter-the-gecko/,Gex: Enter the Gecko,"Feb 24, 1998","Nintendo 64, PC, PlayStation","While the game is technically proficient, the unbelievably lame speech and camera problems make Gex: Enter the Gecko a frustrating title at best.","Realtime Associates, Crystal Dynamics","Midway, GT Interactive, Ubisoft, Bandai, SCEA, Crystal Dynamics, Square Enix","Action, 3D, Platformer",Kids to Adults
https://www.gamespot.com/games/fifa-99/,FIFA 99,"Oct 31, 1998","Nintendo 64, PC, PlayStation","While not completely perfect, it's deep on options, packed with real teams and players, and presented with a slick interface.","EA Canada, EA Sports","Electronic Arts, EA Sports, Electronic Arts Victor","Team-Based, Simulation, Soccer, Sports",Everyone
https://www.gamespot.com/games/fifa-soccer-97/,FIFA Soccer 97,"Oct 31, 1996","Game Boy, Genesis, PC, PlayStation, Saturn, Super Nintendo",EA has delivered a serious soccer game for serious soccer players.,"Tiertex Design Studios, Extended Play Productions, EA Sports, EA Canada, Rage Software","Black Pearl, Tec Toy, EA Sports, Electronic Arts, Electronic Arts Victor","Team-Based, Simulation, Soccer, Sports",Kids to Adults
https://www.gamespot.com/games/fighting-force-2/,Fighting Force 2,"Nov 30, 1999","Dreamcast, PlayStation",Fighting Force 2 takes the same basic beat-'em-up ethic and melds it with a pinch of Lara Croftian camera work and a smidgen of Metal Gear-esque espionage.,Core Design Ltd.,"Eidos Interactive, Square Enix","3D, Action, Beat-'Em-Up",Teen
https://www.gamespot.com/games/formula-1/,Formula 1,"Sep 30, 1996","BlackBerry, PC, PlayStation",Psygnosis' Formula 1 is a high-octane masterpiece.,"MMH-IT BV, Bizarre Creations","MMH-IT BV, Psygnosis, SCEI, SCEA","Driving/Racing, Simulation",Kids to Adults
https://www.gamespot.com/games/ecw-hardcore-revolution/,ECW Hardcore Revolution,"Feb 17, 2000","Dreamcast, Game Boy Color, Nintendo 64, PlayStation",ECW and its fans deserve better than this.,"Acclaim Studios Salt Lake City, Crawfish Interactive",Acclaim,"Action, Fighting, Wrestling",Mature
https://www.gamespot.com/games/dune-2000/,Dune 2000,"Aug 31, 1998","PC, PlayStation","While some may take away from Dune 2000 a fleeting sense of nostalgia for the classic, most will invariably leave the game disappointed and wondering how a true sequel might have turned out.",Westwood Studios,"Electronic Arts, Virgin Interactive, Westwood Studios, Sold Out Software","Strategy, Real-Time",Teen
https://www.gamespot.com/games/the-dukes-of-hazzard-racing-for-home/,The Dukes of Hazzard: Racing for Home,"Nov 30, 1999","Game Boy Color, PC, PlayStation","The Dukes of Hazzard: Racing For Home could have been an outstanding game, but the game is simply too easy and way too buggy to succeed.","Spellbound, SouthPeak Games, Sinister Games","Ubisoft, SouthPeak Games","Driving/Racing, Arcade",Everyone
https://www.gamespot.com/games/championship-motocross-featuring-ricky-carmichael/,Championship Motocross Featuring Ricky Carmichael,"Jul 31, 1999",PlayStation,"Championship Motocross Featuring Ricky Carmichael, with its control, visuals, and overall feel is the best motocross game for the PlayStation.",Funcom,"THQ, MediaWorks","Arcade, Driving/Racing",Everyone
https://www.gamespot.com/games/clock-tower-ii-the-struggle-within/,Clock Tower II: The Struggle Within,"Oct 31, 1999",PlayStation,The graphics in Clock Tower II are pure first-generation PlayStation.,Human Entertainment,"SCEA, Human Entertainment, Agetec Inc., SunSoft",Adventure,Mature
https://www.gamespot.com/games/croc-legend-of-the-gobbos/,Croc: Legend of the Gobbos,"Sep 29, 1997","PC, PlayStation, Saturn",Croc just didn't live up to its potential.,Argonaut Games,"Fox Interactive, MediaQuest, Electronic Arts, Tec Toy","3D, Action, Platformer",Kids to Adults
https://www.gamespot.com/games/croc-2/,Croc 2,"Jun 30, 1999","PC, PlayStation","It held promise, but once again two fatal flaws hold it down.",Argonaut Games,"Fox Interactive, Electronic Arts, Koei","Action, 3D, Platformer",Everyone
https://www.gamespot.com/games/cool-boarders-4/,Cool Boarders 4,"Nov 10, 1999",PlayStation,CB4 is basically a better version of CB3.,Idol Minds,"UEP Systems, 989 Studios, 989 Sports","Sports, Snowboarding/Skiing",Everyone
https://www.gamespot.com/games/sid-meiers-civilization-ii/,Sid Meier's Civilization II,"Feb 29, 1996","Macintosh, PC, PlayStation","Civilization II is a solid, if not spectacular, game that strategy fans will not want to miss.","Worker Bee Software, Varcon Systems, MicroProse, MPS Labs, LTI Gray Matter","MacSoft, Hasbro Interactive, MicroProse, Infogrames, Sold Out Software, Human Entertainment, Activision","Strategy, Turn-Based",Everyone
https://www.gamespot.com/games/chocobo-racing/,Chocobo Racing,"Jul 31, 1999",PlayStation,"Apparently, there is no stone that Square is willing to leave unturned, because this game is nothing more than a tired rehash of almost everything that's come before it.",SquareSoft,"Square EA, SquareSoft, Square Enix","Arcade, Driving/Racing",Everyone
https://www.gamespot.com/games/cool-boarders-3/,Cool Boarders 3,"Sep 30, 1998",PlayStation,"Unfortunately, Cool Boarders 3 isn't the sequel we had all hoped for - changing developers for this third game really hurt the series a lot.",Idol Minds,"SCEE, SCEA, 989 Studios, UEP Systems","Sports, Snowboarding/Skiing",Everyone
https://www.gamespot.com/games/blast-radius/,Blast Radius,"Feb 28, 1999",PlayStation,It just seems more like an expansion pack than anything else.,Camden Studio,Psygnosis,Simulation,Everyone
https://www.gamespot.com/games/blasto/,Blasto,"Mar 31, 1998",PlayStation,There's a good game here - it's simply hidden under many layers of frustration.,Sony Interactive Studios America,"SCEE, SCEA","3D, Action, Shooter, Third-Person",Teen
https://www.gamespot.com/games/big-air/,Big Air,"Feb 28, 1999",PlayStation,"Certainly this is not an offensive game by any means, but it's remarkably average.",Pitbull Syndicate,Accolade,"Sports, Snowboarding/Skiing",Everyone
https://www.gamespot.com/games/bust-a-move-4/,Bust-A-Move 4,"Oct 31, 1998","Arcade Games, Dreamcast, Game Boy Color, PC, PlayStation",Fans of the Bust-A-Move puzzle series can look forward to more sleepless months with Natsume's release of Bust-A-Move 4.,"Taito Corporation, Crawfish Interactive","Taito Corporation, Acclaim, CyberFront, Altron, Interplay, Agetec Inc., D3Publisher, Natsume, SCEA","Puzzle, Matching/Stacking",Everyone
https://www.gamespot.com/games/asuka-120-excellent-burning-fest-excellent/,Asuka 120% Excellent BURNING Fest. EXCELLENT,"May 9, 1997",PlayStation,All-girl fighting games haven't seen the light of day in the US.,Fill-In Cafe,Family Soft,"2D, Action, Fighting",
https://www.gamespot.com/games/asteroids/,Asteroids,November 1979,"Arcade Games, Atari 2600, Atari 7800, Atari 8-bit, Game Boy, Oric 1/Atmos","While it might make a better rental than a straight-up purchase, either way you won't go wrong.","Atari, Atari Corporation, The Code Monkeys, Artic Computing Ltd.","Zaccaria, Bootleg, Atari, Sears, Atari Corporation, Polyvox, Accolade, Artic Computing Ltd.","2D, Action, Fixed-Screen, Shooter",Everyone
https://www.gamespot.com/games/assault-retribution/,Assault: Retribution,"Oct 31, 1998",PlayStation,"While the basics may sound playable enough, Assault's problems are almost too many to list in this review.",Candle Light Studios,"Midway, Telstar","Third-Person, 3D, Action, Shooter",Teen
https://www.gamespot.com/games/arcade-party-pak/,Arcade Party Pak,"Sep 30, 1999",PlayStation,The great conversion of Smash TV alone makes this pack worth picking up.,Digital Eclipse,Midway,Compilation,Teen
https://www.gamespot.com/games/midway-presents-arcades-greatest-hits-the-atari/,Midway Presents Arcade's Greatest Hits: The Atari Collection 1,"Dec 31, 1997","PlayStation, Saturn, Super Nintendo","The real tragedy is being unable to make the famous ""Tempest Whir.""",Digital Eclipse,"GT Interactive, Midway",Compilation,Kids to Adults
https://www.gamespot.com/games/adidas-power-soccer-98/,Adidas Power Soccer 98,"Jun 30, 1998",PlayStation,"Adidas Power Soccer 98 does a number of things well, but its shortcomings are frustrating enough to turn most players off before the whistle blows.",Shen,Psygnosis,"Simulation, Soccer, Sports, Team-Based",Everyone
https://www.gamespot.com/games/andretti-racing/,Andretti Racing,"Nov 30, 1996","PC, PlayStation, Saturn","You'd think that at 200 mph the scenery would just blow by - instead, the cars seem to move at a light rush-hour crawl.","Stormfront Studios, Press Start Inc., High Score Productions","Electronic Arts, EA Sports, Electronic Arts Victor, Tec Toy","Arcade, Driving/Racing",Kids to Adults
https://www.gamespot.com/games/all-japan-woman-pro-wrestling/,All Japan Woman Pro Wrestling,"Jul 23, 1998",PlayStation,All Japan Woman Pro Wrestling offers a tiny handful of modes compared with current wrestling games.,Dream Japan,TEN,"Fighting, Wrestling, Action",
https://www.gamespot.com/games/allied-general/,Allied General,1995,"Macintosh, PC, PlayStation","The term ""Armchair General"" was coined for this kind of game.","SSI, Asylum Entertainment","SSI, Mindscape Inc., Xing Entertainment","Strategy, Turn-Based",Kids to Adults
https://www.gamespot.com/games/army-men-air-attack/,Army Men: Air Attack,"Nov 3, 1999","Game Boy Color, Nintendo 64, PC, PlayStation","While it may not completely wash away the bad taste left by Army Men 3D and Army Men: Sarge's Heroes, Army Men: Air Attack is a fun little mission-based shooter that is worth checking out.","Fluid Studios, 3DO, Aqua Pacific","3DO, Sold Out Software",Simulation,Teen
https://www.gamespot.com/games/midway-presents-arcades-greatest-hits-the-midway/,Midway Presents Arcade's Greatest Hits: The Midway Collection 2,"Nov 30, 1997","PC, PlayStation",This collection of arcade emulations will provide solid retro fun.,Digital Eclipse,"GT Interactive, Midway",Compilation,Kids to Adults
https://www.gamespot.com/games/midway-presents-arcades-greatest-hits-the-atari/,Midway Presents Arcade's Greatest Hits: The Atari Collection 1,"Dec 31, 1997","PlayStation, Saturn, Super Nintendo","The real tragedy is being unable to make the famous ""Tempest Whir.""",Digital Eclipse,"GT Interactive, Midway",Compilation,Kids to Adults
https://www.gamespot.com/games/a-collection-of-activision-classic-games-for-the-a/,A Collection of Activision Classic Games for the Atari 2600,"Sep 30, 1998",PlayStation,"Considering you can pick up many playable 2600 cartridges at flea markets for about one dollar or so, if you just want to occasionally play some of your favorite old titles, this collection is worth it.",Gray Matter,Activision,Compilation,Everyone
https://www.gamespot.com/games/ace-combat-2/,Ace Combat 2,"Jul 31, 1997",PlayStation,Ace Combat 2 fixes every problem that troubled the first game.,Namco,"Namco, SCEE","Simulation, Flight",Teen
https://www.gamespot.com/games/the-fifth-element/,The Fifth Element,"Sep 30, 1998","PC, PlayStation",No need to waste time clamoring about lousy feature film to video game metamorphoses; let's just say that Activision's The Fifth Element PlayStation game is a textbook example of the conversion conundrum - and quite possibly the worst game I've ever played.,Kalisto,"Activision, Ubisoft, SCE Australia, SCEE, Hudson","Action, Adventure",Teen
https://www.gamespot.com/games/3xtreme/,3Xtreme,"Apr 21, 1999",PlayStation,After playing the game for 30 minutes you'll be wishing you had rented something else.,989 Sports,989 Sports,"Arcade, Driving/Racing",Everyone
https://www.gamespot.com/games/3d-baseball/,3D Baseball,"Oct 31, 1996","PlayStation, Saturn","3D Baseball is an excellent rookie attempt, and future updates could easily become contenders for the MVP award.",Crystal Dynamics,"BMG Interactive Entertainment, Crystal Dynamics","Sports, Team-Based, Baseball, Simulation",Kids to Adults
https://www.gamespot.com/games/2-xtreme/,2 Xtreme,"Nov 6, 1996",PlayStation,"Even NASCAR fans will cringe when their character slams to the asphalt with a fleshy ""smack.""",Sony Interactive Studios America,"SCEA, SCEE, SCEI","Driving/Racing, Arcade",Kids to Adults
https://www.gamespot.com/games/thousand-arms/,Thousand Arms,"Oct 13, 1999",PlayStation,"The game has a strong anime aesthetic - sometimes cute, sometimes wacky, and definitely attractive.",Red Company/Atlus/Tose,ATLUS,Role-Playing,Teen
https://www.gamespot.com/games/stepping-selection/,Stepping Selection,"Mar 4, 2000",PlayStation 2,"Musically, Stepping Selection eschews Konami's techno-laced offering in favor of two CDs full of pop music.",Jaleco Entertainment,Jaleco Entertainment,Action,
https://www.gamespot.com/games/i-q-remix-intelligent-qube/,I.Q. Remix+: Intelligent Qube,"Mar 23, 2000",PlayStation 2,"I.Q. Remix+ fails in that it subtracts from what made the original formula so worthy, and it tries to blindside you with tons of techno trickery but fools practically no one.",Sugar & Rockets,SCEI,Puzzle,
https://www.gamespot.com/games/drummania/,DrumMania,"Jul 10, 1999","Arcade Games, PlayStation 2","DrumMania is just as much fun as the other games in the series, but it definitely has a steeper learning curve than any other game in the Bemani line.",Konami,Konami,Music/Rhythm,
https://www.gamespot.com/games/samurai-shodown-ii/,Samurai Shodown II,"Dec 2, 1994","Android, Arcade Games, iOS (iPhone/iPad), Neo Geo, Neo Geo CD, Nintendo Switch, PC, PlayStation 4, Xbox 360, Xbox One",The second game in SNK's Samurai Shodown line is widely regarded as the best of the series.,"SNK Playmore, SNK, Kinesoft, Hamster","SNK Playmore, SNK, D4 Enterprise, Hamster, SNK Corporation, CyberFront, GameBank","Fighting, 2D, Action",Mature
https://www.gamespot.com/games/neo-geo-cup-98-plus-color/,Neo Geo Cup '98 Plus Color,1998,Neo Geo Pocket Color,"Soccer games have come a long way over the past 15 years, and its these advancements that make Neo Geo Cup '98 Plus Color seem silly by comparison.",SNK,SNK,"Soccer, Sports, Team-Based, Simulation",Everyone
https://www.gamespot.com/games/metal-slug-1st-mission/,Metal Slug: 1st Mission,1999,Neo Geo Pocket Color,Metal Slug was one of the surprising series to come out on the Neo Geo.,Ukiyotei,SNK,"2D, Shoot-'Em-Up, Action",Everyone
https://www.gamespot.com/games/the-last-blade/,The Last Blade,1997,"Arcade Games, Neo Geo, Neo Geo CD, Nintendo Switch, PC, PlayStation, PlayStation 4, Xbox One","For casual players, it may seem like just another disc on the pile, but for enthusiasts it's an extremely deep and enjoyable game that really shouldn't be missed.","SNK, DotEmu, Hamster","SNK, D4 Enterprise, Hamster, SNK Playmore","Action, Fighting, 2D",Teen
https://www.gamespot.com/games/snk-gals-fighters/,SNK Gals Fighters,"Feb 19, 2000","Neo Geo Pocket Color, Nintendo Switch",It's a little hard to recommend it to anyone but the most die-hard fan of SNK's female lineup.,"Yumekobo, Code Mystics Inc.","SNK, SNK Corporation","Action, 2D, Fighting",Everyone
https://www.gamespot.com/games/baseball-stars-color/,Baseball Stars Color,"May 31, 1999",Neo Geo Pocket Color,Baseball Stars Color is portable baseball at its finest.,SNK,SNK,"Simulation, Sports, Team-Based, Baseball",Everyone
https://www.gamespot.com/games/world-cup-98/,World Cup 98,"Mar 31, 1998","Game Boy, Nintendo 64, PC, PlayStation","On the basis of AI improvements alone, World Cup 98 is highly recommended.","Tiertex Design Studios, EA Canada","THQ, EA Sports, Gradiente, Electronic Arts Victor","Team-Based, Simulation, Soccer, Sports",Everyone
https://www.gamespot.com/games/wonder-project-j2/,Wonder Project J2,"Nov 22, 1996",Nintendo 64,"If nothing else, Wonder Project J2 will make you realize just how different the US and Japanese game markets truly are.",Givro,Enix Corporation,Adventure,
https://www.gamespot.com/games/iggys-reckin-balls/,Iggy's Reckin' Balls,"Jul 31, 1998",Nintendo 64,"For all Iggy's trademark puzzle-game annoyances, it also has the perks.",Iguana Entertainment,"Acclaim, Acclaim Japan","Arcade, Driving/Racing",Everyone
https://www.gamespot.com/games/wipeout-64/,Wipeout 64,"Nov 3, 1998",Nintendo 64,"WipeOut 64 isn't horrible, it just feels like the developer's first effort for the system at times - which it is.",Psygnosis,"Coconuts Japan, Midway","Driving/Racing, Arcade",Everyone
https://www.gamespot.com/games/wcw-vs-nwo-world-tour/,WCW vs. nWo: World Tour,"Nov 30, 1997",Nintendo 64,You may want to rent WCW vs. NWO before purchasing it.,Aki Corp.,THQ,"Wrestling, Fighting, Action",Everyone
https://www.gamespot.com/games/war-gods/,War Gods,1997,"Arcade Games, Nintendo 64, PC, PlayStation",War Gods is an interesting footnote to the MK legacy.,"Midway, Eurocom Entertainment Software","Midway, Tec Toy, GT Interactive","Action, Fighting, 3D",Mature
https://www.gamespot.com/games/true-golf-classics-waialae-country-club/,True Golf Classics: Waialae Country Club,November 1991,"3DO, Genesis, NEC PC98, Nintendo 64, Super Nintendo",,T&E Soft,"Panasonic, T&E Soft, Sega, Nintendo","Golf, Simulation, Sports",Everyone
https://www.gamespot.com/games/virtual-pool-64/,Virtual Pool 64,"Dec 17, 1998",Nintendo 64,It's the video game equivalent of a college textbook: great to learn from but not really exciting to read.,Celeris,Crave,"Billiards, Sports",Everyone
https://www.gamespot.com/games/virtual-chess-64/,Virtual Chess 64,"Jun 10, 1998",Nintendo 64,The 3D view's lack of visual clarity makes for a frustrating game.,Titus Software,Titus Software,Trivia/Board Game,Everyone
https://www.gamespot.com/games/turok-rage-wars/,Turok: Rage Wars,"Nov 23, 1999",Nintendo 64,"Even on the most difficult setting, the bot AI can't stand up to any steady-handed human player.",Acclaim Studios Austin,Acclaim,"First-Person, Shooter, 3D, Action",Mature
https://www.gamespot.com/games/top-gear-rally-1997/,Top Gear Rally (1997),October 1997,Nintendo 64,Top Gear Rally is a title of some inarguable merit.,Boss Game Studios,Kemco,"Simulation, Driving/Racing",Everyone
https://www.gamespot.com/games/tony-hawks-pro-skater/,Tony Hawk's Pro Skater,"Aug 31, 1999","Dreamcast, Game Boy Color, N-Gage, Nintendo 64, PlayStation",It's one of those games that will keep you coming back long after you've mastered it.,"Treyarch, Natsume, Neversoft Entertainment, Edge of Reality","Crave, Activision, Success, Nokia","Skateboarding/Skating, Sports",Teen
https://www.gamespot.com/games/cybertiger/,CyberTiger,"Sep 30, 1999","Game Boy Color, Nintendo 64, PlayStation","The single most obvious characteristic you'll discover within the first five minutes of playing CyberTiger was that if the game had come out before Hot Shots Golf or even before Mario Golf, it might have been more impressive.","Xantera, Saffire, EA Redwood Shores","Electronic Arts, EA Sports","Sports, Arcade, Golf",Everyone
https://www.gamespot.com/games/top-gear-overdrive/,Top Gear Overdrive,"Nov 23, 1998",Nintendo 64,"The multiplayer aspect alone raises the score, but Top Gear Overdrive's rough edges really keep this game from maximizing on all Snowblind's hard work.",Snowblind Studios,Kemco,"Driving/Racing, Arcade",Everyone
https://www.gamespot.com/games/tetrisphere/,Tetrisphere,"Aug 11, 1997",Nintendo 64,Tetrisphere is precisely the sort of game that the N64 really needs.,H2O Interactive,Nintendo,"Puzzle, Matching/Stacking",Kids to Adults
https://www.gamespot.com/games/supercross-2000/,Supercross 2000,"Oct 31, 1999","Nintendo 64, PlayStation","Control issues and dodgy graphics plant Supercross 2000 firmly behind 989 Sports' recent addition to the genre, Supercross Circuit.",MBL Research,Electronic Arts,"Arcade, Driving/Racing",Everyone
https://www.gamespot.com/games/64-oozumou/,64 Oozumou,"Nov 28, 1997",Nintendo 64,Sumo Battle is an action/sports simulation that tries to depict every aspect of what a sumo wrestler must go through.,Bottom Up,Bottom Up,"Fighting, Action, Wrestling",
https://www.gamespot.com/games/star-fox-64/,Star Fox 64,"Jul 1, 1997","3DS, Nintendo 64",Star Fox 64 is the kind of game you will spend many sleepless nights with.,"Q Games, Nintendo",Nintendo,"Shooter, 3D, Action, On-Rails",Kids to Adults
https://www.gamespot.com/games/rocket-robot-on-wheels/,Rocket: Robot on Wheels,"Oct 31, 1999",Nintendo 64,"Its gameplay is diverse yet solid, and it all combines to form a game that will keep you interested for quite some time.",Sucker Punch,Ubisoft,"Action, 3D, Platformer",Everyone
https://www.gamespot.com/games/south-park-rally/,South Park Rally,"Jan 5, 2000","Dreamcast, Nintendo 64, PC, PlayStation","Even though the Dreamcast may possess considerably more processing power under the hood than the Nintendo 64 or PlayStation, nothing seems to be able to hide the fact that South Park Rally is simply not a good game.",Tantalus Interactive,Acclaim,"Driving/Racing, Arcade",Mature
