url,title,release_date,platforms,description,developers,publishers,genres,esrb
https://www.gamespot.com/games/barrage-1998/,Barrage (1998),"Sep 30, 1998",PC,Barrage is heavy on two themes. The first is flying around in a hovercraft. Thesecond is blowing the hell out of anything that even resembles a threat.,Mango Grits,"Activision, Zoo Corporation",Action,Everyone
https://www.gamespot.com/games/balls-of-steel/,Balls of Steel,"Dec 12, 1997","Macintosh, PC","The best pinball games have hidden levels, animated beasties, and plenty of surprises. Balls of Steel has all the above.",Wildfire Studios,"3D Realms, Pinball Wizards, Tec Toy",Pinball,Teen
https://www.gamespot.com/games/baldies/,Baldies,December 1995,"Jaguar CD, PC, PlayStation, Saturn",,Creative Edge Software,"Atari Corporation, Panasonic, Phoenix Games, Bethesda Softworks, Banpresto","Strategy, Real-Time",Kids to Adults
https://www.gamespot.com/games/back-to-baghdad/,Back to Baghdad,"Jul 31, 1996",PC,"If a game does one or two things very well, and other things not so well, is that game a success or a failure?",Military Simulations,Military Simulations,"Simulation, Flight",
https://www.gamespot.com/games/the-residents-bad-day-on-the-midway/,The Residents' Bad Day on the Midway,"Oct 31, 1995","Macintosh, PC","Your goal in Bad Day is like your motivation for reading an engaging novel: to experience it, not solve it.",The Residents and Jim Ludt,Inscape,Adventure,
https://www.gamespot.com/games/azraels-tear/,Azrael's Tear,"Sep 30, 1996",PC,"If you can get past the interface, you can easily get lost in the underground setting of the Knights Templars.","Intelligent Games, Ltd.",Mindscape Inc.,"Adventure, Action",Teen
https://www.gamespot.com/games/ayso-soccer-97/,AYSO Soccer '97,"Mar 31, 1997",PC,"The charming, uniform graphics also invoke the warm nostalgia of a bygone era.",Rage Software,GameTek,"Soccer, Sports, Team-Based, Simulation",Everyone
https://www.gamespot.com/games/axis-and-allies-1998/,Axis & Allies: The Ultimate WWII Strategy Game,"Sep 30, 1998",PC,The result of all of Hasbro's diligent faithfulness to the source is a great version of a classic board game.,Meyer / Glass Interactive,Hasbro Interactive,Trivia/Board Game,Everyone
https://www.gamespot.com/games/chronomaster/,Chronomaster,"Feb 29, 1996","Linux, Macintosh, PC","Chronomaster is filled with incredibly beautiful scenes, and boasts music and sound effects strong enough to back them up.",DreamForge Intertainment,"Mirrorsoft, U.S. Gold, Capstone Software, tewi publishing GmbH, IntraCorp",Adventure,
https://www.gamespot.com/games/bubble-bobble-also-featuring-rainbow-islands/,Bubble Bobble also featuring Rainbow Islands,"Sep 3, 1996","PC, PlayStation, Saturn",Bubble Bobble is a game in which players guide bubble spitting dinosaurs through 125 levels of arcade action.,"Probe Entertainment Limited, Taito Corporation",Acclaim,Compilation,Kids to Adults
https://www.gamespot.com/games/d/,D,1995,"3DO, Linux, Macintosh, PC, PlayStation, Saturn","Stylish, cinematic and creepily atmospheric, D would be a good example to show your friends of what 3-D graphics animators can do on the computer these days.",WARP,"Panasonic, WARP, Sanyei Shobou, Night Dive Studios, Acclaim, Acclaim Japan, Tec Toy",Adventure,Teen
https://www.gamespot.com/games/beetle-buggin/,Beetle Buggin',"Feb 29, 2000",PC,Its varied courses and vehicles enhance its replay value and will keep casual gamers coming back for more.,Xpiral,Infogrames,"Arcade, Driving/Racing",Everyone
https://www.gamespot.com/games/battleground-3-waterloo/,Battleground 3: Waterloo,"May 31, 1996",PC,"While the Battleground series has always featured solid gameplay, this new title adds a grace of play and significant style to the table as well.",TalonSoft,TalonSoft,Strategy,Everyone
https://www.gamespot.com/games/battleground-2-gettysburg/,Battleground 2: Gettysburg,"Dec 31, 1995",PC,"Of the many Civil War strategy games available on the market, Battleground: Gettysburg comes very close to being the best.",TalonSoft,TalonSoft,Strategy,Everyone
https://www.gamespot.com/games/armored-fist-2-m1a2-abrams/,Armored Fist 2: M1A2 Abrams,"Oct 6, 1997",PC,I just felt taken for a ride. And a bumpy one at that.,NovaLogic,NovaLogic,Simulation,Teen
https://www.gamespot.com/games/armored-fist-3/,Armored Fist 3,"Sep 30, 1999",PC,"As a single-player game, it's outdated, and as a multiplayer game, it lacks the variety to provide long-term enjoyment.",NovaLogic,NovaLogic,Simulation,Teen
https://www.gamespot.com/games/armor-command/,Armor Command,"Mar 31, 1998",PC,"Because of the game's, um, different interface, the two 3D views are interesting in application but almost useless in practice.",Ronin Entertainment,Ripcord Games,"Strategy, Real-Time",Everyone
https://www.gamespot.com/games/armed-and-delirious/,Armed & Delirious,"Oct 31, 1997",PC,Armed & Delirious is blander than it thinks it is and certainly less clever and entertaining than it should have been.,Makh-Shevet Ltd.,Sir-Tech Software Inc.,Adventure,Teen
https://www.gamespot.com/games/armored-moon-the-next-eden/,Armored Moon: The Next Eden,"Jan 31, 1998",PC,"It's obvious then that the folks at Microforum who decided to release Armored Moon, its entry into the over-saturated real-time strategy market, had a marked lack of common sense.",Sungjin Multi-media,Microforum,Strategy,
https://www.gamespot.com/games/ark-of-time/,Ark of Time,"Feb 28, 1997","PC, PlayStation",The logic behind some of the puzzles is a little on the dubious side.,"Trecision, ICE","Koei, ICE, Project Two Interactive",Adventure,Everyone
https://www.gamespot.com/games/ares-rising/,Ares Rising,"Aug 31, 1998",PC,"In light of recent space sim successes like Descent: Freespace and Independence War, it's difficult to take Ares Rising too seriously.",Imagine Studios,Imagine Studios,Simulation,Everyone
https://www.gamespot.com/games/area-51-1995/,Area 51 (1995),November 1995,"Arcade Games, PC, PlayStation, Saturn","Area 51 is a shooting game starring a soldier from the elite S.T.A.A.R. forces, sent into Area 51 to eliminate a deadly alien infection that has spread throughout the base.","Atari Games (Midway), Midway, Tantalus Interactive, Mesa Logic","Atari Games (Midway), GT Interactive, Soft Bank, Midway, Tec Toy","Shooter, Action, Light-Gun",Mature
https://www.gamespot.com/games/decisive-battles-of-wwii-the-ardennes-offensive/,Decisive Battles of WWII: The Ardennes Offensive,"May 31, 1997",PC,Combat is where Ardennes distinguishes itself.,Strategic Studies Group,SSI,Strategy,
https://www.gamespot.com/games/apollo-18-the-moon-missions/,Apollo 18: The Moon Missions,"Mar 31, 1999",PC,"You listen to a command, then click the appropriate button. Repeat this about 200 times, and you've got an idea of how thrilling things can get.",AIM Software,Project Two Interactive,Simulation,Everyone
https://www.gamespot.com/games/apache/,Apache,"Jul 31, 1995",PC,"Whether you're a serious armchair pilot or an arcade maniac who likes to blow the hell out of anything and everything in existence, Apache is the game for you.",Digital Integration,"Interactive Magic, Digital Integration, Sold Out","Simulation, Flight",
https://www.gamespot.com/games/battleground-5-antietam/,Battleground 5: Antietam,"Dec 31, 1997",PC,"It may not be the perfect Civil War game, but it's pretty darn close.",TalonSoft,TalonSoft,Strategy,Everyone
https://www.gamespot.com/games/andretti-racing/,Andretti Racing,"Nov 30, 1996","PC, PlayStation, Saturn","You'd think that at 200 mph the scenery would just blow by - instead, the cars seem to move at a light rush-hour crawl.","Stormfront Studios, Press Start Inc., High Score Productions","EA Sports, Electronic Arts, Electronic Arts Victor, Tec Toy","Driving/Racing, Arcade",Kids to Adults
https://www.gamespot.com/games/amok/,Amok,"Oct 31, 1996","PC, Saturn","If you're looking for yet another mech game and don't care if the game is any good or not, Amok might be right up your alley.",Lemon,"GT Interactive, GameBank, Tec Toy, Scavenger, Koei, Sega","Third-Person, 3D, Action, Shooter",Teen
https://www.gamespot.com/games/american-civil-war-from-sumter-to-appomatox/,American Civil War: From Sumter to Appomatox,"May 31, 1996",PC,"Good graphics, a good interface, and gameplay that keeps you coming back for more are this product's strengths.",Interactive Magic,"Adanac Command Studies, Interactive Magic",Strategy,
https://www.gamespot.com/games/amber-journeys-beyond/,Amber: Journeys Beyond,"Nov 30, 1996","Macintosh, PC",Playing this spooky game might have you sleeping with the lights on - at least for a little while.,Hue Forest Entertainment,"Changeling, Sierra Entertainment, Graphic Simulations, NBG EDV","Adventure, First-Person, 3D",
https://www.gamespot.com/games/ama-superbike/,AMA Superbike,"Sep 30, 1999",PC,There's definitely enough full-on action to compensate for the laborious setup sequences.,Motorsims,Motorsims,"Driving/Racing, Simulation",Everyone
https://www.gamespot.com/games/alone-in-the-dark-the-trilogy-1-2-3/,Alone in the Dark: The Trilogy 1+2+3,"Apr 9, 1997",PC,This is a great deal for those who've never played the games.,I Motion,"Interplay, Infogrames",Compilation,Teen
https://www.gamespot.com/games/allied-general/,Allied General,1995,"Macintosh, PC, PlayStation","The term ""Armchair General"" was coined for this kind of game.","SSI, Asylum Entertainment","SSI, Mindscape Inc., Xing Entertainment","Turn-Based, Strategy",Kids to Adults
https://www.gamespot.com/games/star-wars-x-wing-alliance/,Star Wars: X-Wing Alliance,"Feb 28, 1999",PC,"With X-Wing Alliance, Totally Games and LucasArts have at last delivered the game that many players had hoped X-Wing vs. TIE Fighter would be.",Totally Games,"Disney Interactive Studios, LucasArts, Brasoft Produtos de Informatica Ltda.",Simulation,Everyone
https://www.gamespot.com/games/alien-trilogy/,Alien Trilogy,February 1996,"PC, PlayStation, Saturn",Acclaim provides enough firepower for the experienced Marine to show every Alien Queen who's boss.,Probe Entertainment Limited,"Acclaim, Tec Toy, Acclaim Japan","Shooter, 3D, Action, First-Person",Mature
https://www.gamespot.com/games/aliens-online/,Aliens Online,"Mar 31, 1998",PC,"With so much to gain and absolutely nothing to lose, any self-respecting Aliens fan should give Aliens Online a try.",Mythic Entertainment,Kesmai,"Tactical, Action, First-Person, Shooter",
https://www.gamespot.com/games/sid-meiers-alpha-centauri/,Sid Meier's Alpha Centauri,"Jan 31, 1999","Macintosh, PC",Sid Meier's Alpha Centauri is another one of those games that can make hours pass like minutes.,"Westlake Interactive, Firaxis Games","Aspyr, Electronic Arts, Square EA, Sold Out Software, ak tronic","Strategy, Turn-Based",Everyone
https://www.gamespot.com/games/great-battles-of-alexander/,Great Battles of Alexander,"Jun 30, 1997",PC,Admirably re-creates the unique dynamics of ancient warfare.,Erudite Software Inc.,Interactive Magic,"Turn-Based, Strategy",
https://www.gamespot.com/games/air-warrior-ii/,Air Warrior II,"Feb 28, 1997",PC,A worthwhile investment if you're a fan of WWI or WWII flight and fight sims.,Kesmai,"Kesmai, Interactive Magic","Flight, Simulation",
https://www.gamespot.com/games/air-warrior-iii/,Air Warrior III,"Nov 30, 1997",PC,The fact that Air Warrior III is built as an online game is apparent as soon as you jump into the cockpit.,Kesmai,"Interactive Magic, Midas Interactive Entertainment","Simulation, Flight",
https://www.gamespot.com/games/air-power-battle-in-the-skies/,Air Power: Battle in the Skies,"Nov 6, 1995",PC,"As one of four dukes of Karanthia, the game's fictional setting, you must crush your opponents in order to become the supreme emperor.",Rowan Software Ltd.,Mindscape Inc.,"Simulation, Flight",Kids to Adults
https://www.gamespot.com/games/ahx-1/,AHx-1,"Oct 31, 1997",PC,"In a genre that's already given us Hind, Longbow, and the Comanche series,AHx-1 simply doesn't measure up.",Pixel Multimedia,GT Interactive,"Simulation, Flight",Everyone
https://www.gamespot.com/games/enemy-engaged-apache-v-havoc/,Enemy Engaged: Apache V Havoc,"Apr 30, 1999",PC,"Apache Havoc offers a great mix of realism and approachability, so that hard-core fans and novices alike should find a lot to like in the game.",Razorworks Studios,"Frogster Interactive, Empire Interactive","Flight, Simulation",Everyone
https://www.gamespot.com/games/agile-warrior-f-111x/,Agile Warrior F-111X,"Nov 21, 1995","PC, PlayStation","Not-so-exciting gameplay, not-so-absorbing missions, and not-so-hot graphics...",Black Ops Entertainment,Virgin Interactive,"Flight, Simulation",Teen
https://www.gamespot.com/games/age-of-sail/,Age of Sail,"Nov 30, 1996",PC,"Not all the elements of this game have gelled into a satisfying whole, but it's a worthwhile game for any nautical buff.",TalonSoft,"TalonSoft, Empire Interactive",Strategy,Kids to Adults
https://www.gamespot.com/games/wargame-construction-set-iii-age-of-rifles-1846/,Wargame Construction Set III: Age of Rifles 1846-1905,"Aug 31, 1996",PC,"Rifles is a deep, satisfying, wholly entertaining wargame.",SSI,SSI,"Turn-Based, Strategy",
https://www.gamespot.com/games/afterlife-1996/,Afterlife (1996),1996,"Macintosh, PC","As a semi-omnipotent being, you are responsible for laying out a functional heaven and hell to reward or punish the denizens of a strange planet.",LucasArts,"LucasArts, LucasFilm",Strategy,Teen
https://www.gamespot.com/games/after-dark-games/,After Dark Games,"Oct 29, 1998","Macintosh, PC","Unless you have an enormous crush on Hula Girl, you can do better elsewhere.",Berkeley Systems,"Sierra Online, Sierra Entertainment",Party/Minigame,Everyone
https://www.gamespot.com/games/admiral-sea-battles/,Admiral Sea Battles,"Sep 30, 1996",PC,"Deadly slow pacing, overly difficult missions, no individual scenarios, mystifying approaches to victory, and frankly, lean gameplay make this one a non-starter.",Meridian 93,Megamedia,"Turn-Based, Strategy",
https://www.gamespot.com/games/addiction-pinball/,Addiction Pinball,"Apr 30, 1998",PC,"While it doesn't have the ultrarealism of a game such as Pro Pinball: Timeshock, Addiction Pinball offers more sensory gratification.",Team 17,"MicroProse, Team 17, Novitas GmbH, Crucial Entertainment",Pinball,Everyone
https://www.gamespot.com/games/achtung-spitfire/,Achtung! Spitfire,"Aug 31, 1997","Macintosh, PC",Achtung Spitfire is a wargamer's dream.,Big Time Software,Avalon Hill,"Strategy, Real-Time",
https://www.gamespot.com/games/ace-ventura/,Ace Ventura,"Oct 31, 1996",PC,It's Ace's lowbrow humor that makes this a fun game to play.,7th Level,"7th Level, Bomico Entertainment Software",Adventure,Teen
https://www.gamespot.com/games/absolute-zero-1995/,Absolute Zero (1995),"Dec 31, 1995","Macintosh, PC","The story is well-conceived and fresh, following the lives of 24th century humans who have finally mastered cold fusion, and buzz around the solar system like busy bees.",Domark,"Spectrum Holobyte, Eidos Interactive, Domark",Simulation,
https://www.gamespot.com/games/abomination/,Abomination,"Oct 31, 1999",PC,It's a real-time tactical action game with very little underlying strategy.,Hothouse Creations,Eidos Interactive,"Real-Time, Strategy",Mature
https://www.gamespot.com/games/oddworld-abes-exoddus/,Oddworld: Abe's Exoddus,"Oct 31, 1998","PC, PlayStation","If you hated the first one, it's likely because of the lack of save points, so you should definitely consider giving this series another try.","Digital Dialect, Oddworld Inhabitants","GT Interactive, Infogrames, GT Software, Oddworld Inhabitants, Riverhillsoft, SCEA","Action, 2D, Platformer",Teen
https://www.gamespot.com/games/abc-monday-night-football-98/,ABC Monday Night Football '98,"Sep 30, 1997",PC,"MNF '98 is definitely an improvement over its predecessor, but it still has aways to go before it can be considered a true champion.",Overtime Sports,ABC Interactive,"Simulation, Sports, Team-Based, Football (American)",Kids to Adults
https://www.gamespot.com/games/aaron-vs-ruth-battle-of-the-big-bats/,Aaron vs. Ruth: Battle of the Big Bats,"Jun 30, 1997",PC,Too much attention was paid to shelf appeal and not nearly enough to actual design.,Mindscape Inc.,Mindscape Inc.,"Sports, Team-Based, Baseball, Simulation",Everyone
https://www.gamespot.com/games/a-10-cuba/,A-10 Cuba!,"Nov 30, 1996","Macintosh, PC","Longtime flight-sim fans will take to the realism of A-10 Cuba! like ducks to water, and forgive it its shortcomings.","Parsoft, Match Software","Parsoft, Activision","Flight, Simulation",Everyone
https://www.gamespot.com/games/ultimate-8-ball/,Ultimate 8 Ball,"May 31, 1999","PC, PlayStation","Ever wanted to play pool against Satan? Hey, who hasn't?",Mirage Interactive,"THQ, Zoo Digital Publishing, Gremlin Interactive","Sports, Billiards",Everyone
https://www.gamespot.com/games/7th-legion/,7th Legion,"Sep 24, 1997",PC,The developers of 7th Legion forgot to include something in their game: strategy.,Epic Games,"Night Dive Studios, MicroProse","Real-Time, Strategy",Teen
https://www.gamespot.com/games/688-i-hunter-killer/,688(I) Hunter/Killer,"Jun 30, 1997",PC,"At last, the long wait for a worthy nuclear submarine simulation is over.",Sonalysts,"Electronic Arts, Strategy First",Simulation,Kids to Adults
https://www.gamespot.com/games/3d-lemmings/,3D Lemmings,"Jul 31, 1995","PC, PlayStation, Saturn","With addictive gameplay, numerous levels, and cute little rodents, 3D Lemmings is a must-buy.","Clockwork Games, Perfect Entertainment","Psygnosis, Dice Multi Media, SCE Australia, SCEI, Imagineer","Action, Puzzle",Kids to Adults
https://www.gamespot.com/games/12-oclock-high-bombing-the-reich/,12 O'Clock High: Bombing the Reich,"Nov 30, 1999",PC,12 O'Clock High is a meticulously researched wargame that unfortunately doesn't add up.,TalonSoft,Take-Two Interactive,"Real-Time, Strategy",Everyone
https://www.gamespot.com/games/101-airborne-the-airborne-invasion-of-normandy/,101 Airborne: The Airborne Invasion of Normandy,"Sep 30, 1998",PC,"101 simulates the chaos of an airborne drop very well, and the level of detail is tremendous.",Empire Interactive,"Empire Interactive, Empire Interactive Europe, UIG Entertainment","Turn-Based, Strategy",Teen
https://www.gamespot.com/games/ncaa-football-2000/,NCAA Football 2000,"Jun 30, 1999",PlayStation,"While its not leaps and bounds beyond the previous game, all of the other little extras make it well worth your money.",EA Sports,EA Sports,"Simulation, Sports, Team-Based, Football (American)",Everyone
https://www.gamespot.com/games/mlb-2001/,MLB 2001,"Feb 29, 2000",PlayStation,"Pacing and sound issues aside, 989 Studios has fixed many of the glaring flaws of last year's release and as such has created a game superior to EA's offering.",989 Sports,SCEA,"Simulation, Sports, Team-Based, Baseball",Everyone
https://www.gamespot.com/games/ballistic-1999/,Ballistic (1999),December 1998,"Arcade Games, Game Boy Color, iOS (iPhone/iPad), Nuon, PlayStation","Despite the simplistic nature of the game and sheer mediocrity of many of the game elements, Ballistic is still a fairly fun puzzle game with a refreshingly new premise.","Mitchell, Hudson, Infogrames","Mitchell, Capcom, Infogrames, Hudson, Nuon, THQ","Puzzle, Action",Everyone
https://www.gamespot.com/games/ballblazer-champions/,Ballblazer Champions,"Mar 31, 1997",PlayStation,Ballblazer Champions has everything that a remake could want.,Factor 5,"CTO SpA, Bullet Proof Software, LucasArts",Sports,Kids to Adults
https://www.gamespot.com/games/backstreet-billiards/,Backstreet Billiards,"Nov 30, 1998",PlayStation,It's the most complete pool-simulation game around for the PlayStation.,Agenda,"Argent, ASCII Entertainment","Sports, Billiards",Everyone
https://www.gamespot.com/games/auto-destruct/,Auto Destruct,"Feb 28, 1998",PlayStation,"Auto Destruct could've been a modernized city-based version of Midway's Spy Hunter, but it ended up as a G Police that got grounded.",Neurostone,Electronic Arts,Simulation,Teen
https://www.gamespot.com/games/high-heat-baseball-2000/,High Heat Baseball 2000,"Mar 31, 1999","PC, PlayStation",High Heat Baseball 2000 is easily the worst baseball game to come out for the PlayStation this year.,Team .366,3DO,"Simulation, Sports, Team-Based, Baseball",Everyone
https://www.gamespot.com/games/sammy-sosa-high-heat-baseball-2001/,Sammy Sosa High Heat Baseball 2001,"Mar 7, 2000","PC, PlayStation","Though the latest version of High Heat suffers from a number of minor flaws once again, it's still the early favorite to capture best-of-breed honors in PC baseball sims this year.",Team .366,3DO,"Sports, Team-Based, Baseball, Simulation",Everyone
https://www.gamespot.com/games/disneys-hercules-action-game/,Disney's Hercules Action Game,"Jul 1, 1997","PC, PlayStation",Hercules is a game not to be missed.,Eurocom Entertainment Software,"Disney Interactive Studios, Disney Interactive, Virgin Interactive, SCEE, Majesco Games","2D, Platformer, Action",Kids to Adults
https://www.gamespot.com/games/hercs-adventures/,Herc's Adventures,"Jul 15, 1997","PlayStation, Saturn","The graphics, gameplay, and humor make a unique mix that results in a truly fresh title.",Big Ape Productions,"Virgin Interactive, LucasArts, SCEA, Bullet Proof Software","Action, Adventure",Kids to Adults
https://www.gamespot.com/games/hello-kittys-cube-frenzy/,Hello Kitty's Cube Frenzy,"Mar 31, 1999","Game Boy Color, PlayStation","A few screamed expletives and chucked controllers later, you are rewarded with the sight of Hello Kitty Angel, and honestly, what more could you possibly want?","Torus Games, Culture Publishers","NewKidCo, D3Publisher, Culture Publishers","Action, Puzzle",Everyone
https://www.gamespot.com/games/hardball-99/,HardBall 99,"Oct 31, 1998",PlayStation,"For gamers who really get into statistical tracking or team management, HardBall 99's stat-o-rama-based gameplay makes this title a great first choice.",MindSpan,Accolade,"Baseball, Simulation, Sports, Team-Based",Everyone
https://www.gamespot.com/games/gundam-the-battle-master/,Gundam: The Battle Master,"Jun 20, 1997",PlayStation,"If you've absolutely got to have an import fighting game, get Tobal 2.",Natsume,Bandai,"2D, Action, Fighting",
https://www.gamespot.com/games/point-blank-2/,Point Blank 2,1994,"Arcade Games, PlayStation","Fans of Point Blank will certainly not be disappointed, and those who thought Point Blank was a bit too remedial will probably be right at home.","Namco, TOSE","Namco, SCEE","Light-Gun, Action, Shooter",Teen
https://www.gamespot.com/games/guilty-gear/,Guilty Gear,"Oct 31, 1998","Nintendo Switch, PC, PlayStation, PlayStation 4","These fighters are a mix of the usual Ken/Ryu/Zangief ilk, with a little Samurai Shodown thrown in for good measure.",Arc System Works,"Arc System Works, PQube, Virgin Interactive, System 3, ATLUS","2D, Fighting, Action",Teen
https://www.gamespot.com/games/grand-theft-auto/,Grand Theft Auto,"Feb 28, 1998","Game Boy Color, PC, PlayStation","If you're armed with weapons and a strong disrespect for authority, you might just want to take that Body Count song to heart and become a cop killer.","Tarantula Studios, DMA Design, Rockstar Toronto, Visual Sciences","Rockstar Games, BMG Interactive Entertainment, Take-Two Interactive, ASC Games, M3, Sold Out Software, GungHo, Syscom","Adventure, Action",Mature
https://www.gamespot.com/games/grand-slam/,Grand Slam,1996,"PC, PlayStation, Saturn","If you can stomach Grand Slam's gameplay, the rest of the game is pretty easy to swallow.",Burst Studios,Virgin Interactive,"Baseball, Simulation, Sports, Team-Based",Kids to Adults
https://www.gamespot.com/games/car-and-driver-presents-grand-tour-racing-98/,Car and Driver Presents: Grand Tour Racing '98,"Sep 30, 1997",PlayStation,"Grand Tour Racing may not be perfect, but at times comes close.",Eutechnyx,"Activision, ATLUS, Ocean","Driving/Racing, Simulation",Kids to Adults
https://www.gamespot.com/games/grid-runner/,Grid Runner,"Oct 31, 1996","PC, PlayStation, Saturn",Grid Runner operates under a simple premise: Tag the other guy and capture flags.,Radical Entertainment,"Virgin Interactive, Tec Toy",Action,Kids to Adults
https://www.gamespot.com/games/gradius-gaiden/,Gradius Gaiden,"Aug 28, 1997",PlayStation,"While it can't compete with the graphics of Star Fox 64 or RayStorm, gameplay is what counts, and Gradius Gaiden delivers.",KCET,Konami,"Action, Shoot-'Em-Up, 2D",
https://www.gamespot.com/games/g-police/,G-Police,"Sep 30, 1997","PC, PlayStation","The excitement never really builds, let alone climaxes.","Psygnosis, Wheelhaus","Psygnosis, SCEI, SCEE","Simulation, Flight",Everyone
https://www.gamespot.com/games/g-police-weapons-of-justice/,G-Police: Weapons of Justice,"Aug 31, 1999",PlayStation,G Police 2 makes few improvements over the original and never really overcomes the issues that plagued its predecessor.,Psygnosis,"SCEE, Psygnosis","Flight, Simulation",Teen
https://www.gamespot.com/games/gauntlet-legends/,Gauntlet Legends,October 1998,"Arcade Games, Dreamcast, Nintendo 64, PlayStation","Unfortunately, this game is another piece of evidence that indicates that some classics should be left well enough alone.","Atari Games (Midway), Midway","Atari Games (Midway), SNK, Midway, Epoch","Action, Role-Playing",Teen
https://www.gamespot.com/games/nfl-gameday-99/,NFL GameDay 99,"Jul 31, 1998","PC, PlayStation",In the end GameDay 99 is the total package.,"989 Sports, Red Line Studios",989 Sports,"Team-Based, Football (American), Simulation, Sports",Everyone
https://www.gamespot.com/games/nfl-gameday-98/,NFL GameDay 98,"Jul 31, 1997",PlayStation,NFL GameDay '98 is a great technical feat and a very fun football game.,989 Studios,SCEA,"Simulation, Sports, Team-Based, Football (American)",Kids to Adults
https://www.gamespot.com/games/all-star-baseball/,All-Star Baseball '97 Featuring Frank Thomas,"Jun 30, 1997","PlayStation, Saturn",,Iguana Entertainment,Acclaim,"Simulation, Sports, Team-Based, Baseball",Kids to Adults
