url,title,release_date,platforms,description,developers,publishers,genres,esrb
https://www.gamespot.com/games/ultimate-fighting-championship-tapout/,Ultimate Fighting Championship: Tapout,"Feb 17, 2002",Xbox,"On its own merits, UFC: Tapout is an excellent, original fighting game that's especially fun for two players.",DreamFactory,"Capcom, Ubisoft, Crave","Sports, Boxing",Teen
https://www.gamespot.com/games/forever-kingdom/,Forever Kingdom,"Jan 21, 2002",PlayStation 2,Some players will find that the more unique aspects of Forever Kingdom make it a worthwhile title even though it's merely adequate in most respects.,From Software,"From Software, Agetec Inc.","Role-Playing, Action",Teen
https://www.gamespot.com/games/circus-maximus-chariot-wars/,Circus Maximus: Chariot Wars,"Feb 24, 2002","PlayStation 2, Xbox","Actually competing in a deadly chariot race is an intriguing concept for a game, but Circus Maximus doesn't manage to make the experience all that exciting.",Kodiak Interactive,"THQ, Encore Software, Inc.","Driving/Racing, Arcade",Teen
https://www.gamespot.com/games/tony-hawks-pro-skater-3/,Tony Hawk's Pro Skater 3,"Oct 30, 2001","Game Boy Advance, Game Boy Color, GameCube, Macintosh, Nintendo 64, PC, PlayStation, PlayStation 2, Xbox",Tony Hawk's Pro Skater 3 strikes a perfect balance between new and old and renders the two previous entries in the series almost completely obsolete in the process.,"Vicarious Visions, HotGen, Neversoft Entertainment, Beenox, Edge of Reality, Gearbox Software, Shaba Games","Activision, Success, Aspyr","Skateboarding/Skating, Sports",Teen
https://www.gamespot.com/games/dark-summit/,Dark Summit,"Nov 12, 2001","GameCube, PlayStation 2, Xbox",The GameCube version of Dark Summit is a good snowboarding game that has a small list of minor problems.,Radical Entertainment,THQ,"Snowboarding/Skiing, Sports",Teen
https://www.gamespot.com/games/star-wars-racer-revenge/,Star Wars: Racer Revenge,"Feb 11, 2002","PlayStation 2, PlayStation 4","Racer Revenge is good-looking game that's a whole lot of fun while it lasts, which unfortunately isn't very long at all.","Rainbow Studios, LucasArts","LucasArts, SCEA, Disney Interactive Studios, Disney Interactive, Limited Run Games","Driving/Racing, Arcade",Everyone
https://www.gamespot.com/games/jeremy-mcgrath-supercross-world/,Jeremy McGrath Supercross World,"Nov 14, 2001","GameCube, PlayStation 2",The game is a thoroughly bland cross between the simulation and arcade styles of MX games.,Acclaim Studios Salt Lake City,Acclaim,"Arcade, Driving/Racing",Teen
https://www.gamespot.com/games/nba-2k2/,NBA 2K2,"Oct 24, 2001","Dreamcast, GameCube, PlayStation 2, Xbox","The improvements in the game, although subtle on the surface, are substantial for serious fans of the NBA.",Visual Concepts,Sega,"Simulation, Sports, Team-Based, Basketball",Everyone
https://www.gamespot.com/games/nhl-2k2/,NHL 2K2,"Feb 14, 2002",Dreamcast,NHL 2K2 is a great game of hockey that any hockey fan who owns a Dreamcast should really consider picking up.,Treyarch,Sega,"Hockey, Simulation, Sports, Team-Based",Everyone
https://www.gamespot.com/games/espn-international-winter-sports-2002/,ESPN International Winter Sports 2002,"Jan 28, 2002","Game Boy Advance, GameCube, PlayStation 2, Xbox",The gameplay mechanics that proved oh-so-satisfying more than a decade ago fail to impress today.,"KCEO, Konami",Konami,Sports,Everyone
https://www.gamespot.com/games/salt-lake-2002/,Salt Lake 2002,"Jan 19, 2002","Game Boy Advance, PC, PlayStation 2",This game will feature six official events based on the 2002 Olympic Winter Games.,"DC Studios, Attention To Detail","Ubisoft, Eidos Interactive",Sports,Everyone
https://www.gamespot.com/games/super-mario-world/,Super Mario World,"Aug 13, 1991","Game Boy Advance, Super Nintendo",Mario's first Super Nintendo adventure is regarded by many as his best to date.,Nintendo,"iQue, Nintendo, Mattel, Playtronic, Hyundai Electronics","Platformer, Action, 2D",Everyone
https://www.gamespot.com/games/eoe-eve-of-extinction/,EOE: Eve of Extinction,"Feb 26, 2002",PlayStation 2,"Yuke's has taken the classic beat-'em-up gameplay and mixed it with the evil corporation motif, creating Eve of Extinction, a game with lofty aspirations but only moderate means.",Yuke's,Eidos Interactive,"Adventure, Action",Teen
https://www.gamespot.com/games/fatal-frame/,Fatal Frame,"Mar 4, 2002","PlayStation 2, Xbox","If games such as Silent Hill and Resident Evil interest you, this should be right up your alley.",Tecmo,"Tecmo, Wanadoo, SCEA, SCEI, Microsoft Game Studios","3D, Action, Adventure, Survival",Teen
https://www.gamespot.com/games/mimesis-online/,Mimesis Online,"Jan 16, 2002",PC,"Mimesis Online has a long way to go before it is worth your bandwidth, your time, or your money.",Tannhauser Gate,Tannhauser Gate,"MMO, Role-Playing",
https://www.gamespot.com/games/moto-racer-3/,Moto Racer 3,"Jan 31, 2002",PC,"In attempting to be all things to all PC motorcycle enthusiasts, Moto Racer 3 isn't quite as enjoyable or as polished as it could have been.",Delphine Software International,"Infogrames, Delphine Software International, Sold Out Software","Driving/Racing, Arcade",Everyone
https://www.gamespot.com/games/espn-nba-2night-2002/,ESPN NBA 2Night 2002,"Feb 25, 2002","PlayStation 2, Xbox",ESPN NBA 2Night 2002 really has nothing that would make it worth recommending over a number of other basketball games for the PlayStation 2.,Konami,Konami,"Simulation, Sports, Team-Based, Basketball",Everyone
https://www.gamespot.com/games/espn-winter-x-games-snowboarding-2002/,ESPN Winter X-Games Snowboarding 2002,"Jan 14, 2002","Game Boy Advance, PlayStation 2, Xbox",ESPN Winter X-Games Snowboarding 2002 demonstrates that an average game ported to a more powerful console is still an average game.,"KCEO, Konami",Konami,"Snowboarding/Skiing, Sports",Teen
https://www.gamespot.com/games/tiger-woods-pga-tour-2002/,Tiger Woods PGA Tour 2002,"Feb 24, 2002","PC, PlayStation 2",EA Sports has finally created a true 3D golf game that matches the quality of its bigger sports game series.,"Headgate, EA Sports","EA Sports, Electronic Arts","Simulation, Golf, Sports",Everyone
https://www.gamespot.com/games/tiger-woods-pga-tour-2002/,Tiger Woods PGA Tour 2002,"Feb 24, 2002","PC, PlayStation 2",EA Sports has finally created a true 3D golf game that matches the quality of its bigger sports game series.,"Headgate, EA Sports","EA Sports, Electronic Arts","Golf, Simulation, Sports",Everyone
https://www.gamespot.com/games/high-heat-major-league-baseball-2003/,High Heat Major League Baseball 2003,"Feb 11, 2002","Game Boy Advance, PC, PlayStation 2",High Heat again ups the ante where gameplay is concerned but still fails to match the graphical finesse of its competitors.,"Mobius Entertainment, 3DO","Takara, 3DO","Simulation, Sports, Team-Based, Baseball",Everyone
https://www.gamespot.com/games/nba-jam-2002/,NBA Jam 2002,"Feb 21, 2002",Game Boy Advance,"Several problems ultimately keep NBA Jam 2002 from attaining all-star status. But all things considered, it's still a decent handheld rendition of two-on-two basketball.",DC Studios,Acclaim,"Arcade, Basketball, Sports, Team-Based",Everyone
https://www.gamespot.com/games/pac-man-world-2/,Pac-Man World 2,"Feb 24, 2002","Game Boy Advance, GameCube, PC, PlayStation 2, Xbox","Pac-Man World 2 is a great platform game overall, one that anybody who's into the lighthearted style of the game would do well to check out.","Full Fat, Namco","Zoo Digital Publishing, Namco, Electronic Arts, LSP, Hip Games, SCEE","3D, Action, Platformer",Everyone
https://www.gamespot.com/games/trainz/,Trainz,"Feb 10, 2002",PC,"If you've ever been captivated by the romance of the rails or have perhaps thought of dabbling in model railroading, Trainz could easily make an enthusiastic convert of you.",Auran,Strategy First,"Management, Strategy",Everyone
https://www.gamespot.com/games/druuna-morbus-gravis/,Druuna: Morbus Gravis,"Nov 27, 2001",PC,"It not only makes all the wrong moves, but it also finds new and innovative ways to make them.",Artematica,Microids,"Adventure, Action",Mature
https://www.gamespot.com/games/world-tour-soccer-2002/,World Tour Soccer 2002,"Feb 17, 2002",PlayStation 2,"If you demand more from gameplay than what the FIFA series is currently offering, World Tour Soccer 2002 is a wise choice.",Team Soho,"SCEE, SCE Australia, 989 Sports","Team-Based, Simulation, Soccer, Sports",Everyone
https://www.gamespot.com/games/mall-tycoon/,Mall Tycoon,"Feb 3, 2002",PC,Mall Tycoon is more trouble than it's worth.,"Holistic Design, Inc.","Take-Two Interactive, ak tronic","Strategy, Management",Everyone
https://www.gamespot.com/games/columns-crown/,Columns Crown,"Feb 4, 2002",Game Boy Advance,"Although it's not as energetic or complex as many modern-day puzzle games, it doesn't really disappoint in any specific area either.",Wow Entertainment,"THQ, Sega","Matching/Stacking, Puzzle",Everyone
https://www.gamespot.com/games/nascar-racing-2002-season/,NASCAR Racing 2002 Season,"Feb 14, 2002",PC,NASCAR Racing 2002 Season proves once again that Papyrus is one of the most faithful and knowledgeable purveyors of racing games on the planet.,Papyrus,Sierra Entertainment,"Simulation, Driving/Racing",Everyone
https://www.gamespot.com/games/knockout-kings-2002/,Knockout Kings 2002,"Mar 4, 2002","PlayStation 2, Xbox","Knockout Kings 2002 is the first version of the game for the Xbox, and it's certainly the best of the series to date.",Electronic Arts,Electronic Arts,"Sports, Boxing",Teen
https://www.gamespot.com/games/knockout-kings-2002/,Knockout Kings 2002,"Mar 4, 2002","PlayStation 2, Xbox","Knockout Kings 2002 is the first version of the game for the Xbox, and it's certainly the best of the series to date.",Electronic Arts,Electronic Arts,"Boxing, Sports",Teen
https://www.gamespot.com/games/puyo-pop/,Puyo Pop,"Feb 11, 2002","Game Boy Advance, N-Gage",The joy of Puyo Pop lies in its gameplay.,"Sonic Team, Sega","Sega, THQ, Nokia","Puzzle, Matching/Stacking",Everyone
https://www.gamespot.com/games/shadow-force-razor-unit/,Shadow Force: Razor Unit,"Feb 24, 2002",PC,You mainly run around 10 bland variations of a single desert level while shooting at the same two enemies.,FUN Labs,Activision Value,"Shooter, 3D, Action, First-Person",Mature
https://www.gamespot.com/games/tom-clancys-rainbow-six-rogue-spear/,Tom Clancy's Rainbow Six: Rogue Spear,"Aug 31, 1999","Dreamcast, Macintosh, PC, PlayStation","Though Rogue Spear is in many ways a much better game than its similar predecessor, it too is not without a laundry list of problems.","Pipe Dream Interactive, Red Storm Entertainment, Saffire","Swing! Deutschland, Red Storm Entertainment, MacSoft, Ubisoft","Tactical, Action, First-Person, Shooter",Teen
https://www.gamespot.com/games/the-sims/,The Sims,"Jan 31, 2000","GameCube, Macintosh, PC, PlayStation 2, Xbox",The PS2 game makes solid additions and a few improvements to The Sims' basic gameplay--but that gameplay has aged.,"Edge of Reality, Maxis","EA Games, Electronic Arts, Aspyr, Maxis",Simulation,Teen
https://www.gamespot.com/games/grandia-ii/,Grandia II,"Dec 6, 2000","Dreamcast, PC, PlayStation 2","Game Arts has put together a solid RPG with Grandia II, even if it isn't as deep or difficult as the original.","Game Arts, SkyBox Labs","Ubisoft, Game Arts, GungHo, Frogster Interactive, eSofnet, Enix Corporation",Role-Playing,Teen
https://www.gamespot.com/games/sled-storm/,Sled Storm,"Jul 31, 1999","PlayStation, PlayStation 2","For any gamer looking for a uniquely fresh adrenaline rush, Sled Storm makes for one very worthy purchase.","EA Canada, Electronic Arts","Electronic Arts, EA Sports Big","Arcade, Driving/Racing",Teen
https://www.gamespot.com/games/ultima-online/,Ultima Online,"Sep 30, 1997",PC,"In its current form, Ultima Online is a major disappointment.","Electronic Arts, EA Games, Origin","Electronic Arts, EA Games","Role-Playing, MMO",Mature
https://www.gamespot.com/games/mike-tyson-boxing/,Mike Tyson Boxing,"Oct 23, 2000","Game Boy Advance, PlayStation",Mike Tyson's Boxing just doesn't have the depth of Knockout Kings or the immediate satisfaction found from the arcade style of play in Ready 2 Rumble.,"Virtucraft, Codemasters","Ubisoft, Codemasters","Boxing, Sports",Teen
https://www.gamespot.com/games/star-trek-bridge-commander/,Star Trek Bridge Commander,"Feb 27, 2002",PC,Totally Games has managed to accurately translate the slow-paced tactical battles of the Star Trek universe into an interesting game.,Totally Games,Activision,Simulation,Everyone
https://www.gamespot.com/games/pirates-the-legend-of-black-kat/,Pirates: The Legend of Black Kat,"Feb 17, 2002","PlayStation 2, Xbox","Pirates is like a Zelda-meets-Tomb Raider, though the actual environments you'll explore are pretty original, as is the method by which you'll get around.",Westwood Studios,Electronic Arts,"Adventure, Action",Teen
https://www.gamespot.com/games/james-bond-007-agent-under-fire/,James Bond 007: Agent Under Fire,"Nov 13, 2001","GameCube, PlayStation 2, Xbox","Agent Under Fire isn't a horrible game, but its lackluster level design, poor enemy AI, and easy level of difficulty pile up to detract from what it does offer greatly.","EA Redwood Shores, Electronic Arts",Electronic Arts,"First-Person, Shooter, 3D, Action",Teen
https://www.gamespot.com/games/warrior-kings/,Warrior Kings,"Apr 13, 2002","Macintosh, PC",Warrior Kings is a very good 3D real-time strategy game that could have been great.,"Zonic, Black Cactus","Feral Interactive, Strategy First, Sega, Microids, Empire Interactive, Frogster Interactive","Real-Time, Strategy",Teen
https://www.gamespot.com/games/motogp/,MotoGP,"Mar 8, 2002","Game Boy Advance, Mobile, N-Gage, PC, Xbox","While it doesn't have as many tracks or as much replay value as we'd like, MotoGP definitely deserves a spot on your shelf.","Visual Impact, Cybiko, THQ, Climax Group","THQ, MTO, Nokia, ak tronic","Simulation, Driving/Racing",Everyone
https://www.gamespot.com/games/herdy-gerdy/,Herdy Gerdy,"Mar 4, 2002",PlayStation 2,Another five or six months in the cooker and Herdy Gerdy could have really been something special.,Core Design Ltd.,"Eidos Interactive, Hanbitsoft","Action, Adventure",Everyone
https://www.gamespot.com/games/global-operations/,Global Operations,"Mar 25, 2002",PC,"If you don't care about the single-player game, if you have a high-speed Internet connection, and if you can find a good server, then Global Operations is great.",Barking Dog,"Crave, Square EA, Electronic Arts, Sold Out Software","First-Person, Shooter, Tactical, Action",Mature
https://www.gamespot.com/games/triple-play-2002/,Triple Play 2002,"Mar 11, 2002","PlayStation 2, Xbox","The game's great graphics, involving gameplay, and great commentary all blend together to deliver an exciting and authentic game of baseball.",Pandemic Studios,Electronic Arts,"Simulation, Sports, Team-Based, Baseball",Everyone
https://www.gamespot.com/games/triple-play-2002/,Triple Play 2002,"Mar 11, 2002","PlayStation 2, Xbox","The game's great graphics, involving gameplay, and great commentary all blend together to deliver an exciting and authentic game of baseball.",Pandemic Studios,Electronic Arts,"Simulation, Sports, Team-Based, Baseball",Everyone
https://www.gamespot.com/games/virtua-fighter-4/,Virtua Fighter 4,2001,"Arcade Games, PlayStation 2","You can't tell right off the bat, but Virtua Fighter 4 is the best fighting game in years.",Sega AM2,"Sega, SCEE","Action, 3D, Fighting",Teen
https://www.gamespot.com/games/wta-tour-tennis/,WTA Tour Tennis,"Mar 26, 2002","Game Boy Advance, GameCube, PlayStation 2, Xbox","WTA Tour Tennis offers a decent game of tennis, but the game's biggest strength is its lack of competition.","Now Production, Konami",Konami,"Tennis, Sports",Everyone
https://www.gamespot.com/games/heroes-of-might-and-magic-iv/,Heroes of Might and Magic IV,"Mar 28, 2002","Macintosh, PC",The Heroes formula clearly stands the test of time in Heroes IV and is every bit as enjoyable as it's ever been in previous games.,"3DO, New World Computing","3DO, Mastertronic, MediaQuest, Ubisoft, Sold Out Software, ak tronic","Turn-Based, Strategy",Everyone
https://www.gamespot.com/games/hot-shots-golf-3/,Hot Shots Golf 3,"Mar 12, 2002",PlayStation 2,"Fans of the series, or anyone looking for a consistently goofy, lighthearted golf game, will surely be pleased.",Clap Hanz,"SCEA, SCEI","Golf, Arcade, Sports",Everyone
https://www.gamespot.com/games/blood-omen-2/,Blood Omen 2,"Mar 21, 2002","GameCube, PC, PlayStation 2, Xbox",It's worth playing to those lonely for another vampire game or wanting a change of pace from all the first-person shooters.,Crystal Dynamics,"Eidos Interactive, Square Enix","Adventure, Survival, 3D, Action",Mature
https://www.gamespot.com/games/crash-bandicoot-the-wrath-of-cortex/,Crash Bandicoot: The Wrath of Cortex,"Nov 1, 2001","GameCube, PlayStation 2, Xbox","For better or worse, The Wrath of Cortex is no different from previous Crash Bandicoot games.",Traveller's Tales,"Universal Interactive, VU Games, Konami, Hanbitsoft","3D, Platformer, Action",Everyone
https://www.gamespot.com/games/dark-arena/,Dark Arena,"Jan 18, 2002",Game Boy Advance,"Many of its little touches are quite impressive, but there are clearly more memorable shooters of its kind already available.",Graphic State,"Majesco Games, THQ","3D, Action, First-Person, Shooter",Teen
https://www.gamespot.com/games/spy-hunter/,Spy Hunter,1984,"Game Boy Advance, GameCube, Macintosh, PC, PlayStation 2, Xbox, Zodiac",It's a solid reinterpretation of a video game classic that adds its own unique elements to the franchise without forsaking what made Spy Hunter what it was.,"Midway, Point of View, Fluent, Paradigm Entertainment, Fathammer","Midway, Aspyr, Sega","Arcade, Driving/Racing",Teen
https://www.gamespot.com/games/tom-clancys-ghost-recon/,Tom Clancy's Ghost Recon,"Nov 13, 2001","GameCube, Macintosh, PC, PlayStation 2, Xbox",The lack of online play really hurts the game.,Red Storm Entertainment,"Ubisoft, Aspyr, Microsoft Game Studios","First-Person, Shooter, Tactical, Action",Mature
https://www.gamespot.com/games/driven/,Driven,"Nov 6, 2001","Game Boy Advance, GameCube, PlayStation 2","If you're looking for a racing game that is easy to control but extremely difficult, Driven fits the bill.","Crawfish Interactive, Bam Entertainment",Bam Entertainment,"Driving/Racing, Simulation",Teen
https://www.gamespot.com/games/tony-hawks-pro-skater-3/,Tony Hawk's Pro Skater 3,"Oct 30, 2001","Game Boy Advance, Game Boy Color, GameCube, Macintosh, Nintendo 64, PC, PlayStation, PlayStation 2, Xbox",Tony Hawk's Pro Skater 3 strikes a perfect balance between new and old and renders the two previous entries in the series almost completely obsolete in the process.,"Vicarious Visions, HotGen, Neversoft Entertainment, Beenox, Edge of Reality, Gearbox Software, Shaba Games","Activision, Success, Aspyr","Skateboarding/Skating, Sports",Teen
https://www.gamespot.com/games/star-wars-jedi-knight-ii-jedi-outcast/,Star Wars Jedi Knight II: Jedi Outcast,"Mar 26, 2002","GameCube, Macintosh, Nintendo Switch, PC, PlayStation 4, Xbox",Jedi Outcast is simply one of the easiest games to recommend this year.,"Vicarious Visions, LucasArts, Aspyr, Raven Software","Activision, LucasArts, Aspyr, Limited Run Games, THQ Nordic, Cosmi, CyberFront, Electronic Arts","Adventure, Action",Teen
https://www.gamespot.com/games/savage-skies/,Savage Skies,"Dec 30, 2001","PC, PlayStation 2","Savage Skies can be entertaining at times, so it's not bad. But its flaws generally outweigh its strengths.",iRock Interactive,"Success, Bam Entertainment, BigBen Interactive","3D, Action, Shooter, Third-Person",Mature
https://www.gamespot.com/games/nba-2k2/,NBA 2K2,"Oct 24, 2001","Dreamcast, GameCube, PlayStation 2, Xbox","The improvements in the game, although subtle on the surface, are substantial for serious fans of the NBA.",Visual Concepts,Sega,"Simulation, Sports, Team-Based, Basketball",Everyone
https://www.gamespot.com/games/shadow-man-2econd-coming/,Shadow Man: 2econd Coming,"Feb 28, 2002",PlayStation 2,"Despite its flaws, Shadow Man 2econd Coming will likely manage to draw you in, especially if you can get into the creepy aesthetics and earnestly engaging story.",Acclaim Studios Teeside,Acclaim,"3D, Action, Adventure, Survival",Mature
https://www.gamespot.com/games/zone-of-the-enders-the-fist-of-mars/,Zone of the Enders: The Fist of Mars,"Mar 3, 2002",Game Boy Advance,"Although tactical combat is the focus of the title, Konami has infused an element of hands-on action into this competent, story-driven strategy RPG.",WinkySoft,Konami,"Turn-Based, Strategy",Everyone
https://www.gamespot.com/games/might-and-magic-ix/,Might and Magic IX,"Mar 28, 2002",PC,Might and Magic IX is the sort of game that can't please either longtime fans or series newcomers looking to get a role-playing fix.,3DO,"3DO, Ubisoft, Sold Out Software",Role-Playing,Teen
https://www.gamespot.com/games/alfred-hitchcock-presents-the-final-cut/,Alfred Hitchcock presents The Final Cut,"Mar 31, 2002",PC,"The game bears no comparison to Hitchcock's world of paranoia, intrigue, and ugly deeds.",Arxel Tribe,"Wanadoo, Ubisoft, 1C","Adventure, Action",Mature
https://www.gamespot.com/games/high-heat-major-league-baseball-2003/,High Heat Major League Baseball 2003,"Feb 11, 2002","Game Boy Advance, PC, PlayStation 2",High Heat again ups the ante where gameplay is concerned but still fails to match the graphical finesse of its competitors.,"Mobius Entertainment, 3DO","3DO, Takara","Team-Based, Baseball, Simulation, Sports",Everyone
https://www.gamespot.com/games/nfl-blitz-20-02/,NFL Blitz 20-02,"Sep 17, 2001","Game Boy Advance, GameCube, PlayStation 2, Xbox",NFL Blitz 2002 is the best arcade-style football game on the home market.,"OutLook Entertainment, Point of View, Midway",Midway,"Football (American), Sports, Team-Based, Arcade",Everyone
https://www.gamespot.com/games/nfl-blitz-20-02/,NFL Blitz 20-02,"Sep 17, 2001","Game Boy Advance, GameCube, PlayStation 2, Xbox",NFL Blitz 2002 is the best arcade-style football game on the home market.,"OutLook Entertainment, Point of View, Midway",Midway,"Sports, Team-Based, Arcade, Football (American)",Everyone
https://www.gamespot.com/games/warlords-battlecry-ii/,Warlords Battlecry II,"Mar 11, 2002",PC,"Warlords Battlecry II's many playable factions, persistent heroes, and dynamic campaign are innovative elements on top of a solid real-time strategy game.",Strategic Studies Group,Ubisoft,"Real-Time, Strategy",Teen
https://www.gamespot.com/games/bloody-roar-primal-fury/,Bloody Roar: Primal Fury,"Mar 18, 2002","GameCube, Xbox","Bloody Roar Extreme isn't exactly a fresh take on fighting games, though it looks good and controls well enough.",Eighting,"Activision, Hudson, Konami","3D, Fighting, Action",Teen
https://www.gamespot.com/games/home-run-king/,Home Run King,"Mar 18, 2002",GameCube,"Home Run King is supposed to be an over-the-top arcade sports game, but nothing could be farther from the truth.",Wow Entertainment,Sega,"Team-Based, Baseball, Simulation, Sports",Everyone
https://www.gamespot.com/games/star-wars-jedi-starfighter/,Star Wars: Jedi Starfighter,"Mar 10, 2002","PlayStation 2, PlayStation 4, Xbox",Star Wars: Jedi Starfighter is a solid game that fans of the first entry in the series should check out without giving it a second thought.,"LucasArts, Secret Level","LucasArts, Electronic Arts, Activision, Disney Interactive Studios, Disney Interactive",Simulation,Teen
https://www.gamespot.com/games/army-men-rts/,Army Men: RTS,"Mar 24, 2002","GameCube, PC, PlayStation 2",Console gamers who haven't been spoiled by the likes of Starcraft or Red Alert 2 are in for a treat.,Pandemic Studios,"Global Star Software, 2K Games, 3DO, Capcom","Real-Time, Strategy",Teen
https://www.gamespot.com/games/smash-court-tennis-pro-tournament/,Smash Court Tennis Pro Tournament,"Mar 20, 2002",PlayStation 2,"While Smash Court isn't quite as polished or deep as Virtua Tennis, there's still plenty of fun to be had with this game.",Namco,"Namco, SCEE","Tennis, Sports",Everyone
https://www.gamespot.com/games/motocross-maniacs-advance/,Motocross Maniacs Advance,"Mar 21, 2002",Game Boy Advance,Motocross Maniacs Advance offers just as much depth as the competition and is definitely worth taking a look at.,Konami,Konami,"Driving/Racing, Arcade",Everyone
https://www.gamespot.com/games/konami-collectors-series-arcade-advanced/,Konami Collector's Series: Arcade Advanced,"Mar 21, 2002","Dedicated Console, Game Boy Advance","The ability to play as Chain, Buchu, Star, Blues, and the rest of the Yie Ar Kung-Fu gang is enough on its own to make this cart a must-have.","Konami, KCEA","Majesco Games, Konami",Compilation,Everyone
https://www.gamespot.com/games/dark-planet-battle-for-natrolis/,Dark Planet: Battle for Natrolis,"Mar 20, 2002",PC,"Many of Dark Planet's problems have been solved in other real-time strategy games, so it's disappointing to find them marring what should have been a better game.",Creative Edge Software,Ubisoft,"Real-Time, Strategy",Mature
https://www.gamespot.com/games/sega-soccer-slam/,Sega Soccer Slam,"Mar 18, 2002","GameCube, Mobile, PlayStation 2, Xbox",Sega Soccer Slam sets the bar by which any other soccer games of this type will be judged.,"EA Black Box, Centerscore","Sega, Sega Mobile","Arcade, Soccer, Sports, Team-Based",Everyone
https://www.gamespot.com/games/all-star-baseball-2003/,All-Star Baseball 2003,"Feb 25, 2002","Game Boy Advance, GameCube, PlayStation 2, Xbox","All-Star Baseball 2003 is the best baseball simulation available for the Xbox, and it will satisfy hard-core fans of hardball.","Software Creations, Acclaim Studios Austin","Acclaim, Acclaim Japan","Team-Based, Baseball, Simulation, Sports",Everyone
