url,title,release_date,platforms,description,developers,publishers,genres,esrb
https://www.gamespot.com/games/memento-mori-2/,Memento Mori 2,"May 13, 2014",PC,Memento Mori 2 - Guardian of Immortality is the sequal to dtp entertainment's original title.,Centauri Production,"DTP Entertainment, Bohemia Interactive",Adventure,Rating Pending
https://www.gamespot.com/games/blade-symphony/,Blade Symphony,"May 7, 2014","Linux, Macintosh, PC","Prove that you are the world's greatest swordsman in Blade Symphony: a slash-em-up featuring a highly detailed and in-depth sword fighting system. Face down other players in skill-based tactical swordplay, in 2vs2 team duels, or participate in sandbox FFA game modes.",Puny Human Games,Puny Human Games,"Action, Fighting, 3D",
https://www.gamespot.com/games/nutjitsu/,Nutjitsu,"May 8, 2014","PlayStation 4, Xbox One","Nutjitsu is a top-down, arcade-style acorn-snatcher game where you become the squirrel to retrieve the stolen artifacts from the villainous samurai.",NinjaBee,NinjaBee,Action,Everyone
https://www.gamespot.com/games/mario-kart-8/,Mario Kart 8,"May 30, 2014","Nintendo Switch, Wii U","Mario Kart 8 introduces new racing circuit designs and antigravity karts that will have players driving upside down. Players will also enjoy a variety of series-favorite features, including the return of 12-player online competitive play, hang-gliders, underwater racing and motorbikes.",Nintendo,Nintendo,"Arcade, Driving/Racing",Everyone
https://www.gamespot.com/games/sir-you-are-being-hunted/,"Sir, You Are Being Hunted","May 2, 2014","Linux, Macintosh, Nintendo Switch, PC","Sir, You Are Being Hunted is a game where you're tasked with surviving on an island that is procedurally generated, dodging robot hunters out to get you and scavenging for food along the way.",Big Robot Ltd,Big Robot Ltd,"Survival, 3D, Action, Adventure",Rating Pending
https://www.gamespot.com/games/dark-souls-ii/,Dark Souls II,"Mar 11, 2014","PC, PlayStation 3, PlayStation 4, Xbox 360, Xbox One","Dark Souls II is a sequel to From Software's critically acclaimed title Dark Souls. The game features a new hero, a fresh storyline, and an ""unfamiliar"" setting.","From Software, Namco Bandai Games","Bandai Namco Games, From Software, Namco Bandai Games","Action, Role-Playing",Teen
https://www.gamespot.com/games/bound-by-flame/,Bound by Flame,"May 6, 2014","Linux, PC, PlayStation 3, PlayStation 4, Xbox 360",Bound by Flame is an action role-playing game that lets you play as a mercenary posessed by a flame demon in a dark fantasy universe.,Spiders,"Focus Home Interactive, IntraGames","Action, Role-Playing",Mature
https://www.gamespot.com/games/onimusha-warlords/,Onimusha: Warlords,"Mar 13, 2001","Nintendo Switch, PC, PlayStation 2, PlayStation 4, Xbox One","While die-hard Resident Evil fans will be turned off by the game's length, others will find it to be the survival-horror game for people who don't like survival-horror games.","NeoBards Entertainment, Capcom","Capcom, Akella","Adventure, Action",Mature
https://www.gamespot.com/games/kentucky-route-zero/,Kentucky Route Zero,"Feb 22, 2013","Linux, Macintosh, Nintendo Switch, PC, PlayStation 4, Xbox One","Kentucky Route Zero is a magical realistic adventure game about a secret highway in the caves beneath Kentucky, and the mysterious folks who travel it.",Cardboard Computer,"Cardboard Computer, Annapurna Interactive, iam8bit",Adventure,Teen
https://www.gamespot.com/games/world-of-tanks/,World of Tanks,"Apr 12, 2011","PC, PlayStation 4, Xbox 360, Xbox One",World of Tanks is the first and only team-based massively multiplayer online action game dedicated to armored warfare.,Wargaming.net,"Wargaming.net, IGS Software Publishing, Deep Silver, Maximum Games, Wargaming Group Limited, Microsoft Game Studios","Tactical, Free-to-Play, Third-Person, Shooter, Action",Teen
https://www.gamespot.com/games/world-of-tanks/,World of Tanks,"Apr 12, 2011","PC, PlayStation 4, Xbox 360, Xbox One",World of Tanks is the first and only team-based massively multiplayer online action game dedicated to armored warfare.,Wargaming.net,"Wargaming.net, IGS Software Publishing, Deep Silver, Maximum Games, Wargaming Group Limited, Microsoft Game Studios","Tactical, Free-to-Play, Third-Person, Shooter, Action",Teen
https://www.gamespot.com/games/titanfall/,Titanfall,"Mar 11, 2014","PC, Xbox 360, Xbox One","Set in the near future on a distant frontier torn apart by war, Titanfall drops players in the middle of a conflict between the Interstellar Manufacturing Corporation (IMC) and the Militia.","Respawn Entertainment, Bluepoint Games","Electronic Arts, Microsoft Game Studios","First-Person, Shooter, 3D, Action",Mature
https://www.gamespot.com/games/grand-theft-auto-v/,Grand Theft Auto V,"Sep 17, 2013","PC, PlayStation 3, PlayStation 4, PlayStation 5, Xbox 360, Xbox One, Xbox Series X","Grand Theft Auto V is an open-world crime epic set in the LA-inspired city of Los Santos around the lives of Franklin, a street hustler looking for real opportunities; Michael, a professional ex-con whose retirement isn't all he hoped it would be; and Trevor, a violent psychopath.",Rockstar North,"Rockstar Games, Take-Two Interactive, 2K Games","Open-World, Third-Person, Adventure, Shooter, 3D, First-Person, Action",Mature
https://www.gamespot.com/games/sportsfriends/,Sportsfriends,"May 6, 2014","Linux, Macintosh, PC, PlayStation 3, PlayStation 4",Sportsfriends is a compendium of four joyfully fun local multiplayer games for the PlayStation 3 and home computers.,Die Gute Fabrik,Die Gute Fabrik,Party/Minigame,Rating Pending
https://www.gamespot.com/games/mlb-14-the-show/,MLB 14: The Show,"Apr 1, 2014","PlayStation 3, PlayStation 4, PlayStation Vita","MLB 14 The Show is a realistic baseball game that lets you feel the MLB experience with moments such as when you're called up to the majors, a sacrifice fly to left field, or crushing a walk-off homer to win it all.",SCEA San Diego Studios,"SCEA, SCEE, SCE Australia, SCEI","Baseball, Simulation, Sports, Team-Based",Everyone
https://www.gamespot.com/games/final-fantasy-xiv-online-a-realm-reborn/,Final Fantasy XIV Online: A Realm Reborn,"Aug 27, 2013","Macintosh, PC, PlayStation 3, PlayStation 4, PlayStation 5","After a tumultuous launch, an entirely new team at Square-Enix has completely redesigned and rebuilt their second MMO, Final Fantasy XIV Online, from the ground up.",Square Enix,"Square Enix, Sony DADC Brasil","MMO, Role-Playing",Teen
https://www.gamespot.com/games/final-fantasy-xiv-online-a-realm-reborn/,Final Fantasy XIV Online: A Realm Reborn,"Aug 27, 2013","Macintosh, PC, PlayStation 3, PlayStation 4, PlayStation 5","After a tumultuous launch, an entirely new team at Square-Enix has completely redesigned and rebuilt their second MMO, Final Fantasy XIV Online, from the ground up.",Square Enix,"Square Enix, Sony DADC Brasil","Role-Playing, MMO",Teen
https://www.gamespot.com/games/the-amazing-spider-man-2/,The Amazing Spider-Man 2,"Apr 17, 2014","Android, iOS (iPhone/iPad), PC, PlayStation 3, PlayStation 4, Wii U, Xbox 360, Xbox One","The Amazing Spider-Man 2 is a third-person action-adventure video game that builds on the story of the previous game with an alternative take on the events of the upcoming movie, while also giving players an enhanced, free-roaming web-slinging experience through a greatly expanded New York City.","Gameloft, Beenox","Gameloft, Activision, Square Enix","Adventure, Action",Teen
https://www.gamespot.com/games/jojos-bizarre-adventure-all-star-battle/,JoJo's Bizarre Adventure: All-Star Battle,"Aug 29, 2013","Nintendo Switch, PC, PlayStation 3, PlayStation 4, PlayStation 5, Xbox One, Xbox Series X",JoJo's Bizarre Adventure: All-Star Battle gives players the feeling that they are participating in vivid and colorful battles straight from the pages of the manga.,CyberConnect2,"Bandai Namco Games, Namco Bandai Games","3D, Action, Fighting",Teen
https://www.gamespot.com/games/mario-golf/,Mario Golf,"Jun 30, 1999","Game Boy Color, Nintendo 64","Although Mario Golf is a little on the cutesy side, anyone who wants a great golf game need look no further.",Camelot Software Planning,Nintendo,"Arcade, Sports, Golf",Everyone
https://www.gamespot.com/games/daylight/,Daylight,"Apr 29, 2014","PC, PlayStation 4","Daylight is a PC-based psychological horror game where you wake up in an abandoned hospital with only your cell phone for illumination, and you must explore the institution's dark criminal past as you attempt to escape.",Zombie Studios,"ATLUS, Arc System Works","Survival, 3D, Action, Adventure",Mature
https://www.gamespot.com/games/kirby-triple-deluxe/,Kirby: Triple Deluxe,"May 2, 2014",3DS,"Pink? Check. Puffy? Check. Powerful? You have no idea. Devour trees, obstacles, and huge chunks of stages with Kirby’s Hypernova ability and inhale enemies to copy epic new moves like Archer.",HAL Labs,Nintendo,"Platformer, Action, 2D",Everyone
https://www.gamespot.com/games/assassins-creed-ii/,Assassin's Creed II,"Nov 17, 2009","Macintosh, PC, PlayStation 3, Xbox 360",Assassin's Creed returns with a new adventure set in the Italian Renaissance.,Ubisoft Montreal,"Ubisoft, Focus Multimedia, E-Frontier","Adventure, Action",Mature
https://www.gamespot.com/games/assassins-creed-ii/,Assassin's Creed II,"Nov 17, 2009","Macintosh, PC, PlayStation 3, Xbox 360",Assassin's Creed returns with a new adventure set in the Italian Renaissance.,Ubisoft Montreal,"Ubisoft, Focus Multimedia, E-Frontier","Action, Adventure",Mature
https://www.gamespot.com/games/mario-golf-world-tour/,Mario Golf: World Tour,"May 2, 2014",3DS,"Mario Golf: World Tour is a golfing game for the Nintendo 3DS that includes both simple controls and a deeper experience for golf fans, plus courses that range from traditional to those inspired by the Mushroom Kingdom.",Camelot Software Planning,Nintendo,"Sports, Golf, Arcade",Everyone
https://www.gamespot.com/games/the-elder-scrolls-online/,The Elder Scrolls Online,"Apr 4, 2014","Macintosh, PC, PlayStation 4, PlayStation 5, Stadia, Xbox One, Xbox Series X",The Elder Scrolls Online will be the first Elder Scrolls game to allow gamers to explore the Elder Scrolls world with others.,"ZeniMax Media, Zenimax Online Studios, Bethesda Softworks","Bethesda Softworks, Zenimax Online Studios, DMM GAMES, ZeniMax Media","MMO, Role-Playing",Mature
https://www.gamespot.com/games/batman-arkham-origins/,Batman: Arkham Origins,"Oct 25, 2013","PC, PlayStation 3, Wii U, Xbox 360","Batman: Arkham Origins is the latest entry in the Batman Arkham series that will see a younger Caped Crusader facing many noted villains for the first time, including Deathstroke.","Iron Galaxy Studios, WB Games Montreal, Human Head Studios","Warner Bros. Interactive Entertainment, Sony DADC Brasil","Action, Adventure",Teen
https://www.gamespot.com/games/dark-souls-ii/,Dark Souls II,"Mar 11, 2014","PC, PlayStation 3, PlayStation 4, Xbox 360, Xbox One","Dark Souls II is a sequel to From Software's critically acclaimed title Dark Souls. The game features a new hero, a fresh storyline, and an ""unfamiliar"" setting.","From Software, Namco Bandai Games","From Software, Bandai Namco Games, Namco Bandai Games","Action, Role-Playing",Teen
https://www.gamespot.com/games/life-goes-on/,Life Goes On,"Apr 17, 2014","Linux, Macintosh, Nintendo Switch, PC, PlayStation 4",Life Goes On is a comically-morbid platform game where you guide heroic knights to their demise and use their dead bodies to solve puzzles.,Infinite Monkeys,"Infinite Monkeys, Gamepoch","2D, Action, Platformer",Everyone 10+
https://www.gamespot.com/games/broken-sword-the-serpents-curse/,Broken Sword 5: The Serpent's Curse,"Dec 4, 2013","Android, iOS (iPhone/iPad), Linux, Macintosh, Mobile, Nintendo Switch, PC, PlayStation 4, PlayStation Vita, Xbox One",George Stobbart and Nico Collard reunite for a new adventure in Broken Sword: The Serpent's Curse.,Revolution Software,"Revolution Software, Ravenscourt, Koch Media, Deep Silver, Unbalance",Adventure,Teen
https://www.gamespot.com/games/demon-gaze/,Demon Gaze,"Apr 22, 2014","Nintendo Switch, PC, PlayStation 4, PlayStation Vita",Demon Gaze is a dungeon-crawling RPG where you play as the main character Oz and explore 3D dungeons as you fight against of a myriad of monsters in order to bolster your party with ever stronger equipment.,"Cattle Call, Kadokawa Shoten, Experience Inc.","Kadokawa Shoten, Clouded Leopard Entertainment, NIS America",Role-Playing,Teen
https://www.gamespot.com/games/nes-remix-2/,NES Remix 2,"Apr 25, 2014",Wii U,Take on rapid-fire challenges from classic NES games remixed with mind-bending twists.,Indies Zero ,Nintendo,Party/Minigame,Everyone
https://www.gamespot.com/games/borderlands-2/,Borderlands 2,"Sep 18, 2012","Android, Linux, Macintosh, PC, PlayStation 3, PlayStation 4, PlayStation Vita, Xbox 360, Xbox One","Borderlands 2 continues in its predecessors footsteps with four new characters, tons of new quests, and lots of shooting and looting.","Gearbox Software, Aspyr, Iron Galaxy Studios","NVIDIA, Aspyr, 2K Games, Take-Two Interactive, SCEA, SCEE, SCE Australia","Shooter, 3D, Action, First-Person",Mature
https://www.gamespot.com/games/trials-fusion/,Trials Fusion,"Apr 15, 2014","PC, PlayStation 4, Xbox 360, Xbox One","Trials Fusion melds the classic, proven Trials formula of simple yet addictive competition with the social and visual breakthroughs of the next generation of gaming.",RedLynx,Ubisoft,"Driving/Racing, Arcade",Everyone 10+
https://www.gamespot.com/games/2014-fifa-world-cup-brazil/,2014 FIFA World Cup Brazil,"Apr 15, 2014","PlayStation 3, Xbox 360",2014 FIFA World Cup Brazil brings Rio de Janeiro to your living room.,EA Canada,"EA Sports, Electronic Arts","Simulation, Soccer, Sports, Team-Based",Everyone
https://www.gamespot.com/games/lego-the-hobbit/,LEGO The Hobbit,"Apr 8, 2014","3DS, Macintosh, PC, PlayStation 3, PlayStation 4, PlayStation Vita, Wii U, Xbox 360, Xbox One","LEGO The Hobbit will be based on the first two films of The Hobbit Trilogy, The Hobbit: An Unexpected Journey and the upcoming The Hobbit: Desolation of Smaug, a production of New Line Cinema and Metro-Goldwyn-Mayer Pictures (MGM), opening worldwide beginning December 13, 2013.  

Following the storyline of the first two films, LEGO The Hobbit will take players on quests throughout Middle-earth, joining Bilbo Baggins, Gandalf the Grey, and Thorin Oakenshield and Company in their exciting adventures toward the Dwarven Kingdom of Erebor.","TT Games, Feral Interactive","Warner Bros. Interactive Entertainment, Feral Interactive, Sony DADC Brasil, Inplay Interactive","Adventure, Action",Everyone 10+
https://www.gamespot.com/games/moebius-empire-rising/,Moebius: Empire Rising,"Apr 15, 2014","Linux, Macintosh, PC","Moebius: Empire Rising is a contemporary adventure that merges classic point-and-click puzzle solving with Jane Jensen’s sophisticated storytelling. Travel the world using Malachi’s unique deductive powers to analyze suspects, make historical connections, and uncover the truth behind a theory of space and time the government will defend at any cost.",Pinkerton Road Studio,Phoenix Online Publishing,Adventure,
https://www.gamespot.com/games/conception-ii-children-of-the-seven-stars/,Conception II: Children of the Seven Stars,"Aug 22, 2013","3DS, PC, PlayStation Vita","Conception II: Children of the Seven Stars is a turn-based RPG where players take on the role of a young man beginning his training as a Disciple - a human gifted with the divine powers of one of the Star Gods, and one of the few who can fight the monsters that plague the world.",Spike Chunsoft,"ATLUS, Spike Chunsoft",Role-Playing,Mature
https://www.gamespot.com/games/half-minute-hero-the-second-coming/,Half Minute Hero: The Second Coming,"Apr 4, 2014","PC, PSP","Find a quest, level up, equip some loot, and slay the Evil Lord, all in half a minute!","Opus, Marvelous","Marvelous AQL, Marvelous","Action, Role-Playing",
https://www.gamespot.com/games/strike-suit-zero/,Strike Suit Zero,"Jan 23, 2013","Android, Linux, Macintosh, Nintendo Switch, PC, PlayStation 4, Xbox One","Strike Suit Zero is an action-packed arcade game set in the final hours of a future Earth where the only hope for the planet to avoid destruction is the Strike Suit, an advanced, transforming spacecraft that empowers the player with ludicrous firepower and awesome abilities.",Born Ready Games,Born Ready Games,"Simulation, VR, Flight",Everyone 10+
https://www.gamespot.com/games/titanfall/,Titanfall,"Mar 11, 2014","PC, Xbox 360, Xbox One","Set in the near future on a distant frontier torn apart by war, Titanfall drops players in the middle of a conflict between the Interstellar Manufacturing Corporation (IMC) and the Militia.","Respawn Entertainment, Bluepoint Games","Electronic Arts, Microsoft Game Studios","First-Person, Shooter, 3D, Action",Mature
https://www.gamespot.com/games/simcity/,SimCity,"Mar 5, 2013","Macintosh, PC",SimCity is a city-building simulation game that lets players create the city they desire to make the choices that shape your city and power the citizens within it.,Maxis,Electronic Arts,"Management, Strategy",Everyone 10+
https://www.gamespot.com/games/simcity/,SimCity,"Mar 5, 2013","Macintosh, PC",SimCity is a city-building simulation game that lets players create the city they desire to make the choices that shape your city and power the citizens within it.,Maxis,Electronic Arts,"Management, Strategy",Everyone 10+
https://www.gamespot.com/games/mercenary-kings/,Mercenary Kings,"Jul 22, 2013","Linux, Macintosh, Nintendo Switch, Ouya, PC, PlayStation 4, PlayStation Vita, Xbox One","In this frantic 2D action game, you are part of the Mercenary Kings, the most skilled team of warriors-for-hire on Earth, but when your comrades have fallen and the fearsome forces of CLAW have seized an island-wide top secret Laboratory Base, you must do what it takes to stop them.","Tribute Games, OUYA Publishing","Tribute Games, Limited Run Games, OUYA Publishing, EastAsiaSoft","Action, Shoot-'Em-Up, 2D",Mature
https://www.gamespot.com/games/the-wolf-among-us/,The Wolf Among Us,"Oct 11, 2013","Android, iOS (iPhone/iPad), Macintosh, PC, PlayStation 3, PlayStation 4, PlayStation Vita, Xbox 360, Xbox One","The Wolf Among Us is a five episode series from developer Telltale Games where your every decision can have enormous consequences. As Bigby Wolf , the big bad wolf in human form, you will discover that the brutal, bloody murder of a Fable is just a taste of things to come.",Telltale Games,"Telltale Games, Athlon Games, Inc.",Adventure,Mature
https://www.gamespot.com/games/ragnarok-odyssey-ace/,Ragnarok Odyssey ACE,"Dec 31, 2014","PlayStation 3, PlayStation Vita","Ragnarok Odyssey ACE is an evolved version of the giant-hunting game released on PlayStation Vita, adding new content and features and introducing a PlayStation 3 version.",Game Arts,"GungHo, Xseed Games","Role-Playing, Action",Teen
https://www.gamespot.com/games/planetside-2/,PlanetSide 2,"Nov 20, 2012","PC, PlayStation 4",PlanetSide 2 is a massively multiplayer online first-person shooter set in an online persistent world where the war wages nonstop and the balance of power shifts with every base and territory captured and lost.,"Sony Online Entertainment, Daybreak Games","Sony Online Entertainment, Deep Silver, Daybreak Games","Free-to-Play, Team-Based, Action, Shooter, 3D, First-Person",Teen
https://www.gamespot.com/games/arma-3/,Arma 3,"Mar 5, 2013",PC,Arma 3 is the brand-new installment in this series of critically acclaimed realistic military simulators.,Bohemia Interactive,"Bohemia Interactive, Zoo Corporation",Simulation,Mature
https://www.gamespot.com/games/kinect-sports-rivals/,Kinect Sports Rivals,"Dec 31, 2015",Xbox One,Kinect Sports Rivals is a sports game for the Xbox One that captures your likeness as a champion and plunges you into a world of sports competition.,Microsoft Game Studios,Microsoft Game Studios,Sports,Everyone 10+
https://www.gamespot.com/games/arma-3/,Arma 3,"Mar 5, 2013",PC,Arma 3 is the brand-new installment in this series of critically acclaimed realistic military simulators.,Bohemia Interactive,"Bohemia Interactive, Zoo Corporation",Simulation,Mature
https://www.gamespot.com/games/lightning-returns-final-fantasy-xiii/,Lightning Returns: Final Fantasy XIII,"Feb 11, 2014","PC, PlayStation 3, Xbox 360","Lightning Returns: Final Fantasy XIII incorporates a brand-new story, world, characters and an enhanced gameplay system and is the final chapter in Lightning's saga",Square Enix,Square Enix,Role-Playing,Teen
https://www.gamespot.com/games/planetside-2/,PlanetSide 2,"Nov 20, 2012","PC, PlayStation 4",PlanetSide 2 is a massively multiplayer online first-person shooter set in an online persistent world where the war wages nonstop and the balance of power shifts with every base and territory captured and lost.,"Sony Online Entertainment, Daybreak Games","Deep Silver, Sony Online Entertainment, Daybreak Games","3D, First-Person, Shooter, Action, Free-to-Play, Team-Based",Teen
https://www.gamespot.com/games/deus-ex-the-fall/,Deus Ex: The Fall,"Jul 11, 2013","Android, iOS (iPhone/iPad), PC",Deus Ex: The Fall is a story driven action-RPG and the first Deus Ex in the series to be released on mobile and tablet devices.,"N-Fusion Interactive Entertainment Corp., Square Enix",Square Enix,"Shooter, 3D, Action, First-Person",Rating Pending
https://www.gamespot.com/games/betrayer/,Betrayer,"Aug 14, 2013",PC,,Blackpowder Games ,Blackpowder Games ,"3D, Adventure, First-Person",
https://www.gamespot.com/games/escape-goat-2/,Escape Goat 2,"Mar 24, 2014","Linux, Macintosh, PC, PlayStation 4",Escape Goat 2 is a goat-based puzzle platformer.,MagicalTimeBean,"Double Fine Productions, MagicalTimeBean, Limited Run Games","2D, Action, Platformer",Everyone
https://www.gamespot.com/games/age-of-wonders-iii/,Age of Wonders III,"Mar 31, 2014","Linux, Macintosh, PC","Age of Wonders III marks a modern reimagining of the series, where you join a clash of kings, queens, and dark lords for the spoils of an ancient paradise.",Triumph Studios,Triumph Studios,"Strategy, Turn-Based",Teen
https://www.gamespot.com/games/bioshock-infinite/,BioShock Infinite,"Mar 25, 2013","Linux, Macintosh, Nintendo Switch, PC, PlayStation 3, PlayStation 4, Xbox 360","BioShock Infinite is a first person shooter where players assume the role of former Pinkerton agent Booker DeWitt who is sent to the flying city of Columbia on a rescue mission to save Elizabeth, who has been imprisoned since childhood.","Virtual Programming, Irrational Games, Virtuos, 2K Games","2K Games, Aspyr, Take-Two Interactive","First-Person, Shooter, 3D, Action",Mature
https://www.gamespot.com/games/bioshock-infinite/,BioShock Infinite,"Mar 25, 2013","Linux, Macintosh, Nintendo Switch, PC, PlayStation 3, PlayStation 4, Xbox 360","BioShock Infinite is a first person shooter where players assume the role of former Pinkerton agent Booker DeWitt who is sent to the flying city of Columbia on a rescue mission to save Elizabeth, who has been imprisoned since childhood.","Virtual Programming, Irrational Games, Virtuos, 2K Games","2K Games, Aspyr, Take-Two Interactive","First-Person, Shooter, 3D, Action",Mature
https://www.gamespot.com/games/diablo-iii/,Diablo III,"May 15, 2012","Macintosh, Nintendo Switch, PC, PlayStation 3, PlayStation 4, Xbox 360, Xbox One","Diablo III is a fantasy action RPG that continues the land of Sanctuary's battle against a reoccurring demonic evil, and provides players around the world with the opportunity to create the ultimate hero to quest against it with friends online, or on their own.","Blizzard Entertainment, Activision","Blizzard Entertainment, Nintendo, Activision, Square Enix, Sony DADC Brasil, Sony Interactive Entertainment","Action, Role-Playing",Mature
https://www.gamespot.com/games/the-witch-and-the-hundred-knight/,The Witch and the Hundred Knight,"Mar 18, 2014","PlayStation 3, PlayStation 4",The Witch and the Hundred Knights lets players have the choice to be the hero who saves the world or go evil and pillage the village.,Nippon Ichi Software,"Nippon Ichi Software, NIS America","Role-Playing, Action",Teen
https://www.gamespot.com/games/burnout-3-takedown/,Burnout 3: Takedown,"Sep 7, 2004","PlayStation 2, Xbox",Burnout 3: Takedown is an amazing achievement that anyone with a pulse will probably love.,Criterion Games,"Electronic Arts, EA Games","Arcade, Driving/Racing",Teen
https://www.gamespot.com/games/top-gun-air-combat/,Top Gun: Air Combat,"Jun 13, 2003",Mobile,"Thanks to its challenging and exciting gameplay, Air Combat is still a very entertaining romp through the not-so-friendly skies.",MoGame,Mforma,"Third-Person, 3D, Action, Shooter",
https://www.gamespot.com/games/seaworld-adventure-parks-tycoon/,SeaWorld Adventure Parks Tycoon,"Sep 29, 2003",PC,You can build any kind of theme park you want--so long as it's SeaWorld--in this budget strategy game that's a bit thin on content.,Deep Red,Activision Value,"Management, Strategy",Everyone
https://www.gamespot.com/games/ncaa-college-football-2k3/,NCAA College Football 2K3,"Aug 7, 2002","GameCube, PlayStation 2, Xbox","NCAA College Football 2K3 features all 25 official BCS bowls, completely redesigned stadiums, and an enhanced Legacy mode in which you can recruit stars from straight out of high school.",Avalanche Software,Sega,"Simulation, Sports, Team-Based, Football (American)",Everyone
https://www.gamespot.com/games/ncaa-college-football-2k3/,NCAA College Football 2K3,"Aug 7, 2002","GameCube, PlayStation 2, Xbox","NCAA College Football 2K3 features all 25 official BCS bowls, completely redesigned stadiums, and an enhanced Legacy mode in which you can recruit stars from straight out of high school.",Avalanche Software,Sega,"Simulation, Sports, Team-Based, Football (American)",Everyone
