url,title,release_date,platforms,description,developers,publishers,genres,esrb
https://www.gamespot.com/games/i-am-bread-tv/,I Am Bread TV,"Dec 31, 2015","iOS (iPhone/iPad), Macintosh, Ouya, PC, PlayStation 4, Xbox One",I Am Bread tells the story of one slice of bread's epic and emotional journey as it embarks upon a quest to become toasted.,"Bossa Studios, OUYA Publishing, Just Add Water","Bossa Studios, OUYA Publishing, Ravenscourt, Intergrow, Oizumi Amuzio","Platformer, 3D, Action",Everyone 10+
https://www.gamespot.com/games/age-of-wonders-iii/,Age of Wonders III,"Mar 31, 2014","Linux, Macintosh, PC","Age of Wonders III marks a modern reimagining of the series, where you join a clash of kings, queens, and dark lords for the spoils of an ancient paradise.",Triumph Studios,Triumph Studios,"Turn-Based, Strategy",Teen
https://www.gamespot.com/games/halo-spartan-strike/,Halo: Spartan Strike,"Apr 16, 2015","iOS (iPhone/iPad), PC, Windows Mobile",Halo: Spartan Strike is a top-down shooter coming to Windows 8 devices and Steam.,"343 Industries, Vanguard Games",Microsoft Game Studios,"2D, Action, Fixed-Screen, Shooter",Teen
https://www.gamespot.com/games/dungeons-2/,Dungeons 2,"Apr 24, 2015","Linux, Macintosh, PC, PlayStation 4","In Dungeons 2, fulfil the Dark Lord’s insatiable quest for vengeance by recruiting fearsome new monsters from all corners of the underworld in order to undertake his evil bidding.",Kalypso,"Kalypso, H2 Interactive Co., Ltd.",Strategy,Teen
https://www.gamespot.com/games/harold/,Harold,"Feb 12, 2015","PC, PlayStation 3, Xbox 360",Harold is a single-player side-scrolling platformer with an emphasis on the high-quality hand-drawn style of classic animated films.,Moon Spider Studio,Moon Spider Studio,"2D, Action, Platformer",Rating Pending
https://www.gamespot.com/games/voidexpanse/,VoidExpanse,"Apr 2, 2015","Linux, Macintosh, PC","VoidExpanse is a science fiction, top-down action role-playing game set in outer space.",AtomicTorch,AtomicTorch,"Action, Role-Playing",
https://www.gamespot.com/games/affordable-space-adventures/,Affordable Space Adventures,"Apr 9, 2015",Wii U,"Affordable Space Adventures is a 2D side scrolling spaceship simulator. You are using the GamePad as a “Heads Down Display” – spaceship cockpit, and you have to configure all the systems in order to fly around undetected on an alien planet. You can either play it alone, or fly as a crew of 2 or 3 players, requiring a lot of communication between the players.",KnapNok Games,"KnapNok Games, Rainy Frog","Action, 2D, Shoot-'Em-Up",Everyone
https://www.gamespot.com/games/assassins-creed-chronicles-china/,Assassin's Creed Chronicles: China,"Apr 21, 2015","PC, PlayStation 4, Xbox One",Assassin's Creed Chronicles: China is a new 2.5D sidescrolling entry in the series that see the the final remaining Assassin in the Chinese Brotherhood out for vengeance in Beijing.,Climax Group,Ubisoft,"Action, Adventure",Teen
https://www.gamespot.com/games/slow-down-bull/,"Slow Down, Bull","Apr 20, 2015","Linux, Macintosh, PC","Slow Down, Bull is an action collecting game. Steer Esteban, a stressed-out overachieving bull, to collect as many crafty pieces as you can, but be careful! Every time you steer him, he gets a little more stressed out, and you DON'T want to stress him out!",Insomniac Games,Insomniac Games,Action,
https://www.gamespot.com/games/the-charnel-house-trilogy/,The Charnel House Trilogy,"Apr 16, 2015",PC,,Owl Cave,Mastertronic,Adventure,
https://www.gamespot.com/games/grand-theft-auto-v/,Grand Theft Auto V,"Sep 17, 2013","PC, PlayStation 3, PlayStation 4, PlayStation 5, Xbox 360, Xbox One, Xbox Series X","Grand Theft Auto V is an open-world crime epic set in the LA-inspired city of Los Santos around the lives of Franklin, a street hustler looking for real opportunities; Michael, a professional ex-con whose retirement isn't all he hoped it would be; and Trevor, a violent psychopath.",Rockstar North,"Rockstar Games, Take-Two Interactive, 2K Games","Action, 3D, Shooter, Adventure, First-Person, Third-Person, Open-World",Mature
https://www.gamespot.com/games/we-are-doomed/,WE ARE DOOMED,"Apr 14, 2015","Macintosh, Nintendo Switch, PC, PlayStation 4, PlayStation Vita, Xbox One",We Are Doomed is a twin-stick shooter where you zap polygon baddies with an absurdly overpowered laserbeam.,Vertex Pop,Vertex Pop,"2D, Action, Shoot-'Em-Up",Everyone
https://www.gamespot.com/games/worlds-of-magic/,Worlds of Magic,"Mar 19, 2015","Linux, Macintosh, PC","Worlds of Magic is a turn based fantasy 4x game with procedurally generated maps, and a load of spells, races, and heroes.",Wastelands Interactive,Wastelands Interactive,"Strategy, Turn-Based",
https://www.gamespot.com/games/titan-souls/,Titan Souls,"Apr 14, 2015","Android, Linux, Macintosh, PC, PlayStation 4, PlayStation Vita","Between our world and the world beyond lie the Titan Souls, the spiritual source and sum of all living things. Now scattered amongst the ruins and guarded by the idle titans charged with their care, a solitary hero armed with but a single arrow is once again assembling shards of the Titan Soul in a quest.","Devolver Digital, Acid Nerve",Devolver Digital,"Adventure, Action",Teen
https://www.gamespot.com/games/slender-the-arrival/,Slender: The Arrival,"Mar 26, 2013","iOS (iPhone/iPad), Macintosh, Nintendo Switch, PC, PlayStation 3, PlayStation 4, Wii U, Xbox 360, Xbox One",Slender: The Arrival is the official continuation of Slender: The Eight Pages.,Blue Isle Studios,"Blue Isle Studios, Midnight City, Majesco Games","3D, Adventure, First-Person",Teen
https://www.gamespot.com/games/infinite-crisis/,Infinite Crisis,"Dec 31, 2014",PC,"Infinite Crisis is a multiplayer online battle arena game where a sudden assault threatens the DC multiverse. All realities stand on the brink of annihilation, and the last hope for Earth lies in the powers of the DC legends.",Turbine Inc.,Warner Bros. Interactive Entertainment,"MOBA, Strategy",Teen
https://www.gamespot.com/games/paperbound/,Paperbound,"Mar 31, 2015","PC, PlayStation 4","Paperbound is Smash Bros on crack. Be a gravity ninja as you battle your friends inside old storybooks. Run up walls and on ceilings, and then invert your gravity for a surprise attack. It's chaotic yet strategic. Sometimes, it's madness. Sometimes, it's a cat-and-mouse game. You'll laugh. You'll swear at your friends. You'll want to play another round. In Paperbound, you play as stick men and other characters who come to life via magic dust. Inside Journey to the Center of the Earth, you discover the ability to have your gravity adapt to any curved surface as you run along it. What better way to test this newfound ability than combat?",Dissident Logic,"Dissident Logic, CrossFunction","2D, Action, Fighting",Everyone 10+
https://www.gamespot.com/games/bastion/,Bastion,"Jul 20, 2011","iOS (iPhone/iPad), Linux, Macintosh, Nintendo Switch, PC, PlayStation 4, PlayStation Vita, Xbox 360, Xbox One",Bastion is an action role-playing game from Supergiant Games.,Supergiant Games,"Warner Bros. Interactive Entertainment, Supergiant Games, Limited Run Games","Role-Playing, Action",Everyone 10+
https://www.gamespot.com/games/dark-souls-ii/,Dark Souls II,"Mar 11, 2014","PC, PlayStation 3, PlayStation 4, Xbox 360, Xbox One","Dark Souls II is a sequel to From Software's critically acclaimed title Dark Souls. The game features a new hero, a fresh storyline, and an ""unfamiliar"" setting.","From Software, Namco Bandai Games","Bandai Namco Games, Namco Bandai Games, From Software","Role-Playing, Action",Teen
https://www.gamespot.com/games/pillars-of-eternity/,Pillars of Eternity,"Mar 26, 2015","Linux, Macintosh, Nintendo Switch, PC, PlayStation 4, Xbox One","Pillars of Eternity is an isometric, party-based computer RPG set in a new fantasy world developed by Obsidian Entertainment.","Obsidian Entertainment, Red Cerberus, Paradox Arctic","Paradox Interactive, Versus Evil, Encore Software, Inc.",Role-Playing,Mature
https://www.gamespot.com/games/mlb-15-the-show/,MLB 15: The Show,"Mar 31, 2015","PlayStation 3, PlayStation 4, PlayStation Vita",MLB 15: The Show is a realistic baseball game that lets you feel the MLB experience.,SCEA San Diego Studios,"SCEA, SCEI, SCE Australia, SCEE, Sony Interactive Entertainment","Sports, Team-Based, Baseball, Simulation",Everyone
https://www.gamespot.com/games/etrian-mystery-dungeon/,Etrian Mystery Dungeon,"Apr 7, 2015",3DS,"Infinite Dungeons to Explore: Etrian Mystery Dungeon incorporates the random map feature, which changes the floor terrain each time a player enters the dungeon.",Spike Chunsoft,"ATLUS, NIS America","Role-Playing, Roguelike",Everyone 10+
https://www.gamespot.com/games/dyscourse/,Dyscourse,"Mar 25, 2015","Linux, Macintosh, PC",Dyscourse is an interactive choose-your-own adventure where you journey through a stylized world of choice and consequence.,Owlchemy Labs,Owlchemy Labs,Adventure,
https://www.gamespot.com/games/three-fourths-home/,Three Fourths Home,"Aug 3, 2014","Linux, Macintosh, Nintendo Switch, PC, PlayStation 4, PlayStation Vita, Xbox One","In Three Fourths Home, players assume the role of Kelly while she is driving home during this thunderstorm.",[bracket]games,"[bracket]games, Digerati Distribution","Text-Based, Adventure",Mature
https://www.gamespot.com/games/sunless-sea/,Sunless Sea,"Jul 1, 2014","iOS (iPhone/iPad), Linux, Macintosh, Nintendo Switch, PC, PlayStation 4, Xbox One","Sunless Sea is a game of discovery, loneliness and frequent death, set in the award-winning Victorian Gothic universe of Fallen London.","Failbetter Games, Digerati Distribution","Failbetter Games, Digerati Distribution","Action, Adventure",Mature
https://www.gamespot.com/games/sid-meiers-starships/,Sid Meier's Starships,"Mar 12, 2015","iOS (iPhone/iPad), Macintosh, PC",Control a fleet of starships on your quest to control the galaxy in Sid Meier's Starships.,Firaxis Games,2K Games,"Strategy, Turn-Based",
https://www.gamespot.com/games/dreamfall-chapters/,Dreamfall Chapters,"Oct 21, 2014","Linux, Macintosh, PC, PlayStation 4, Xbox One","Dreamfall Chapters continues and concludes the gripping story of Zoe Castillo, the Dreamer.",Red Thread Games,"Red Thread Games, Deep Silver, Koch Media","3D, Adventure, Third-Person",Mature
https://www.gamespot.com/games/story-of-seasons/,Story of Seasons,"Feb 28, 2014",3DS,"Story of Seasons is the beginning of a new chapter in the ‘Bokujo Monogatari’ series, a long-standing and top-selling farming/life simulation franchise.",Marvelous AQL,"Xseed Games, Marvelous AQL, Nintendo, Marvelous Inc.",Strategy,Everyone 10+
https://www.gamespot.com/games/resogun/,Resogun,"Nov 15, 2013","PlayStation 3, PlayStation 4, PlayStation Vita",Resogun is an intense fast-paced shoot em' up developed exclusively for the PS4.,"XDEV, Housemarque, Climax Group","SCEA, SCEE, SCEI, SCE Australia","Shoot-'Em-Up, Action, 2D",Everyone 10+
https://www.gamespot.com/games/dragon-age-inquisition/,Dragon Age: Inquisition,"Nov 18, 2014","PC, PlayStation 3, PlayStation 4, Xbox 360, Xbox One",Dragon Age: Inquisition is the third entry in BioWare's epic fantasy role-playing game trilogy.,"BioWare, Electronic Arts","BioWare, Electronic Arts, Sony DADC Brasil","Action, 3D, Third-Person, Role-Playing, Adventure",Mature
https://www.gamespot.com/games/life-is-strange-remastered/,Life is Strange,"Feb 1, 2022","Android, iOS (iPhone/iPad), Linux, Macintosh, Nintendo Switch, PC, PlayStation 3, PlayStation 4, Xbox 360, Xbox One",,"DONTNOD Entertainment, Feral Interactive, Square Enix, Deck Nine Games","DONTNOD Entertainment, Square Enix","Adventure, Action",Mature
https://www.gamespot.com/games/xenoblade-chronicles/,Xenoblade Chronicles,"Apr 6, 2012","3DS, Nintendo Switch, Wii",Xenoblade Chronicles is a role-playing game which takes place on an immense game world on the remains of two giant titans.,"Monster Games Inc., Monolith Soft",Nintendo,"Action, Role-Playing",Teen
https://www.gamespot.com/games/game-of-thrones-a-telltale-games-series/,Game of Thrones: A Telltale Games Series,"Nov 17, 2015","Android, iOS (iPhone/iPad), Macintosh, PC, PlayStation 3, PlayStation 4, Xbox 360, Xbox One","Game of Thrones - A Telltale Games Series is targeted to premiere digitally in 2014 for home consoles, PC/Mac, and mobile devices.",Telltale Games,Telltale Games,Adventure,Mature
https://www.gamespot.com/games/borderlands-the-handsome-collection/,Borderlands: The Handsome Collection,"Mar 24, 2015","Nintendo Switch, PC, PlayStation 4, Xbox One","The Handsome Collection brings Borderlands 2 and The Pre-Sequel, along with all of their DLC, to PS4 and Xbox One.","2K Games, Iron Galaxy Studios",2K Games,Compilation,Mature
https://www.gamespot.com/games/bloodborne/,Bloodborne,"Mar 24, 2015",PlayStation 4,"Bloodborne is a new PS4 exclusive title from Software and Hidetaka Miyazaki, creators of the critically acclaimed Demon’s Souls and Dark Souls games.",From Software,"SCEA, SCEE, SCEI, Sony Interactive Entertainment, SCE Australia","Role-Playing, Action",Mature
https://www.gamespot.com/games/borderlands-the-pre-sequel/,Borderlands: The Pre-Sequel,"Oct 13, 2014","Android, Linux, Macintosh, PC, PlayStation 3, Xbox 360","Borderlands: The Pre-Sequel takes off into space and brings the action to Pandora's moon, telling the tale of Handsome Jack's rise to power.","Gearbox Software, Aspyr, 2K Australia","2K Games, Aspyr, Sony DADC Brasil, Take-Two Interactive","Action, First-Person, Shooter, 3D",Mature
https://www.gamespot.com/games/woolfe-the-redhood-diaries/,Woolfe - The Red Hood Diaries,"Mar 17, 2015",PC,"A twisted fable in a rich, fantasy setting of smoke-spewing factories and evil forests, Woolfe: The Red Hood Diaries is an action-platforming fairy tale of death, industrial greed and vengeance, coming to PC, PS4, and Xbox One in 2015.",GriN Multimedia,GriN Multimedia,"3D, Action, Adventure, Survival",
https://www.gamespot.com/games/frozen-cortex/,Frozen Cortex,"Mar 10, 2014","Linux, Macintosh, PC","Frozen Cortex is a simultaneous turn-based strategy game from Mode 7, the creators of Frozen Synapse.",Mode 7 Games,Mode 7 Games,Sports,
https://www.gamespot.com/games/robot-roller-derby-disco-dodgeball/,Robot Roller-Derby Disco Dodgeball,"Mar 28, 2014","Linux, Macintosh, PC",Disco Dodgeball is a first-person sports shooter set in a dance club.,Erik Asmussen,82 Apps,Sports,
https://www.gamespot.com/games/bladestorm-the-hundred-years-war/,Bladestorm: The Hundred Years' War,"Nov 6, 2007","PC, PlayStation 3, PlayStation 4, Xbox 360, Xbox One",Bladestorm: The Hundred Years' War is set in medieval Europe and features vast teeming battlelfields in the tradition of Dynasty Warriors.,"Omega Force, Koei Tecmo Games","Koei Tecmo Games, Koei","Beat-'Em-Up, 3D, Action",Teen
https://www.gamespot.com/games/final-fantasy-type-0/,Final Fantasy Type-0,"Mar 17, 2015","PC, PlayStation 4, PSP, Xbox One",Final Fantasy Type-0 lets players switch at will between fourteen characters with unique weapons and abilities.,"Square Enix, HexaDrive",Square Enix,"Action, Role-Playing",Mature
https://www.gamespot.com/games/la-cops/,LA Cops,"Jul 30, 2014","Macintosh, PC, PlayStation 4, Xbox One",,Modern Dream,"LA Cops Ltd, Team 17","2D, Action, Fixed-Screen, Shooter",Mature
https://www.gamespot.com/games/resident-evil-revelations-2/,Resident Evil: Revelations 2,"Mar 17, 2015","Nintendo Switch, PC, PlayStation 3, PlayStation 4, PlayStation Vita, Xbox 360, Xbox One","Resident Evil Revelations 2 brings the terror to a new setting for PlayStation 4, PlayStation 3, Xbox 360, Xbox One, and PC.","Capcom, Frima Studio","Capcom, SCEA, SCEE","3D, Action, Adventure, Survival",Mature
https://www.gamespot.com/games/battlefield-hardline/,Battlefield Hardline,"Mar 17, 2015","PC, PlayStation 3, PlayStation 4, Xbox 360, Xbox One",A brand new series in the Battlefield franchise focused on the war on crime and the battle between cops and criminals.,Visceral Games,Electronic Arts,"Shooter, Tactical, Action, First-Person",Mature
https://www.gamespot.com/games/tales-from-the-borderlands-a-telltale-game-series/,Tales from the Borderlands: A Telltale Game Series,"Oct 20, 2015","Android, iOS (iPhone/iPad), Macintosh, Nintendo Switch, PC, PlayStation 3, PlayStation 4, PlayStation 5, Xbox 360, Xbox One, Xbox Series X",Tales from the Borderlands will explore and expand on the stories of existing and all-new characters from the world of Pandora.,Telltale Games,"Telltale Games, Take-Two Interactive, 2K Games",Adventure,Mature
https://www.gamespot.com/games/mario-party-10/,Mario Party 10,"Mar 20, 2015",Wii U,"Bowser crashes the latest Mario Party, the first installment of the
series on the Wii U console. In the new Bowser Party mini games, play as Bowser himself and face off against up to four others playing as Mario and friends. Control Bowser using the buttons, motion controls and touch screen of the Wii U GamePad controller in different ways, and wreak havoc as Bowser in each mini-game while the other players strive to survive.",Nd Cube,Nintendo,Party/Minigame,Everyone
https://www.gamespot.com/games/white-night/,White Night,"Mar 3, 2015","iOS (iPhone/iPad), Linux, Macintosh, Nintendo Switch, PC, PlayStation 4, Xbox One","White Night is an original, narrative-driven survival horror game from OSome Studio.","Playdigious, OSome Studio","Playdigious, Activision, Tesura Games, Plug In Digital","Action, Adventure, Survival, 3D",Mature
https://www.gamespot.com/games/trash-tv/,Trash TV,"Jun 6, 2012",PC,"Cast away into a recycling center, you play an outdated tube television animated to life with a singular goal – find your remote control and become fully functional again.",Lawrence Russell,"Reverb Triple XP, Lawrence Russell","2D, Action, Platformer",
https://www.gamespot.com/games/world-of-van-helsing-deathtrap/,World of Van Helsing: Deathtrap,"Feb 4, 2015","Macintosh, PC, PlayStation 4, Xbox One","Deathtrap is a unique mixture of action-RPGs and Tower Defense games, a game of vicious tricks, killing machines, rotating blades and splattering blood.",NeocoreGames,NeocoreGames,Strategy,Teen
https://www.gamespot.com/games/code-name-steam/,Code Name: S.T.E.A.M.,"Mar 13, 2015",3DS,Code Name: S.T.E.A.M is a turn-based strategy game from a third-person shooter point of view.,Intelligent Systems,Nintendo,"Strategy, Turn-Based",Teen
https://www.gamespot.com/games/shelter-2/,Shelter 2,"Mar 9, 2015","Linux, Macintosh, Nintendo Switch, PC",Shelter 2 is a spiritual sequel to their artistic adventure game Shelter where players are put in the role of a lone lynx mother in a vast open world.,Might and Delight,Might and Delight,Simulation,
https://www.gamespot.com/games/hotline-miami-2-wrong-number/,Hotline Miami 2: Wrong Number,"Mar 10, 2015","Android, Linux, Macintosh, PC, PlayStation 3, PlayStation 4, PlayStation Vita, Stadia","A brutal conclusion to the gruesome saga, Hotline Miami 2: Wrong Number follows the escalating level of violence through multiple factions born from the events of the original game and driven by uncertain motivations.","Devolver Digital, Dennaton","Devolver Digital, SCEI","Action, Adventure",Mature
https://www.gamespot.com/games/resident-evil-revelations-2/,Resident Evil: Revelations 2,"Mar 17, 2015","Nintendo Switch, PC, PlayStation 3, PlayStation 4, PlayStation Vita, Xbox 360, Xbox One","Resident Evil Revelations 2 brings the terror to a new setting for PlayStation 4, PlayStation 3, Xbox 360, Xbox One, and PC.","Capcom, Frima Studio","Capcom, SCEE, SCEA","Action, Adventure, Survival, 3D",Mature
https://www.gamespot.com/games/homeworld-remastered-collection/,Homeworld Remastered Collection,"Feb 25, 2015","Macintosh, PC",Homeworld Remastered Collection is an ultra high-definition remastering of the acclaimed strategy series.,"Aspyr, Gearbox Software","Aspyr, Gearbox Publishing",Compilation,Everyone 10+
https://www.gamespot.com/games/ori-and-the-blind-forest/,Ori and the Blind Forest,"Mar 11, 2015","Nintendo Switch, PC, Xbox One","Ori and the Blind Forest is a bit of a genremix of strong platforming and light RPG elements, all set within an atmospheric world.",Mon Studios,"Xbox Game Studios, iam8bit, Fangamer, Microsoft Game Studios","Platformer, Action, Metroidvania",Everyone
https://www.gamespot.com/games/there-came-an-echo/,There Came an Echo,"Feb 24, 2015","PC, PlayStation 4, Xbox One","Developed for release on the Steam, Xbox One, and PS4 platforms. The player can use an innovative voice control system to direct their units around the battlefield to ensure a tactical advantage over the enemy. The game features a AAA voice cast, led by Star Trek regular Wil Wheaton and internet sensation Ashly Burch.",Iridium Studios,Iridium Studios,"Strategy, Real-Time",Teen
https://www.gamespot.com/games/dragon-ball-xenoverse/,Dragon Ball: Xenoverse,"Feb 24, 2015","PC, PlayStation 3, PlayStation 4, Xbox 360, Xbox One","Developed by famed Osaka-based Japanese videogame developer Dimps (the team behind the fan favorite Dragon Ball Z: Budokai series); Dragon Ball XENOVERSE will be the first Dragon Ball game to make its way to the new generation of consoles with all the epic battles fans have come to expect between Goku and his most feared enemies; Vegeta, Frieza, Cell and many others, with brand new gameplay design.  Dragon Ball XENOVERSE will take the beloved universe from series’ creator Akira Toriyama by storm and break tradition with a new world setup, a mysterious city, a mysterious fighter and other amazing features to be announced in the future.","Dimps Corporation, Bandai Namco Games",Bandai Namco Games,"3D, Action, Fighting",Teen
https://www.gamespot.com/games/helldivers/,Helldivers,"Mar 3, 2015","PC, PlayStation 3, PlayStation 4, PlayStation Vita","Helldivers is a top-down squad shooter set in a dystopian future where you fight to protect Super Earth, where a managed democracy has blurred the lines between military and government rule.",Arrowhead Game Studios,"PlayStation Mobile Inc., SCEI, SCEA, SCE Australia, SCEE, Sony Interactive Entertainment","Action, Fixed-Screen, Shooter, 2D",Teen
https://www.gamespot.com/games/olliolli2/,OlliOlli2: Welcome to Olliwood,"Mar 3, 2015","Linux, Macintosh, PC, PlayStation 4, PlayStation Vita, Xbox One",OlliOlli2: Welcome to Olliwood plucks the iconic skater from the street and dropping him squarely in the middle of the Big Screen’s most bodacious cinematic locations.,roll7,"Devolver Digital, roll7, PQube, Team 17","Skateboarding/Skating, Sports",Teen
https://www.gamespot.com/games/dmc-devil-may-cry/,DmC: Devil May Cry,"Jan 15, 2013","PC, PlayStation 3, PlayStation 4, Xbox 360, Xbox One","DMC is the next installment in the gothic Devil May Cry series, featuring a short-coiffed, fully aggressive Dante.","QLOC, Ninja Theory",Capcom,"Adventure, Action",Mature
https://www.gamespot.com/games/lords-of-the-fallen/,Lords of the Fallen,"Oct 28, 2014","Android, iOS (iPhone/iPad), PC, PlayStation 4, Xbox One","Lords of the Fallen is a hardcore action-RPG featuring an advanced combat systems and robust class skill trees that will be coming out for PC, Xbox One, and PlayStation 4.","Deck 13, City Interactive, CI Games","CI Games, City Interactive, Bandai Namco Games, Ubisoft, Nina Freeman, Laura Knetzger, Stephen Lawrence Clark","Action, Role-Playing",Mature
https://www.gamespot.com/games/mario-vs-donkey-kong/,Mario vs. Donkey Kong: Tipping Stars,"Dec 31, 2015","3DS, Wii U",The Mario vs. Donkey Kong series makes its way to Wii U with the newest game in the charming puzzle series. This HD entry takes full advantage of the touch screen on the GamePad controller and features a near-limitless puzzle-creation mode.,Nintendo Software Technology,Nintendo,"Action, Puzzle",Everyone
https://www.gamespot.com/games/qbert-rebooted/,Q*bert: Rebooted,"Jul 7, 2014","Android, iOS (iPhone/iPad), Linux, Macintosh, PC, PlayStation 3, PlayStation 4, PlayStation Vita, Xbox One","Q*bert Rebooted takes the arcade classic and catapults it into the 21st century 3D game play that takes full advantage of today’s technologies yet remains faithful to the original Q*bert. Featuring hexagonal blocks instead of squares, Q*bert Rebooted introduces new enemies, playable characters, power-ups, traps, gem collecting, multiple characters, downloadable content and new ways to play.","Sideline Amusements, LOOT Entertainment, GPC Games","Sideline Amusements, LOOT Entertainment, LOOT Interactive","Action, Arcade",Everyone 10+
https://www.gamespot.com/games/oreshika-tainted-bloodlines/,Oreshika: Tainted Bloodlines,"Mar 3, 2015",PlayStation Vita,Oreshika: Tainted Bloodlines is an RPG where you must lead an ancient Japanese clan in search of revenge against a fearsome demon.,Alfa System,"SCEI, SCEE, SCEA, SCE Australia",Role-Playing,Teen
https://www.gamespot.com/games/screamride/,ScreamRide,"Mar 3, 2015","Xbox 360, Xbox One","Screamride is a full-featured, physics-based coaster game where creativity and destruction are equally welcomed.",Frontier Developments,Microsoft Game Studios,Simulation,Everyone 10+
https://www.gamespot.com/games/resident-evil-revelations-2/,Resident Evil: Revelations 2,"Mar 17, 2015","Nintendo Switch, PC, PlayStation 3, PlayStation 4, PlayStation Vita, Xbox 360, Xbox One","Resident Evil Revelations 2 brings the terror to a new setting for PlayStation 4, PlayStation 3, Xbox 360, Xbox One, and PC.","Capcom, Frima Studio","Capcom, SCEA, SCEE","3D, Action, Adventure, Survival",Mature
https://www.gamespot.com/games/oblitus/,Oblitus,"Feb 27, 2015",PC,"Oblitus follows the tale of a small, spear-wielding creature named Parvus who seeks to discover their purpose and origin within an unfamiliar realm full of huge, ancient terrors.",Connor Ullmann,Adult Swim,"2D, Action, Platformer",
